rank,uri,artist_names,track_name,source,peak_rank,previous_rank,weeks_on_chart,streams
1,"spotify:track:3zSSCPpLZ5Oc8nelhhGjKz","AUR","Tu hai kahan","Sony Music Entertainment",1,1,4,"10226018"
2,"spotify:track:3xMHXmedL5Rvfxmiar9Ryv","Anirudh Ravichander, Arijit Singh, Shilpa Rao, Kumaar","Chaleya","T-Series",1,2,13,"8757990"
3,"spotify:track:5ZLkihi6DVsHwDL3B8ym1t","Shubh","One Love","SHUBH",3,4,12,"6382518"
4,"spotify:track:5PUXKVVVQ74C3gl5vKy9Li","Jasleen Royal, Arijit Singh, Harrykahanhai","Heeriye (feat. Arijit Singh)","Warner Music India",1,3,15,"6371649"
5,"spotify:track:0YQJoDL6f46J0n1rOVkpxJ","Karan Aujla, Ikky","Softly","WM Canada",4,7,12,"4345827"
6,"spotify:track:6FahmzZYKH0zb2f9hrVsvw","Anirudh Ravichander, Nikhita Gandhi","Ordinary Person (From ""Leo"")","Sony Music Entertainment India Pvt. Ltd.",5,5,3,"4053803"
7,"spotify:track:4eBvRhTJ2AcxCsbfTUjoRp","Shubh","Cheques","SHUBH",1,9,24,"4046516"
8,"spotify:track:23y8MwhdvbSalGitHeokpk","Anirudh Ravichander","Badass","Sony Music Entertainment India Pvt. Ltd.",4,6,6,"3973344"
9,"spotify:track:4UMIv5jd9gK98a39BQRD9X","Pritam, Arijit Singh, Amitabh Bhattacharya","Kesariya","Sony Music Entertainment India Pvt. Ltd.",1,12,69,"3429702"
10,"spotify:track:13ZISM2bmrMBCRlMzl669x","Anirudh Ravichander, Thalapathy Vijay, Asal Kolaar","Naa Ready","Sony Music Entertainment India Pvt. Ltd.",4,8,20,"3381229"
11,"spotify:track:0Jiaz0O4AqnJICa9PxHhaR","Darshan Raval","Mahiye Jinna Sohna","Warner Music India",2,10,20,"3325856"
12,"spotify:track:0645eBDehHcqfiF15hscQV","Vishal Mishra, Rashmeet Kaur","Janiye (from the Netflix Film ""Chor Nikal Ke Bhaga"")","Netflix Music",5,11,18,"3111933"
13,"spotify:track:1418IuVKQPTYqt7QNJ9RXN","King","Maan Meri Jaan","Warner Music India",1,25,56,"3027804"
14,"spotify:track:0xIuPDzJSnJywALez8dwKR","AP Dhillon","With You","Mass Appeal India",2,13,13,"3011864"
15,"spotify:track:04ChFQZCKl2yRcvc0VR7qN","Denny, Rahul Mishra, Kunaal Vermaa","Chale Jaana Phir (Humko Tere Bina)","For The Record Music",14,14,18,"3010181"
16,"spotify:track:7iekl4P95GuphG8x8a3cNT","Pritam, Arijit Singh, Jonita Gandhi, Ranveer Singh, Madan Mohan, Amitabh Bhattacharya","What Jhumka ? (From ""Rocky Aur Rani Kii Prem Kahaani"")","Saregama",6,15,17,"2998341"
17,"spotify:track:5Tkf5CbtVYHA1SiKo1NrJE","Sachin-Jigar, Arijit Singh, Amitabha Bhattacharya","Phir Aur Kya Chahiye (From ""Zara Hatke Zara Bachke"")","Saregama",1,18,24,"2859257"
18,"spotify:track:2FCXQHugkoHE1K3tiDu8pu","Alka Yagnik, Arijit Singh","Agar Tum Saath Ho (From ""Tamasha"")","T-Series",4,20,232,"2820140"
19,"spotify:track:5LSAafg2oH9YPgf3EG17iw","Aditya Gadhvi, Achint","Khalasi | Coke Studio Bharat","Universal Music India Pvt Ltd.",11,16,5,"2789941"
20,"spotify:track:6c4Po8zyQjB4cR5XgLhcGb","Prabh Singh, Jay Trak, Rooh Sandhu","9:45","Prabh Singh Official",9,24,18,"2766808"
21,"spotify:track:72vuBPMhwFNlSYpTSf6fVD","Diljit Dosanjh, Sia, Greg Kurstin","Hass Hass","Warner Music India",21,60,2,"2762058"
22,"spotify:track:73K33p4Vyz9koXGqmL5eFs","Sachet Tandon, Parampara Tandon, Kumaar, Sachet-Parampara","Malang Sajna","T-Series",4,23,42,"2608072"
23,"spotify:track:38h4tmH1AWBVuemWAy4R4y","Pritam, Arijit Singh, Shreya Ghoshal, Amitabh Bhattacharya","Tum Kya Mile (From ""Rocky Aur Rani Kii Prem Kahaani"")","Saregama",9,22,19,"2598599"
24,"spotify:track:5DgY6Ab0vpyUMKnY9ubFOF","Anirudh Ravichander, Super Subu","Hukum - Thalaivar Alappara","Sun Pictures",1,17,17,"2556822"
25,"spotify:track:7m4CgL81VVIHaaiSxyH922","Yo Yo Honey Singh","Desi Kalakaar","T-Series",13,21,7,"2424489"
26,"spotify:track:08Isz2ETWSBhvIl8UpKYsp","Shubh","No Love","SHUBH",2,33,87,"2410022"
27,"spotify:track:2Fv2injs4qAm8mJBGaxVKU","Arijit Singh, Mithoon","Tujhe Kitna Chahne Lage (From ""Kabir Singh"")","T-Series",2,26,232,"2399169"
28,"spotify:track:0UZLaEOSIc5kg0cc7eszqC","Vishal Mishra","Manjha","Desi Music Factory",27,27,76,"2372173"
29,"spotify:track:6oz1L5jcqZWYuId7nxvIan","Shubh","Still Rollin","SHUBH",4,29,25,"2357523"
30,"spotify:track:0rMeOAvbQZ2RTG4B6L1M4p","Darshan Raval","Asal Mein","Indie Music Label",21,28,128,"2351094"
31,"spotify:track:2yIW0esEphGtQgVV0w2SYU","King","Tu Jaana Na Piya","Warner Music India",31,70,2,"2321055"
32,"spotify:track:24MMjyA3NLqCsDJfsn51eg","Sharn, 40k, The Paul","Mi Amor","Desi Avenue",7,32,43,"2266980"
33,"spotify:track:3nKQrVVlwbAQSnFbgZWdN0","Avvy Sra, Karan Aujla, Jaani","White Brown Black","Universal Music India Pvt Ltd. – Distribution",33,37,47,"2251696"
34,"spotify:track:5G7pZ8G8NFvS1MQ9H4L7dC","Javed-Mohsin, Arijit Singh, Shreya Ghoshal, Kunaal Vermaa, Prashant Ingole","Pal","Sony Music Entertainment India Pvt. Ltd.",34,34,244,"2242678"
35,"spotify:track:5OxVOeYmIzelfupJtq1X6G","Anirudh Ravichander","Lokiverse 2.0","Sony Music Entertainment India Pvt. Ltd.",15,19,3,"2175968"
36,"spotify:track:6GZIAVSu0YXF7FYzyRl1MP","Sachin-Jigar, Varun Jain, Shadab Faridi, Altamash Faridi, Amitabh Bhattacharya","Tere Vaaste (From ""Zara Hatke Zara Bachke"")","Saregama",1,31,24,"2159990"
37,"spotify:track:4blqlsA1uf2d2I40E90EUC","Pritam, Arijit Singh, Shilpa Rao","Tere Hawaale (From ""Laal Singh Chaddha"")","T-Series",11,36,37,"2157529"
38,"spotify:track:0snQrp1VaY5Pj1YIHRJpRJ","Aditya A","Chaand Baaliyan","Sony Music Entertainment India Pvt. Ltd.",2,40,90,"2136962"
39,"spotify:track:1sZFDDmmBVkcHOpV6AB0Nx","Yo Yo Honey Singh, Rony Ajnali, Gill Machhrai","Kalaastar (From ""Honey 3.0"")","Zee Music Company",39,49,2,"2136092"
40,"spotify:track:2ZD4aIEepqZsdxPxLSuUhm","Pritam, Arijit Singh, Amitabh Bhattacharya, Nikhita Gandhi","Tere Pyaar Mein","T-Series",5,38,40,"2120649"
41,"spotify:track:5BKKKNwrebowaMoUdBaNby","King","Tu Aake Dekhle","Warner Music India",3,46,145,"2107236"
42,"spotify:track:2rOnSn2piaqLAlYjtfUBlY","Tanishk Bagchi, Jubin Nautiyal, Asees Kaur","Raataan Lambiyan (From ""Shershaah"")","Sony Music Entertainment India Pvt. Ltd.",1,42,119,"2085922"
43,"spotify:track:6ygiy70ujkNOYXM1tQuMNe","Karan Aujla, Ikky, Preston Pablo","Admirin' You (feat. Preston Pablo)","WM Canada",24,39,14,"2068057"
44,"spotify:track:7eQl3Yqv35ioqUfveKHitE","Pritam, Mohit Chauhan","Tum Se Hi","T-Series",27,43,190,"2055095"
45,"spotify:track:1y1rQTkWmrZdJmjwuK07GC","Vishal Mishra","Kaise Hua (From ""Kabir Singh"")","T-Series",5,41,230,"2048138"
46,"spotify:track:72zHuDxFQTjbL51qJQSA7j","Jasleen Royal, B Praak, Romy, Anvita Dutt","Ranjha (From ""Shershaah"")","Sony Music Entertainment India Pvt. Ltd.",1,50,118,"2028682"
47,"spotify:track:6aQIGqAo9PxRKjUkhYtR6R","Anirudh Ravichander, Priya Mali","Hayyoda (From ""Jawan"")","T-Series",14,30,11,"2012799"
48,"spotify:track:1smFN2CLqGROu0J0UyvDfL","Pritam, Arijit Singh","Shayad","Sony Music Entertainment India Pvt. Ltd.",1,45,199,"2001356"
49,"spotify:track:4VsP4Dm8gsibRxB5I2hEkw","Kaifi Khalil","Kahani Suno 2.0","1944121 Records DK",1,51,47,"1978989"
50,"spotify:track:0NuWRfZRWzn1oc9piFhK9n","MC SQUARE, Hiten","Laado","Sony Music Entertainment India Pvt. Ltd.",11,35,9,"1962904"
51,"spotify:track:6vPFDbyzSYWAL7r3Waa7BZ","Anirudh Ravichander","I'm Scared (From ""Leo"")","Sony Music Entertainment India Pvt. Ltd.",44,44,2,"1948174"
52,"spotify:track:6swVP5qDAjqlzbF2R3A4bC","Diljit Dosanjh, Intense, Sultaan","Lalkara","DILJIT DOSANJH",22,48,5,"1946543"
53,"spotify:track:4wIWWEhbdgKAxhR68eE0Ye","Arijit Singh, Chinmayi","Mast Magan (From ""2 States"")","T-Series",53,58,142,"1908367"
54,"spotify:track:7ouBSPZKQpm7zQz2leJXta","Arijit Singh","Tum Hi Ho (From ""Aashiqui 2"")","T-Series",44,53,145,"1896102"
55,"spotify:track:2PvaburAUlhNHxVhw5lvOq","Arijit Singh","Humdard (From ""Ek Villain"")","T-Series",28,61,173,"1887599"
56,"spotify:track:3HiobOOpSpMsi95WBKPBYk","Jeet Gannguli, Arijit Singh","Hamari Adhuri Kahani (Title Track)","Sony Music Entertainment India Pvt. Ltd.",56,57,104,"1868238"
57,"spotify:track:4VosVUajzm6nzGlSb6nP3L","Parmish Verma, Paradox","Check It Out","SDA Studios",19,47,17,"1779262"
58,"spotify:track:0ZcMt3GYvVkBjdomag59NP","Addy Nagar, Aniket Jain","Kaley Sheshe","Sony Music Entertainment India Pvt. Ltd.",54,54,5,"1761420"
59,"spotify:track:0tgVpDi06FyKpA1z0VMD4v","Ed Sheeran","Perfect","Atlantic Records UK",29,65,186,"1757705"
60,"spotify:track:6O1RAYwmOqkcoJQr7J9SFJ","Manan Bhardwaj, Arijit Singh","Oonchi Oonchi Deewarein","T-Series",52,52,4,"1750803"
61,"spotify:track:610keNiNVTIkYD0CqeSerg","Cheema Y, Gur Sidhu","California Love","Brown Town Music",27,77,24,"1747022"
62,"spotify:track:42TMa2hgBNjte4uV7jNCnQ","Shubh, Ikky","Baller","SHUBH",2,71,61,"1721669"
63,"spotify:track:6udC4b4jOSnHb9ItnXgKLR","Sachin-Jigar, Shreya Ghoshal, Tochi Raina","Saibo","Sony Music Entertainment India Pvt. Ltd.",31,74,158,"1721049"
64,"spotify:track:2IoZMG3RqiTmsy7Li3zGFg","Sachet Tandon, Parampara Tandon, Sachet-Parampara","Mere Sohneya (From ""Kabir Singh"")","T-Series",4,80,186,"1719530"
65,"spotify:track:3yHyiUDJdz02FZ6jfUbsmY","Arijit Singh, Shreyas Puranik, Siddharth - Garima","Satranga (From ""ANIMAL"")","T-Series",65,149,2,"1712667"
66,"spotify:track:6V4N3h4HYD1Ask9cUTxjjg","Taimour Baig, Raffey Anwar, AUR","Long time no see","Universal Music MENA",66,68,3,"1710478"
67,"spotify:track:0l6g8Z8mqGbGXFOjigYetD","Pritam, Arijit Singh","Hawayein","Sony Music Entertainment India Pvt. Ltd.",51,62,109,"1700019"
68,"spotify:track:4OcvkkpF3xmyCGGY5IBlgi","Akhil Sachdeva, Tulsi Kumar","Tera Ban Jaunga (From ""Kabir Singh"")","T-Series",4,55,217,"1689453"
69,"spotify:track:3ZGJhN4unVspOqpwGvUL2W","Diljit Dosanjh","Lemonade","DILJIT DOSANJH",26,87,67,"1677335"
70,"spotify:track:0czcoKJbJt08NqKrvSbbz7","Pritam, Arijit Singh, Amitabh Bhattacharya","O Bedardeya (From ""Tu Jhoothi Main Makkaar"")","T-Series",1,63,35,"1673368"
71,"spotify:track:6H7fLdt0AeWpuxUKXuXWrx","Hariharan","Shree Hanuman Chalisa","T-Series",39,72,65,"1665845"
72,"spotify:track:3dpM3ijJz0vGzbkh5DcMXz","Payal Dev, Vishal Mishra, A.M. Turaz","Naseeb Se (From ""Satyaprem Ki Katha"")","T-Series",44,69,23,"1664031"
73,"spotify:track:66v97IvccVkHt40FIOq1LH","Pritam, Arijit Singh, Nikhita Gandhi, Amitabh Bhattacharya","Leke Prabhu Ka Naam (From ""Tiger 3"")","YRF Music",67,67,2,"1657938"
74,"spotify:track:5W7DOVGQLTigu09afW7QMT","Sidhu Moose Wala","295","Sidhu Moose Wala",1,78,91,"1652952"
75,"spotify:track:2A4lcqTJZgUs1XrW6TSvt0","Rajat Nagpal, Yasser Desai, Rana Sotal","Hum Toh Deewane","PlayDMF",61,66,6,"1651088"
76,"spotify:track:2vkINQUuzVso4YeU3VG5yK","Gajendra Verma","Mann Mera","Sony Music / Eros Now Music",26,83,136,"1642719"
77,"spotify:track:5XeFesFbtLpXzIVDNQP22n","Arctic Monkeys","I Wanna Be Yours","Domino Recording Co",48,90,52,"1628265"
78,"spotify:track:1QZRCi2Z1DQQaR6bGAzhtN","Yo Yo Honey Singh","Love Dose","T-Series",32,56,10,"1627598"
79,"spotify:track:2KslE17cAJNHTsI2MI0jb2","Jung Kook","Standing Next to You","BIGHIT MUSIC",79,-1,1,"1626564"
80,"spotify:track:0FBQ4NrrHUbR9kus7rzrOj","Atif Aslam","Dil Diyan Gallan","YRF Music",78,81,195,"1625198"
81,"spotify:track:1kOkkEe8QdviYXBqDZpavh","Diljit Dosanjh, Intense","Case","DILJIT DOSANJH",44,86,5,"1624788"
82,"spotify:track:3wz2vWhYnnBoFmgMkqtzLy","Chani Nattan, Inderpal Moga","Daku","Kharku Life Records",5,89,64,"1617672"
83,"spotify:track:7MXVkk9YMctZqd1Srtv4MB","The Weeknd, Daft Punk","Starboy","Universal Republic Records",12,76,119,"1602949"
84,"spotify:track:32VAw8DL9ixX5XSW2VLcZ4","Parmish Verma, PARDHAAN, Desi Crew","Aam Jahe Munde","Parmish Verma Films",29,84,18,"1597566"
85,"spotify:track:0gPgdRfB4jdGrlyXS0Vx78","Vishal-Shekhar, KK, Shilpa Rao, Anvita Dutt Guptan","Khuda Jaane","YRF Music",37,104,57,"1595865"
86,"spotify:track:0CtZpaOhtzvLV3FfcsVpQo","Vishal-Shekhar, Shilpa Rao, Caralisa Monteiro, Vishal Dadlani, Shekhar Ravjiani, Kumaar","Besharam Rang (From ""Pathaan"")","YRF Music",4,79,48,"1591643"
87,"spotify:track:29m79w9xPMH4YCD6r8JSmV","AP Dhillon, Gurinder Gill, Intense","Excuses","RUN-UP RECORDS",1,59,107,"1576864"
88,"spotify:track:2HRgqmZQC0MC7GeNuDIXHN","Jung Kook, Latto","Seven (feat. Latto) (Explicit Ver.)","BIGHIT MUSIC",5,121,17,"1567658"
89,"spotify:track:1AMD2AkfGrKoKhwkvYLbza","Sunny Yaduvanshi, AK Rok, Nitesh Ujoli","Yadav Brand 2","Flame Music",9,82,35,"1557838"
90,"spotify:track:3mUkVsovIuscQlSoMhmAZt","Madhur Sharma, Swapnil Tare, Nusrat Fateh Ali Khan","Kali Kali Zulfon Ke (Lo-Fi)","T-Series",6,73,61,"1557307"
91,"spotify:track:4uK0M8AI6gyFmyzUneQpbi","A.R. Rahman, Arijit Singh, Shashaa Tirupati","Rait Zara Si (From ""Atrangi Re"")","T-Series",12,124,92,"1548367"
92,"spotify:track:6ZYxNjuAU9Vy3VtF6W1dtE","Shubh","We Rollin","SHUBH",10,95,102,"1544779"
93,"spotify:track:6mTvwBzWTGDOVeCNQEqtOE","Amaal Mallik, Arijit Singh, Tulsi Kumar","Soch Na Sake","T-Series",64,64,45,"1533098"
94,"spotify:track:5inzjqKe05zP1eInEO8O1i","Anirudh Ravichander, Vishal Dadlani, Shilpa Rao, Kumaar","Not Ramaiya Vastavaiya","T-Series",20,100,10,"1521430"
95,"spotify:track:1UWacd8x8tPPwmrPB1MoBI","Pritam, Arijit Singh","Ae Dil Hai Mushkil Title Track","Sony Music Entertainment India Pvt. Ltd.",79,98,197,"1520305"
96,"spotify:track:51DEaelXeJJ6cFFYbX8Hal","Javed-Mohsin, Vishal Mishra, Shreya Ghoshal","Zihaal e Miskin","Universal Music India Pvt Ltd.",7,93,24,"1519263"
97,"spotify:track:64r6z0P3RnhpTGdkA7p5Os","Darshan Raval","Ek Tarfa","Indie Music Label",33,109,90,"1515120"
98,"spotify:track:5bQ6oDLqvw8tywmnSmwEyL","Sachin-Jigar, Arijit Singh, Amitabh Bhattacharya","Apna Bana Le","Zee Music Company",1,176,20,"1506542"
99,"spotify:track:2vPrBucKCfKmafHhSfJ2pt","Pritam, Arijit Singh, Amitabh Bhattacharya, Charan","Pyaar Hota Kayi Baar Hai (From ""Tu Jhoothi Main Makkaar"")","T-Series",9,97,39,"1506295"
100,"spotify:track:3WLJ7D5kh44K5eJ1NqZQ6W","Anuv Jain","Baarishein","Universal Music India Pvt. Ltd. (on behalf of Anuv Jain)",18,125,130,"1505924"
101,"spotify:track:1Er6TEtbyuW1b9QtBVkggD","Karan Aujla, Ikky","Jee Ni Lagda","WM Canada",38,116,12,"1496464"
102,"spotify:track:6Z4rRhYZVQsYKmrxD40tru","Riar Saab, Abhijay Sharma","Obsessed","Mass Appeal India, LLC",2,99,27,"1489296"
103,"spotify:track:4bD9z9qa4qg9BhryvYWB7c","Pritam, Tochi Raina, Rekha Bhardwaj","Kabira","T-Series",31,101,217,"1488767"
104,"spotify:track:6fScgF2Y63ScU73nYju0ny","Atif Aslam, Arko","O Saathi","T-Series",58,108,67,"1484394"
105,"spotify:track:5O932cZmzOZGOGZz9RHx20","Pritam, Arijit Singh","Khairiyat","T-Series",1,92,218,"1483489"
106,"spotify:track:48Ix6ReYdJf2H4mKb3TIpj","Atif Aslam, Alisha Chinai, Pritam","Tera Hone Laga Hoon","Tips Industries Ltd",59,88,130,"1481182"
107,"spotify:track:5Gy67YHzPZTk9Q0D73LAGH","Jeet Gannguli, Arijit Singh","Khamoshiyan (From ""Khamoshiyan"")","Sony Music Entertainment India Pvt. Ltd.",107,110,28,"1474187"
108,"spotify:track:1dGr1c8CrMLDpV6mPbImSI","Taylor Swift","Lover","Taylor Swift",9,146,19,"1463826"
109,"spotify:track:1d5lpW3gUyq537iuyrb9Lf","Aditya Rikhari","Samjho Na","CollabX Productions",73,103,29,"1462830"
110,"spotify:track:0ojpEubhy4JNeVftmVuiN7","Vishal Mishra, Armaan Malik","Pehla Pyaar","T-Series",11,107,128,"1460611"
111,"spotify:track:3B9CL5t32mM2SDdps2IhYM","Saad Lamjarred, Shreya Ghoshal, Rajat Nagpal","Guli Mata","PlayDMF",36,106,14,"1446913"
112,"spotify:track:0rk2X5TAhraBC5aCIXK2Rq","Jawad Ahmad, Shaarib Toshi, Arijit Singh, Shreya Ghoshal","Samjhawan","Sony Music Entertainment India Pvt. Ltd.",70,132,132,"1446408"
113,"spotify:track:2AilvPt1AQ8PixlCKqkjfj","Shubh","Elevated","SHUBH",27,112,97,"1439109"
114,"spotify:track:2tjWCe2W7sgvS3C8NHcdtI","Akhil, Dhvani Bhanushali, Kunaal Vermaa","Duniyaa (From ""Luka Chuppi"")","T-Series",1,114,246,"1423639"
115,"spotify:track:7wW9scVNLYFLsmBb1yAUmS","Yo Yo Honey Singh","Blue Eyes","T-Series",38,96,7,"1416313"
116,"spotify:track:32765xcLM1fd6wQIpkN9A0","Ami Mishra, Kunaal Vermaa","Hasi - Male Version","Sony Music Entertainment India Pvt. Ltd.",98,111,19,"1415503"
117,"spotify:track:4IlemV6RBqoeleMsPiT9t4","M.I.A.","Time Traveller","M.I.A./Island",117,163,2,"1414327"
118,"spotify:track:1cPDOeVdALLjj4erFPiuqW","Anirudh Ravichander, Shilpa Rao, Arunraja Kamaraj","Kaavaalaa","Sun Pictures",10,75,18,"1402943"
119,"spotify:track:2eAvDnpXP5W0cVtiI0PUxV","Ruth B.","Dandelions","Columbia",14,122,102,"1366171"
120,"spotify:track:6FjbAnaPRPwiP3sciEYctO","Pritam, Arijit Singh","Raabta","T-Series",41,135,76,"1365495"
121,"spotify:track:2qgXrzJsry4KgYoJCpuaul","The Local Train","Choo Lo","The Local Train",81,118,20,"1364603"
122,"spotify:track:1ZMq0qzXfGnFo7BN03yddJ","Arjun Kanungo, King","Ilzaam (From the Album 'Industry')","One Mind Music",85,129,31,"1363989"
123,"spotify:track:5Y7Y315vZkOZbesJ22jXkK","Govind Vasantha, Pradeep Kumar, Shakthisree Gopalan","Railin Oligal - From ""Blue Star""","Think Music",55,91,6,"1349154"
124,"spotify:track:28lvraTNIN8qiTpoIK7m8Z","AP Dhillon, Shinda Kahlon","True Stories","Mass Appeal India",15,119,21,"1339622"
125,"spotify:track:03yKEFruN3BS2coglBtt2N","Laddi Chahal, Parmish Verma, Gurlez Akhtar","Rubicon Drill","Parmish Verma Films",12,140,47,"1337697"
126,"spotify:track:6FAYpZ4jve8vpvTwUvjK6H","Vishal-Shekhar, Arijit Singh, Sukriti Kakar, Vishal Dadlani, Shekhar Ravjiani, Kumaar","Jhoome Jo Pathaan","YRF Music",3,113,46,"1329195"
127,"spotify:track:6MZyrnqwsLnrWY5Gk0AyXg","Suzonn","Farq hai","Suzonn",60,102,9,"1326410"
128,"spotify:track:2qxmye6gAegTMjLKEBoR3d","Alec Benjamin","Let Me Down Slowly","2018",34,133,187,"1325721"
129,"spotify:track:1RdrAqXa2fUj2XytsKaUwl","Irshad Khan","Haryana Hood","Bajewala Records Haryanvi",40,123,29,"1322793"
130,"spotify:track:3yRLROmAcKJBqTrdEczFB8","Yo Yo Honey Singh","Brown Rang","Times Music",48,105,7,"1320234"
131,"spotify:track:5O2P9iiztwhomNh8xkR9lJ","One Direction","Night Changes","Syco Music",22,141,130,"1319418"
132,"spotify:track:6V7UVqe8XnAS4WPdpaw5TK","Asees Kaur, Stebin Ben","Tu Mile Dil Khile","Saregama",20,131,39,"1319095"
133,"spotify:track:3qrdLVOClRU4yPkcXZ7c5u","Ayushmann Khurrana, Tanishk-Vayu","Mere Liye Tum Kaafi Ho (From ""Shubh Mangal Zyada Saavdhan"")","T-Series",11,157,194,"1317414"
134,"spotify:track:3eSm4iAkLsn3BeggfiQOH9","Gaurav Chatterji, Aasa Singh, Hansika Pareek, Hrishi Giridhar, Pratik Gangavane","Kaise Ab Kahein - From ""Gutar Gu""","Sikhya Entertainment Records",87,136,14,"1316812"
135,"spotify:track:7lNbI1xd39QRdf6Mj8tvTv","Javed Ali","Saudebazi (Encore) [From ""Aakrosh""]","T-Series",109,138,11,"1312567"
136,"spotify:track:1aL9518P5G72N92b48tuKw","AP Dhillon","Summer High","RUN-UP RECORDS",3,139,66,"1309621"
137,"spotify:track:5aMLADD1Ho6Ogq8s8mIzB9","Sachet-Parampara, Sachet Tandon, Parampara Tandon","Ram Siya Ram (From ""Adipurush"")","T-Series",11,153,23,"1303000"
138,"spotify:track:3jyqXdAjwqO3gFtjnYrbq9","Darshan Raval, Rochak Kohli","Ek Ladki Ko Dekha Toh Aisa Laga (From ""Ek Ladki Ko Dekha Toh Aisa Laga"")","Saregama",59,145,51,"1300859"
139,"spotify:track:4U4vgPosXiDSjR0gHQmvN2","Anirudh Ravichander, Lothika","Anbenum","Sony Music Entertainment India Pvt. Ltd.",54,85,4,"1299317"
140,"spotify:track:6bdpj89aYEBjhpsenXAsmO","A.R. Rahman, Arijit Singh","Enna Sona","Sony Music Entertainment India Pvt. Ltd.",34,142,131,"1298406"
141,"spotify:track:6chviF7naWfxVOF91dkdqb","Vidyasagar, Krishnachandar, Sujatha","Thamarai Poovukum","Magnasound",128,128,2,"1298074"
142,"spotify:track:6cUOiOY5qh2FpIQWIYAd2h","Pritam, Darshan Raval, Antara Mitra","Mehrama","Sony Music Entertainment India Pvt. Ltd.",10,127,154,"1293696"
143,"spotify:track:43YkTTlOD203o9E5ZxhUjF","Arijit Singh","Main Dhoondne Ko Zamaane Mein (From ""Heartless"")","T-Series",62,166,109,"1290563"
144,"spotify:track:2RgvvnMwtP0R2OkVZmFvnV","KK","Ajab Si (From ""Om Shanti Om"")","T-Series",34,144,96,"1288462"
145,"spotify:track:6vNolBIVWvfY3Z20gAG5nI","Payal Dev, Jubin Nautiyal, Kunaal Vermaa","Tum Hi Aana (Sad Version) [From ""Marjaavaan""]","T-Series",56,120,26,"1276279"
146,"spotify:track:5WXQbgwGwyauXOqswlEeQY","Tanishk Bagchi, Arijit Singh, Asees Kaur","Bolna (From ""Kapoor & Sons (Since 1921)"")","Sony Music Entertainment India Pvt. Ltd.",101,175,37,"1273707"
147,"spotify:track:5cF0dROlMOK5uNZtivgu50","Charlie Puth","Attention","Artist Partner",110,-1,123,"1272046"
148,"spotify:track:56y1jOTK0XSvJzVv9vHQBK","Doja Cat","Paint The Town Red","Kemosabe Records/RCA Records",45,115,10,"1271153"
149,"spotify:track:3wwLWFRLiReDf5AqgmAJwT","Rito Riba, Rajat Nagpal, Rana Sotal","Heer Ranjha","PlayDMF",11,148,54,"1262617"
150,"spotify:track:1YMLgvsQdE27r30q0fsLeV","Arijit Singh","Tera Fitoor","Tips Industries Ltd",87,158,19,"1257343"
151,"spotify:track:2GXXZFUxYg2LvG8SR0byOE","Atif Aslam","Jeena Jeena","Eros Now Music",37,198,120,"1254769"
152,"spotify:track:3JkVYvxNoGf2HCWJo61462","Sidhu Moose Wala, Sunny Malton, SOE","Never Fold","Sidhu Moose Wala",13,155,81,"1253285"
153,"spotify:track:54PRUdMOYzglMGnsg9kIta","Raghav Chaitanya, Manoj Muntashir, Pritam","Hua Main (From ""ANIMAL"")","T-Series",110,130,4,"1249068"
154,"spotify:track:53QrRlALFJfZgdcGLKwy5s","Shubh","Dior","SHUBH",76,170,18,"1243561"
155,"spotify:track:2n9ylYiF7urpXo36qBwr3g","Stebin Ben","Mera Dil Bhi Kitna Pagal Hai - Recreated Version","Ishtar Music Pvt. Ltd.",70,150,28,"1222637"
156,"spotify:track:1BxfuPKGuaTgP7aM0Bbdwr","Taylor Swift","Cruel Summer","Taylor Swift",54,178,19,"1216652"
157,"spotify:track:2e7CeqSe18O2LPnuRaHpdX","King","Sarkaare","Warner Music India",72,169,6,"1214094"
158,"spotify:track:5mjYQaktjmjcMKcUIcqz4s","Kenya Grace","Strangers","Warner Records/Major Recordings",75,152,6,"1212357"
159,"spotify:track:1feANd8EfcDP5UqSvbheM3","Sachet Tandon, Sachet-Parampara","Bekhayali (From ""Kabir Singh"")","T-Series",1,159,200,"1211121"
160,"spotify:track:3FbZoPzEaUBOD84l1FwFEH","Darshan Raval","Mujhe Peene Do","Indie Music Label",56,180,26,"1207942"
161,"spotify:track:4SqPZorSDuUtvdJwVGeZRC","Pritam, Arijit Singh, Amitabh Bhattacharya, Jonita Gandhi","Deva Deva","Sony Music Entertainment India Pvt. Ltd.",5,183,66,"1199767"
162,"spotify:track:5qolX8ncpZ8R6TfKbvTzbA","Talha Anjum, Umair","Downers At Dusk","Young Stunners",73,137,15,"1198669"
163,"spotify:track:7mSzDKajY2wUtstQSLdzMK","Mohit Chauhan, Rochak Kohli","Rang Lageya","Saregama",35,161,41,"1197298"
164,"spotify:track:7v0t3o17J796y9OG2n3ebl","B Praak, Jaani","Kya Loge Tum","Universal Music India Pvt Ltd. – Distribution",10,156,25,"1193591"
165,"spotify:track:03hJuEQpEQERrHpjcXKWzJ","Mithoon, Arijit Singh, Manoj Muntashir","Tumhe Kitna Pyaar Karte (From ""Bawaal"")","T-Series",20,147,18,"1188403"
166,"spotify:track:0H2iJVgorRR0ZFgRqGUjUM","Pritam, Arijit Singh","Channa Mereya","Sony Music Entertainment India Pvt. Ltd.",58,165,198,"1176259"
167,"spotify:track:6gwnKOvdBKkTU4CQ7KpIAu","Shaarib Toshi, Arijit Singh","Bandeya - From ""Dil Juunglee""","Pooja Music",70,184,60,"1175630"
168,"spotify:track:7qiZfU4dY1lWllzX7mPBI3","Ed Sheeran","Shape of You","Atlantic Records UK",63,174,183,"1166867"
169,"spotify:track:7Imk0IG6S5GA5iYWkjmMW5","Palak Muchhal, Arijit Singh","Chahun Main Ya Naa (From ""Aashiqui 2"")","T-Series",169,177,5,"1164827"
170,"spotify:track:0tpwqQhdfJXRcUDSNRjb9O","Arijit Singh, Neeti Mohan, Rashmi Virag","Mere Yaaraa (From ""Sooryavanshi"")","T-Series",20,168,78,"1164202"
171,"spotify:track:501r9pxOB0z1ksbhC4hNxs","Saabi Bhinder, CHEETAH","Desi Hood","Sabi bhinder",134,134,3,"1158692"
172,"spotify:track:567e29TDzLwZwfDuEpGTwo","The Kid LAROI, Justin Bieber","STAY (with Justin Bieber)","Columbia",1,160,122,"1154227"
173,"spotify:track:2IEhtVeM9TVql8fZdKdlo9","Atif Aslam, Chinmayi, Pritam","Main Rang Sharbaton Ka","Tips Industries Ltd",126,126,15,"1153319"
174,"spotify:track:3f0wz6zcA7XkQiGm0qNF5r","Arijit Singh, Tanishk Bagchi","Thodi Jagah (From ""Marjaavaan"")","T-Series",15,199,54,"1151809"
175,"spotify:track:4fyR24BKznXBLNkK8LwWla","Yo Yo Honey Singh","Dheere Dheere","T-Series",93,167,6,"1146269"
176,"spotify:track:0s76ExpXyMGVBlKLUr683e","Aditya Rikhari","Faasle","CollabX Productions",123,151,24,"1140706"
177,"spotify:track:57jOEZtoLQK4zF2x55bdkp","Rochak Kohli, Arijit Singh, Neha Kakkar","Tu Hi Yaar Mera (From ""Pati Patni Aur Woh"")","T-Series",8,200,187,"1140145"
178,"spotify:track:3bQsp4Vr9Rg4fNCx6HPOgX","Anuv Jain","Alag Aasmaan","Universal Music India Pvt. Ltd. (on behalf of Anuv Jain)",162,-1,8,"1139948"
179,"spotify:track:4O8qbPh4fvzoEcDGCnLHT7","Deva, Unni Menon, Anuradha Sriram","Karu Karu Karupayi","Bayshore Records",80,94,3,"1134526"
180,"spotify:track:4iEGv5Ne6HuCkFCjzxdWQK","Neeti Mohan","Meri Jaan","Saregama",11,179,55,"1133825"
181,"spotify:track:2y0hUGvHaKm2p5xmJF4HBe","Arijit Singh","Saware (From ""Phantom"")","T-Series",82,189,38,"1132680"
182,"spotify:track:01qFKNWq73UfEslI0GvumE","Jung Kook, Jack Harlow","3D (feat. Jack Harlow)","BIGHIT MUSIC",52,-1,5,"1130114"
183,"spotify:track:6EB454nVg2u6sbeCvWAPej","Sam C.S., Anirudh Ravichander, Shakthisree Gopalan","Yaanji - From ""Vikram Vedha""","Think Music",122,164,26,"1129169"
184,"spotify:track:18YHbIhrleUkKKj2DvEp79","Pritam, KK","Zara Sa","Sony Music Entertainment India Pvt. Ltd.",33,172,42,"1115114"
185,"spotify:track:4Tkb7zsDmsawB7S5TpKQV1","Atif Aslam, Shiraz Uppal","Pehli Dafa","T-Series",159,-1,7,"1111870"
186,"spotify:track:7lvDsmTRXFE3dK4OjvRiWB","Shae Gill, Ali Sethi","Pasoori","Giraffe Pakistan",1,192,90,"1107366"
187,"spotify:track:0DXfJ2iKRDEG7rPgssWFea","Kanishk Seth, Kavita Seth","Rangisari (From ""Jugjugg Jeeyo"")","T-Series",22,194,53,"1104940"
188,"spotify:track:0biCSADTAblvLTLtJz4pXO","Vishal-Shekhar, Arijit Singh, Caralisa Monteiro, Jaideep Sahni","Nashe Si Chadh Gayi","YRF Music",164,191,14,"1104837"
189,"spotify:track:3sqRODOZ1Z6hR4F2tnFAlg","Maninder Buttar","Sakhiyaan","White Hill Music",20,187,212,"1104344"
190,"spotify:track:0aXnTU90v6G1QVlimy0Kw8","M.H.R, JOKER390P, SA, Dabzee","Malabari Banger","Devil Inside",72,143,7,"1101709"
191,"spotify:track:3GEiVoaUXq468gfYs2EPfh","DIVINE, Sidhu Moose Wala","Chorni","DIVINE",8,186,18,"1100866"
192,"spotify:track:2NmBCDkjvJVvEZkH5QDOeb","Varinder Brar, Rav Dhaliwal, Ultra Beats","Thaa","Varinder Brar Music",10,196,31,"1087242"
