rank,uri,artist_names,track_name,source,peak_rank,previous_rank,weeks_on_chart,streams
1,"spotify:track:7yDHHVKLbvDmVw1XXhDDIO","Vishal Mishra, Raj Shekhar","Pehle Bhi Main","T-Series",1,1,4,"12177492"
2,"spotify:track:3yHyiUDJdz02FZ6jfUbsmY","Arijit Singh, Shreyas Puranik, Siddharth - Garima","Satranga (From ""ANIMAL"")","T-Series",2,2,9,"9473444"
3,"spotify:track:3zSSCPpLZ5Oc8nelhhGjKz","AUR","Tu hai kahan","Sony Music Entertainment",1,4,11,"7394173"
4,"spotify:track:4ApCig0GTR4IEp7Ijsyo3r","Manan Bhardwaj, Bhupinder Babbal","Arjan Vailly","T-Series",1,3,6,"7283596"
5,"spotify:track:0TL0LFcwIBF5eX7arDIKxY","Anuv Jain","Husn","Universal Music India Pvt. Ltd. (on behalf of Anuv Jain)",5,10,4,"7027041"
6,"spotify:track:3xMHXmedL5Rvfxmiar9Ryv","Anirudh Ravichander, Arijit Singh, Shilpa Rao, Kumaar","Chaleya","T-Series",1,6,20,"6182154"
7,"spotify:track:0YxKKO272sacGBJKjf6FnB","Jaani, B Praak","Saari Duniya Jalaa Denge","T-Series",3,5,5,"5611903"
8,"spotify:track:5ZLkihi6DVsHwDL3B8ym1t","Shubh","One Love","SHUBH",3,8,19,"5082456"
9,"spotify:track:54PRUdMOYzglMGnsg9kIta","Raghav Chaitanya, Manoj Muntashir, Pritam","Hua Main (From ""ANIMAL"")","T-Series",6,7,11,"4846226"
10,"spotify:track:5PUXKVVVQ74C3gl5vKy9Li","Jasleen Royal, Arijit Singh, Harrykahanhai","Heeriye (feat. Arijit Singh)","Warner Music India",1,11,22,"4435892"
11,"spotify:track:35FFqjqaPv1Fr9B1GtJdZO","Harshavardhan Rameshwar, Choir","Abrar’s Entry | Jamal Kudu (From ""ANIMAL"")","T-Series",8,9,3,"4433330"
12,"spotify:track:6bmmHeCvZI92pRiTHxEdTC","Pritam, Arijit Singh, Irshad Kamil","O Maahi","T-Series",12,32,2,"3839664"
13,"spotify:track:0YQJoDL6f46J0n1rOVkpxJ","Karan Aujla, Ikky","Softly","WM Canada",4,16,19,"3156092"
14,"spotify:track:72vuBPMhwFNlSYpTSf6fVD","Diljit Dosanjh, Sia, Greg Kurstin","Hass Hass","Warner Music India",5,12,9,"3099215"
15,"spotify:track:0Jiaz0O4AqnJICa9PxHhaR","Darshan Raval","Mahiye Jinna Sohna","Warner Music India",2,17,27,"3096984"
16,"spotify:track:4eBvRhTJ2AcxCsbfTUjoRp","Shubh","Cheques","SHUBH",1,14,31,"3069897"
17,"spotify:track:1hA697u7e1jX2XM8sWA6Uy","Sachin-Jigar, Arijit Singh, Amitabh Bhattacharya","Apna Bana Le","Zee Music Company",1,15,27,"3044800"
18,"spotify:track:6c4Po8zyQjB4cR5XgLhcGb","Prabh Singh, Jay Trak, Rooh Sandhu","9:45","Prabh Singh Official",9,20,25,"2986310"
19,"spotify:track:0645eBDehHcqfiF15hscQV","Vishal Mishra, Rashmeet Kaur","Janiye (from the Netflix Film ""Chor Nikal Ke Bhaga"")","Netflix Music",5,18,25,"2971837"
20,"spotify:track:4UMIv5jd9gK98a39BQRD9X","Pritam, Arijit Singh, Amitabh Bhattacharya","Kesariya","Sony Music Entertainment India Pvt. Ltd.",1,19,76,"2833902"
21,"spotify:track:1y1rQTkWmrZdJmjwuK07GC","Vishal Mishra","Kaise Hua (From ""Kabir Singh"")","T-Series",5,22,237,"2809086"
22,"spotify:track:4H1FLy4H7nS9wy9gg9JeFQ","Santhosh Narayanan, Dhvani Kailas, Vivek","Unakku Thaan - From ""Chithha""","Think Music",11,13,3,"2805479"
23,"spotify:track:26elzgFl8tvajnDfeoY1YF","Darshan Raval, Prakriti Kakar","Mannat","Warner Music India",23,26,3,"2651251"
24,"spotify:track:7iekl4P95GuphG8x8a3cNT","Pritam, Arijit Singh, Jonita Gandhi, Ranveer Singh, Madan Mohan, Amitabh Bhattacharya","What Jhumka ? (From ""Rocky Aur Rani Kii Prem Kahaani"")","Saregama",6,24,24,"2622583"
25,"spotify:track:38h4tmH1AWBVuemWAy4R4y","Pritam, Arijit Singh, Shreya Ghoshal, Amitabh Bhattacharya","Tum Kya Mile (From ""Rocky Aur Rani Kii Prem Kahaani"")","Saregama",9,25,26,"2592324"
26,"spotify:track:1418IuVKQPTYqt7QNJ9RXN","King","Maan Meri Jaan","Warner Music India",1,23,63,"2543521"
27,"spotify:track:5Tkf5CbtVYHA1SiKo1NrJE","Sachin-Jigar, Arijit Singh, Amitabha Bhattacharya","Phir Aur Kya Chahiye (From ""Zara Hatke Zara Bachke"")","Saregama",1,29,31,"2361809"
28,"spotify:track:73K33p4Vyz9koXGqmL5eFs","Sachet Tandon, Parampara Tandon, Kumaar, Sachet-Parampara","Malang Sajna","T-Series",4,30,49,"2328113"
29,"spotify:track:3F3ZuXYFXGM1V6pk3b3zmi","Diljit Dosanjh, thiarajxtt","Kinni Kinni","DILJIT DOSANJH",25,27,7,"2302023"
30,"spotify:track:4u0D2jZ20wQaEMHBSqsDnZ","King","Tu Jaana Na Piya","Warner Music India",15,21,9,"2279718"
31,"spotify:track:2FCXQHugkoHE1K3tiDu8pu","Alka Yagnik, Arijit Singh","Agar Tum Saath Ho (From ""Tamasha"")","T-Series",4,28,239,"2266342"
32,"spotify:track:2ZD4aIEepqZsdxPxLSuUhm","Pritam, Arijit Singh, Amitabh Bhattacharya, Nikhita Gandhi","Tere Pyaar Mein","T-Series",5,35,47,"2214649"
33,"spotify:track:2pIoyDWZV5OSW0xd6n41xV","Pritam, Arijit Singh, Swanand Kirkire, IP Singh","Lutt Putt Gaya","T-Series",33,77,5,"2199789"
34,"spotify:track:4VsP4Dm8gsibRxB5I2hEkw","Kaifi Khalil","Kahani Suno 2.0","1944121 Records DK",1,31,54,"2189818"
35,"spotify:track:0UZLaEOSIc5kg0cc7eszqC","Vishal Mishra","Manjha","Desi Music Factory",27,34,83,"2162933"
36,"spotify:track:3WLJ7D5kh44K5eJ1NqZQ6W","Anuv Jain","Baarishein","Universal Music India Pvt. Ltd. (on behalf of Anuv Jain)",18,54,137,"2073238"
37,"spotify:track:0xIuPDzJSnJywALez8dwKR","AP Dhillon","With You","Mass Appeal India",2,33,20,"2069666"
38,"spotify:track:6GZIAVSu0YXF7FYzyRl1MP","Sachin-Jigar, Varun Jain, Shadab Faridi, Altamash Faridi, Amitabh Bhattacharya","Tere Vaaste (From ""Zara Hatke Zara Bachke"")","Saregama",1,40,31,"2057157"
39,"spotify:track:3bQsp4Vr9Rg4fNCx6HPOgX","Anuv Jain","Alag Aasmaan","Universal Music India Pvt. Ltd. (on behalf of Anuv Jain)",39,57,15,"2032198"
40,"spotify:track:0rMeOAvbQZ2RTG4B6L1M4p","Darshan Raval","Asal Mein","Indie Music Label",21,43,135,"2015177"
41,"spotify:track:23y8MwhdvbSalGitHeokpk","Anirudh Ravichander","Badass","Sony Music Entertainment India Pvt. Ltd.",4,42,13,"1966169"
42,"spotify:track:4blqlsA1uf2d2I40E90EUC","Pritam, Arijit Singh, Shilpa Rao","Tere Hawaale (From ""Laal Singh Chaddha"")","T-Series",11,37,44,"1964958"
43,"spotify:track:6oz1L5jcqZWYuId7nxvIan","Shubh","Still Rollin","SHUBH",4,41,32,"1964199"
44,"spotify:track:2q9lPN7CT92W1Ry77j2acn","Pritam, Arijit Singh, Shreya Ghoshal, Shadab Faridi, Altamash Faridi, Amitabh Bhattacharya","Ve Kamleya (From ""Rocky Aur Rani Kii Prem Kahaani"")","Saregama",32,46,20,"1913600"
45,"spotify:track:3nKQrVVlwbAQSnFbgZWdN0","Avvy Sra, Karan Aujla, Jaani","White Brown Black","Universal Music India Pvt Ltd. – Distribution",29,47,54,"1907641"
46,"spotify:track:3dpM3ijJz0vGzbkh5DcMXz","Payal Dev, Vishal Mishra, A.M. Turaz","Naseeb Se (From ""Satyaprem Ki Katha"")","T-Series",44,44,30,"1874426"
47,"spotify:track:4wIWWEhbdgKAxhR68eE0Ye","Arijit Singh, Chinmayi","Mast Magan (From ""2 States"")","T-Series",45,45,149,"1859279"
48,"spotify:track:0snQrp1VaY5Pj1YIHRJpRJ","Aditya A","Chaand Baaliyan","Sony Music Entertainment India Pvt. Ltd.",2,39,97,"1813093"
49,"spotify:track:13ZISM2bmrMBCRlMzl669x","Anirudh Ravichander, Thalapathy Vijay, Asal Kolaar","Naa Ready","Sony Music Entertainment India Pvt. Ltd.",4,71,27,"1800684"
50,"spotify:track:2PvaburAUlhNHxVhw5lvOq","Arijit Singh","Humdard (From ""Ek Villain"")","T-Series",28,66,180,"1798696"
51,"spotify:track:3yV2c3cYhkAwSsxAq6nRiv","Gajendra Verma","Mann Mera","Sony Music / Eros Now Music",26,60,143,"1790206"
52,"spotify:track:2Fv2injs4qAm8mJBGaxVKU","Arijit Singh, Mithoon","Tujhe Kitna Chahne Lage (From ""Kabir Singh"")","T-Series",2,38,239,"1779682"
53,"spotify:track:610keNiNVTIkYD0CqeSerg","Cheema Y, Gur Sidhu","California Love","Brown Town Music",27,48,31,"1772036"
54,"spotify:track:08Isz2ETWSBhvIl8UpKYsp","Shubh","No Love","SHUBH",2,51,94,"1749075"
55,"spotify:track:1smFN2CLqGROu0J0UyvDfL","Pritam, Arijit Singh","Shayad","Sony Music Entertainment India Pvt. Ltd.",1,61,206,"1742027"
56,"spotify:track:2rOnSn2piaqLAlYjtfUBlY","Tanishk Bagchi, Jubin Nautiyal, Asees Kaur","Raataan Lambiyan (From ""Shershaah"")","Sony Music Entertainment India Pvt. Ltd.",1,55,126,"1740000"
57,"spotify:track:5BKKKNwrebowaMoUdBaNby","King","Tu Aake Dekhle","Warner Music India",3,49,152,"1724624"
58,"spotify:track:5XeFesFbtLpXzIVDNQP22n","Arctic Monkeys","I Wanna Be Yours","Domino Recording Co",48,53,59,"1718995"
59,"spotify:track:51DEaelXeJJ6cFFYbX8Hal","Javed-Mohsin, Vishal Mishra, Shreya Ghoshal","Zihaal e Miskin","Universal Music India Pvt Ltd.",7,58,31,"1718399"
60,"spotify:track:5DgY6Ab0vpyUMKnY9ubFOF","Anirudh Ravichander, Super Subu","Hukum - Thalaivar Alappara","Sun Pictures",1,68,24,"1717669"
61,"spotify:track:5G7pZ8G8NFvS1MQ9H4L7dC","Javed-Mohsin, Arijit Singh, Shreya Ghoshal, Kunaal Vermaa, Prashant Ingole","Pal","Sony Music Entertainment India Pvt. Ltd.",34,59,251,"1714837"
62,"spotify:track:2oenSXLDbWVaaL7QjSGYj5","Diljit Dosanjh, Intense, Sultaan","Lalkara","DILJIT DOSANJH",22,63,12,"1707484"
63,"spotify:track:24MMjyA3NLqCsDJfsn51eg","Sharn, 40k, The Paul","Mi Amor","Desi Avenue",7,52,50,"1706627"
64,"spotify:track:6ygiy70ujkNOYXM1tQuMNe","Karan Aujla, Ikky, Preston Pablo","Admirin' You (feat. Preston Pablo)","WM Canada",24,76,21,"1701738"
65,"spotify:track:3HiobOOpSpMsi95WBKPBYk","Jeet Gannguli, Arijit Singh","Hamari Adhuri Kahani (Title Track)","Sony Music Entertainment India Pvt. Ltd.",56,75,111,"1696508"
66,"spotify:track:7eQl3Yqv35ioqUfveKHitE","Pritam, Mohit Chauhan","Tum Se Hi","T-Series",27,70,197,"1692857"
67,"spotify:track:7ouBSPZKQpm7zQz2leJXta","Arijit Singh","Tum Hi Ho (From ""Aashiqui 2"")","T-Series",44,65,152,"1685935"
68,"spotify:track:4uK0M8AI6gyFmyzUneQpbi","A.R. Rahman, Arijit Singh, Shashaa Tirupati","Rait Zara Si (From ""Atrangi Re"")","T-Series",12,84,99,"1677185"
69,"spotify:track:7CVw4gVPpH1TPQttQGVmhZ","Karun, Lambo Drive, Arpit Bala, ReVo LEKHAK","Maharani","TEESRI DUNIYA",69,80,3,"1673413"
70,"spotify:track:2vPrBucKCfKmafHhSfJ2pt","Pritam, Arijit Singh, Amitabh Bhattacharya, Charan","Pyaar Hota Kayi Baar Hai (From ""Tu Jhoothi Main Makkaar"")","T-Series",9,79,46,"1669415"
71,"spotify:track:4OcvkkpF3xmyCGGY5IBlgi","Akhil Sachdeva, Tulsi Kumar","Tera Ban Jaunga (From ""Kabir Singh"")","T-Series",4,62,224,"1663269"
72,"spotify:track:5W7DOVGQLTigu09afW7QMT","Sidhu Moose Wala","295","Sidhu Moose Wala",1,78,98,"1656140"
73,"spotify:track:0czcoKJbJt08NqKrvSbbz7","Pritam, Arijit Singh, Amitabh Bhattacharya","O Bedardeya (From ""Tu Jhoothi Main Makkaar"")","T-Series",1,73,42,"1654142"
74,"spotify:track:6H7fLdt0AeWpuxUKXuXWrx","Hariharan","Shree Hanuman Chalisa","T-Series",39,56,72,"1645898"
75,"spotify:track:0ojpEubhy4JNeVftmVuiN7","Vishal Mishra, Armaan Malik","Pehla Pyaar","T-Series",11,69,135,"1642061"
76,"spotify:track:0tgVpDi06FyKpA1z0VMD4v","Ed Sheeran","Perfect","Atlantic Records UK",29,72,193,"1620856"
77,"spotify:track:6FahmzZYKH0zb2f9hrVsvw","Anirudh Ravichander, Nikhita Gandhi","Ordinary Person (From ""Leo"")","Sony Music Entertainment India Pvt. Ltd.",5,64,10,"1616137"
78,"spotify:track:2IoZMG3RqiTmsy7Li3zGFg","Sachet Tandon, Parampara Tandon, Sachet-Parampara","Mere Sohneya (From ""Kabir Singh"")","T-Series",4,74,193,"1615818"
79,"spotify:track:0FBQ4NrrHUbR9kus7rzrOj","Atif Aslam","Dil Diyan Gallan","YRF Music",74,87,202,"1613333"
80,"spotify:track:6udC4b4jOSnHb9ItnXgKLR","Sachin-Jigar, Shreya Ghoshal, Tochi Raina","Saibo","Sony Music Entertainment India Pvt. Ltd.",31,67,165,"1609041"
81,"spotify:track:2A4lcqTJZgUs1XrW6TSvt0","Rajat Nagpal, Yasser Desai, Rana Sotal","Hum Toh Deewane","PlayDMF",50,50,13,"1576828"
82,"spotify:track:0CtZpaOhtzvLV3FfcsVpQo","Vishal-Shekhar, Shilpa Rao, Caralisa Monteiro, Vishal Dadlani, Shekhar Ravjiani, Kumaar","Besharam Rang (From ""Pathaan"")","YRF Music",4,94,55,"1565228"
83,"spotify:track:72zHuDxFQTjbL51qJQSA7j","Jasleen Royal, B Praak, Romy, Anvita Dutt","Ranjha (From ""Shershaah"")","Sony Music Entertainment India Pvt. Ltd.",1,81,125,"1552308"
84,"spotify:track:0l6g8Z8mqGbGXFOjigYetD","Pritam, Arijit Singh","Hawayein","Sony Music Entertainment India Pvt. Ltd.",51,85,116,"1532497"
85,"spotify:track:1UWacd8x8tPPwmrPB1MoBI","Pritam, Arijit Singh","Ae Dil Hai Mushkil Title Track","Sony Music Entertainment India Pvt. Ltd.",79,82,204,"1514874"
86,"spotify:track:23YpzkTDtU78GK6vpgRbkM","Vishal-Shekhar, Vishal Dadlani, Shekhar Ravjiani, Shilpa Rao, Mellow D, Kumaar","Ishq Jaisa Kuch (From ""Fighter"")","T-Series",86,-1,1,"1511540"
87,"spotify:track:0gPgdRfB4jdGrlyXS0Vx78","Vishal-Shekhar, KK, Shilpa Rao, Anvita Dutt Guptan","Khuda Jaane","YRF Music",37,98,64,"1510154"
88,"spotify:track:7MXVkk9YMctZqd1Srtv4MB","The Weeknd, Daft Punk","Starboy","Universal Republic Records",12,86,126,"1503776"
89,"spotify:track:3ZGJhN4unVspOqpwGvUL2W","Diljit Dosanjh","Lemonade","DILJIT DOSANJH",26,91,74,"1502751"
90,"spotify:track:5rpCUsEfBLIumvrxrahnKF","Hasan Raheem, Umair, Talwiinder","Wishes","1698613 Records DK2",90,108,3,"1482796"
91,"spotify:track:42TMa2hgBNjte4uV7jNCnQ","Shubh, Ikky","Baller","SHUBH",2,93,68,"1460852"
92,"spotify:track:4m2af7wCfOyYLBQZ3l7xLs","Sonu Nigam, Harshavardhan Rameshwar, Raj Shekhar","Papa Meri Jaan (From ""ANIMAL"")","T-Series",23,36,4,"1460606"
93,"spotify:track:6FAYpZ4jve8vpvTwUvjK6H","Vishal-Shekhar, Arijit Singh, Sukriti Kakar, Vishal Dadlani, Shekhar Ravjiani, Kumaar","Jhoome Jo Pathaan","YRF Music",3,104,53,"1455560"
94,"spotify:track:2GXXZFUxYg2LvG8SR0byOE","Atif Aslam","Jeena Jeena","Eros Now Music",37,95,127,"1453072"
95,"spotify:track:3wz2vWhYnnBoFmgMkqtzLy","Chani Nattan, Inderpal Moga","Daku","Kharku Life Records",5,102,71,"1450592"
96,"spotify:track:5DezAsjtSLUxW9j00eh0Ia","Santhosh Narayanan, Dhee, Vivek","Maamadura - From ""Jigarthanda DoubleX""","Think Music",39,99,7,"1442032"
97,"spotify:track:29m79w9xPMH4YCD6r8JSmV","AP Dhillon, Gurinder Gill, Intense","Excuses","RUN-UP RECORDS",1,107,114,"1424070"
98,"spotify:track:6mTvwBzWTGDOVeCNQEqtOE","Amaal Mallik, Arijit Singh, Tulsi Kumar","Soch Na Sake","T-Series",64,111,52,"1422212"
99,"spotify:track:7m4CgL81VVIHaaiSxyH922","Yo Yo Honey Singh","Desi Kalakaar","T-Series",13,89,14,"1413892"
100,"spotify:track:32765xcLM1fd6wQIpkN9A0","Ami Mishra, Kunaal Vermaa","Hasi - Male Version","Sony Music Entertainment India Pvt. Ltd.",97,97,26,"1412200"
101,"spotify:track:48Ix6ReYdJf2H4mKb3TIpj","Atif Aslam, Alisha Chinai, Pritam","Tera Hone Laga Hoon","Tips Industries Ltd",59,96,137,"1399171"
102,"spotify:track:2RgvvnMwtP0R2OkVZmFvnV","KK","Ajab Si (From ""Om Shanti Om"")","T-Series",34,114,103,"1391071"
103,"spotify:track:6MZyrnqwsLnrWY5Gk0AyXg","Suzonn","Farq hai","Suzonn",60,112,16,"1383452"
104,"spotify:track:04ChFQZCKl2yRcvc0VR7qN","Denny, Rahul Mishra, Kunaal Vermaa","Chale Jaana Phir (Humko Tere Bina)","For The Record Music",14,90,25,"1381964"
105,"spotify:track:1d5lpW3gUyq537iuyrb9Lf","Aditya Rikhari","Samjho Na","CollabX Productions",73,110,36,"1378215"
106,"spotify:track:53QrRlALFJfZgdcGLKwy5s","Shubh","Dior","SHUBH",76,101,25,"1371837"
107,"spotify:track:4VosVUajzm6nzGlSb6nP3L","Parmish Verma, Paradox","Check It Out","SDA Studios",19,106,24,"1366991"
108,"spotify:track:4i6z4CQXt1HTGSjCJEquG6","Guru Randhawa, Shehnaaz Gill, Sanjoy","Sunrise","T-Series",108,133,2,"1343988"
109,"spotify:track:4bD9z9qa4qg9BhryvYWB7c","Pritam, Tochi Raina, Rekha Bhardwaj","Kabira","T-Series",31,100,224,"1340301"
110,"spotify:track:3mUkVsovIuscQlSoMhmAZt","Madhur Sharma, Swapnil Tare, Nusrat Fateh Ali Khan","Kali Kali Zulfon Ke (Lo-Fi)","T-Series",6,92,68,"1319333"
111,"spotify:track:1feANd8EfcDP5UqSvbheM3","Sachet Tandon, Sachet-Parampara","Bekhayali (From ""Kabir Singh"")","T-Series",1,88,207,"1316521"
112,"spotify:track:6ivemTXTn27PwVjtd0oqDs","Anuv Jain","Gul","Universal Music India Pvt. Ltd. (on behalf of Anuv Jain)",76,147,35,"1315480"
113,"spotify:track:0rk2X5TAhraBC5aCIXK2Rq","Jawad Ahmad, Shaarib Toshi, Arijit Singh, Shreya Ghoshal","Samjhawan","Sony Music Entertainment India Pvt. Ltd.",70,115,139,"1310257"
114,"spotify:track:0rlLBWFFTQiOWi963SH9bb","The Local Train","Choo Lo","The Local Train",78,162,27,"1308346"
115,"spotify:track:2tjWCe2W7sgvS3C8NHcdtI","Akhil, Dhvani Bhanushali, Kunaal Vermaa","Duniyaa (From ""Luka Chuppi"")","T-Series",1,109,253,"1307303"
116,"spotify:track:3eSm4iAkLsn3BeggfiQOH9","Gaurav Chatterji, Aasa Singh, Hansika Pareek, Hrishi Giridhar, Pratik Gangavane","Kaise Ab Kahein - From ""Gutar Gu""","Sikhya Entertainment Records",78,83,21,"1300907"
117,"spotify:track:0n2LpEAixGBWK8mwUSGtGb","Sunanda Sharma","Chandigarh Ka Chokra","Warner Music / Sky Digital JV",117,146,2,"1296843"
118,"spotify:track:3wwLWFRLiReDf5AqgmAJwT","Rito Riba, Rajat Nagpal, Rana Sotal","Heer Ranjha","PlayDMF",11,113,61,"1292529"
119,"spotify:track:0EH7sgeiFqDa3eS7ieW2zs","Akon, Hamsika Iyer","Chammak Challo","T-Series",119,143,37,"1290969"
120,"spotify:track:0DXfJ2iKRDEG7rPgssWFea","Kanishk Seth, Kavita Seth","Rangisari (From ""Jugjugg Jeeyo"")","T-Series",22,119,59,"1290144"
121,"spotify:track:32VAw8DL9ixX5XSW2VLcZ4","Parmish Verma, PARDHAAN, Desi Crew","Aam Jahe Munde","Parmish Verma Films",29,117,25,"1282418"
122,"spotify:track:4vrpvlcDM3uze5PoOgZpoV","Arijit Singh","Dil Haareya","Saregama",122,185,2,"1280841"
123,"spotify:track:4iEGv5Ne6HuCkFCjzxdWQK","Neeti Mohan","Meri Jaan","Saregama",11,128,62,"1279423"
124,"spotify:track:7mSzDKajY2wUtstQSLdzMK","Mohit Chauhan, Rochak Kohli","Rang Lageya","Saregama",35,116,48,"1276951"
125,"spotify:track:6Z4rRhYZVQsYKmrxD40tru","Riar Saab, Abhijay Sharma","Obsessed","Mass Appeal India, LLC",2,123,34,"1270751"
126,"spotify:track:7v0t3o17J796y9OG2n3ebl","B Praak, Jaani","Kya Loge Tum","Universal Music India Pvt Ltd. – Distribution",10,103,32,"1263059"
127,"spotify:track:66v97IvccVkHt40FIOq1LH","Pritam, Arijit Singh, Nikhita Gandhi, Amitabh Bhattacharya","Leke Prabhu Ka Naam (From ""Tiger 3"")","YRF Music",30,121,9,"1254427"
128,"spotify:track:3qrdLVOClRU4yPkcXZ7c5u","Ayushmann Khurrana, Tanishk-Vayu","Mere Liye Tum Kaafi Ho (From ""Shubh Mangal Zyada Saavdhan"")","T-Series",11,132,201,"1249196"
129,"spotify:track:0tpwqQhdfJXRcUDSNRjb9O","Arijit Singh, Neeti Mohan, Rashmi Virag","Mere Yaaraa (From ""Sooryavanshi"")","T-Series",20,150,85,"1245429"
130,"spotify:track:6aQIGqAo9PxRKjUkhYtR6R","Anirudh Ravichander, Priya Mali","Hayyoda (From ""Jawan"")","T-Series",14,124,18,"1240652"
131,"spotify:track:2qxmye6gAegTMjLKEBoR3d","Alec Benjamin","Let Me Down Slowly","2018",34,118,194,"1238017"
132,"spotify:track:5WXQbgwGwyauXOqswlEeQY","Tanishk Bagchi, Arijit Singh, Asees Kaur","Bolna (From ""Kapoor & Sons (Since 1921)"")","Sony Music Entertainment India Pvt. Ltd.",101,122,44,"1234249"
133,"spotify:track:5O932cZmzOZGOGZz9RHx20","Pritam, Arijit Singh","Khairiyat","T-Series",1,138,225,"1228808"
134,"spotify:track:5nQA7m7xypeL7dFaGRwJO5","Shallum Lama","Timro Pratiksa","Sony Music Entertainment India Pvt. Ltd.",134,-1,3,"1225832"
135,"spotify:track:6bdpj89aYEBjhpsenXAsmO","A.R. Rahman, Arijit Singh","Enna Sona","Sony Music Entertainment India Pvt. Ltd.",34,151,138,"1224246"
136,"spotify:track:6fScgF2Y63ScU73nYju0ny","Atif Aslam, Arko","O Saathi","T-Series",58,140,74,"1194719"
137,"spotify:track:6cUOiOY5qh2FpIQWIYAd2h","Pritam, Darshan Raval, Antara Mitra","Mehrama","Sony Music Entertainment India Pvt. Ltd.",10,130,161,"1192991"
138,"spotify:track:0NuWRfZRWzn1oc9piFhK9n","MC SQUARE, Hiten","Laado","Sony Music Entertainment India Pvt. Ltd.",11,155,16,"1190252"
139,"spotify:track:6V7UVqe8XnAS4WPdpaw5TK","Asees Kaur, Stebin Ben","Tu Mile Dil Khile","Saregama",20,105,46,"1178618"
140,"spotify:track:5aMLADD1Ho6Ogq8s8mIzB9","Sachet-Parampara, Sachet Tandon, Parampara Tandon","Ram Siya Ram (From ""Adipurush"")","T-Series",11,142,30,"1173333"
141,"spotify:track:2eAvDnpXP5W0cVtiI0PUxV","Ruth B.","Dandelions","Columbia",14,127,109,"1172760"
142,"spotify:track:1AMD2AkfGrKoKhwkvYLbza","Sunny Yaduvanshi, AK Rok, Nitesh Ujoli","Yadav Brand 2","Flame Music",9,135,42,"1172596"
143,"spotify:track:6FjbAnaPRPwiP3sciEYctO","Pritam, Arijit Singh","Raabta","T-Series",41,125,83,"1168301"
144,"spotify:track:5O2P9iiztwhomNh8xkR9lJ","One Direction","Night Changes","Syco Music",22,129,137,"1166980"
145,"spotify:track:7G5wpuR61ABrT7R1snos7C","Pritam, Arijit Singh","Kalank - Title Track","Zee Music Company",5,148,209,"1164036"
146,"spotify:track:2AilvPt1AQ8PixlCKqkjfj","Shubh","Elevated","SHUBH",27,154,104,"1163954"
147,"spotify:track:5Gy67YHzPZTk9Q0D73LAGH","Jeet Gannguli, Arijit Singh","Khamoshiyan (From ""Khamoshiyan"")","Sony Music Entertainment India Pvt. Ltd.",90,161,35,"1161483"
148,"spotify:track:0H2iJVgorRR0ZFgRqGUjUM","Pritam, Arijit Singh","Channa Mereya","Sony Music Entertainment India Pvt. Ltd.",58,134,205,"1149785"
149,"spotify:track:28lvraTNIN8qiTpoIK7m8Z","AP Dhillon, Shinda Kahlon","True Stories","Mass Appeal India",15,144,28,"1149748"
150,"spotify:track:6O1RAYwmOqkcoJQr7J9SFJ","Manan Bhardwaj, Arijit Singh","Oonchi Oonchi Deewarein","T-Series",52,137,11,"1136748"
151,"spotify:track:6ZYxNjuAU9Vy3VtF6W1dtE","Shubh","We Rollin","SHUBH",10,157,109,"1124272"
152,"spotify:track:7Imk0IG6S5GA5iYWkjmMW5","Palak Muchhal, Arijit Singh","Chahun Main Ya Naa (From ""Aashiqui 2"")","T-Series",152,171,11,"1115019"
153,"spotify:track:0Qo75eJMY72e5IQJt0Dz9z","Pritam, Arijit Singh, Irshad Kamil","Ruaan (From ""Tiger 3"")","YRF Music",66,131,6,"1114700"
154,"spotify:track:03yKEFruN3BS2coglBtt2N","Laddi Chahal, Parmish Verma, Gurlez Akhtar","Rubicon Drill","Parmish Verma Films",12,165,54,"1112004"
155,"spotify:track:2uWZ7EGddFlA1DJ3Rzzvs2","Karan Aujla, Ikky, Yarah","Bachke Bachke (feat. Yarah)","WM Canada",57,152,17,"1107944"
156,"spotify:track:2sT0eosuhBEkw8dz6qFxUo","Anurag Saikia, Raghav Chaitanya, Nikhita Gandhi, Raj Shekhar","Aise Kyun","Netflix Music",156,-1,1,"1105187"
157,"spotify:track:7uoFMmxln0GPXQ0AcCBXRq","Sia","Snowman","Monkey Puzzle/Atlantic",145,-1,7,"1104026"
158,"spotify:track:7aE1lfskJLMHQnzCCP1zsV","Akhil Sachdeva, Mansheel Gujral","Humsafar (From ""Badrinath Ki Dulhania"")","T-Series",158,177,10,"1103102"
159,"spotify:track:1RdrAqXa2fUj2XytsKaUwl","Irshad Khan","Haryana Hood","Bajewala Records Haryanvi",40,166,36,"1095144"
160,"spotify:track:6gwnKOvdBKkTU4CQ7KpIAu","Shaarib Toshi, Arijit Singh","Bandeya - From ""Dil Juunglee""","Pooja Music",70,170,67,"1094999"
161,"spotify:track:1q6pMQBRILzkz0g4rKEXdM","Palak Muchhal","Kaun Tujhe (From ""M.S.Dhoni - The Untold Story"")","T-Series",57,183,24,"1091592"
162,"spotify:track:6V4N3h4HYD1Ask9cUTxjjg","Taimour Baig, Raffey Anwar, AUR","Long time no see","Universal Music MENA",66,149,10,"1090269"
163,"spotify:track:6WzRpISELf3YglGAh7TXcG","The Weeknd, Playboi Carti, Madonna","Popular (with Playboi Carti & Madonna) - From The Idol Vol. 1 (Music from the HBO Original Series)","XO / Republic Records",118,-1,11,"1082758"
164,"spotify:track:0biCSADTAblvLTLtJz4pXO","Vishal-Shekhar, Arijit Singh, Caralisa Monteiro, Jaideep Sahni","Nashe Si Chadh Gayi","YRF Music",151,196,21,"1077753"
165,"spotify:track:6STXfHpOuGjOespYlpeuI4","Dhibu Ninan Thomas, Pradeep Kumar, Karthika Vaidyanathan, Yugabharathi","Kangal Edho - From ""Chithha""","Think Music",81,120,4,"1073905"
166,"spotify:track:7lNbI1xd39QRdf6Mj8tvTv","Javed Ali","Saudebazi (Encore) [From ""Aakrosh""]","T-Series",108,159,18,"1068343"
167,"spotify:track:3jyqXdAjwqO3gFtjnYrbq9","Darshan Raval, Rochak Kohli","Ek Ladki Ko Dekha Toh Aisa Laga (From ""Ek Ladki Ko Dekha Toh Aisa Laga"")","Saregama",59,136,58,"1068233"
168,"spotify:track:3rUGC1vUpkDG9CZFHMur1t","Tate McRae","greedy","RCA Records Label",119,141,9,"1066784"
169,"spotify:track:7o1SDLghDwMc4OW3rKakVt","Bir, Dhanju, thiarajxtt","Afterhours","Sky Digital",87,163,28,"1062468"
170,"spotify:track:64r6z0P3RnhpTGdkA7p5Os","Darshan Raval","Ek Tarfa","Indie Music Label",33,145,97,"1060790"
171,"spotify:track:1YMLgvsQdE27r30q0fsLeV","Arijit Singh","Tera Fitoor","Tips Industries Ltd",87,194,26,"1059681"
172,"spotify:track:5llaVhaIoowKT3fqf2NfPO","Atif Aslam, Pritam","Pehli Nazar Mein","Tips Industries Ltd",138,139,6,"1059019"
173,"spotify:track:4kaLkst9lT3sQ5Crgxs3ic","Ayushmann Khurrana","Pani Da Rang - Male Vocals","Eros Now Music",68,179,18,"1058177"
174,"spotify:track:56y1jOTK0XSvJzVv9vHQBK","Doja Cat","Paint The Town Red","Kemosabe Records/RCA Records",45,160,17,"1055253"
175,"spotify:track:0s76ExpXyMGVBlKLUr683e","Aditya Rikhari","Faasle","CollabX Productions",123,164,28,"1053840"
176,"spotify:track:7fW9J3EpVWVN1ouv0slAs0","KK","Kya Mujhe Pyar Hai (From ""Woh Lamhe"")","T-Series",42,174,50,"1053823"
177,"spotify:track:43YkTTlOD203o9E5ZxhUjF","Arijit Singh","Main Dhoondne Ko Zamaane Mein (From ""Heartless"")","T-Series",62,172,116,"1050148"
178,"spotify:track:2o9flwCy1QzBc6VEwcPooM","King","Sarkaare","Warner Music India",72,126,11,"1049790"
179,"spotify:track:1sZFDDmmBVkcHOpV6AB0Nx","Yo Yo Honey Singh, Rony Ajnali, Gill Machhrai","Kalaastar (From ""Honey 3.0"")","Zee Music Company",39,153,9,"1048884"
180,"spotify:track:0TdWXMXyfTQ2qp5vvU9LID","Diljit Dosanjh, Intense","Case","DILJIT DOSANJH",44,156,12,"1048367"
181,"spotify:track:7qiZfU4dY1lWllzX7mPBI3","Ed Sheeran","Shape of You","Atlantic Records UK",63,175,190,"1045878"
182,"spotify:track:0MbOLfDcGk8ROHJYXJHu5c","Badshah, Karan Aujla, Devika Badyal","Players","Universal Music India Pvt Ltd.",7,182,52,"1045677"
183,"spotify:track:3JkVYvxNoGf2HCWJo61462","Sidhu Moose Wala, Sunny Malton, SOE","Never Fold","Sidhu Moose Wala",13,178,88,"1032981"
184,"spotify:track:6f3ANRNQ8nCiPZ6VqXqq93","Amaal Mallik, Armaan Malik, Rashmi Virag","Main Rahoon Ya Na Rahoon","T-Series",164,-1,3,"1029187"
185,"spotify:track:1ExaQYPap38faw3FEqKcGY","Mankirt Aulakh, Simar Kaur","Koka","Sky Digital",185,197,2,"1025568"
186,"spotify:track:0ZcMt3GYvVkBjdomag59NP","Addy Nagar, Aniket Jain","Kaley Sheshe","Sony Music Entertainment India Pvt. Ltd.",54,158,12,"1022772"
187,"spotify:track:3GEiVoaUXq468gfYs2EPfh","DIVINE, Sidhu Moose Wala","Chorni","DIVINE",8,188,24,"1017054"
188,"spotify:track:567e29TDzLwZwfDuEpGTwo","The Kid LAROI, Justin Bieber","STAY (with Justin Bieber)","Columbia",1,173,129,"1013218"
189,"spotify:track:3ZzUOWnQuNxenx2MbZqtYq","Sidhu Moose Wala, Sikander Kahlon, Mxrci","Watch Out","Sidhu Moose Wala",23,169,7,"1012853"
