rank,uri,artist_names,track_name,source,peak_rank,previous_rank,weeks_on_chart,streams
1,"spotify:track:3zSSCPpLZ5Oc8nelhhGjKz","AUR","Tu hai kahan","Sony Music Entertainment",1,1,7,"8570248"
2,"spotify:track:3xMHXmedL5Rvfxmiar9Ryv","Anirudh Ravichander, Arijit Singh, Shilpa Rao, Kumaar","Chaleya","T-Series",1,2,16,"7870088"
3,"spotify:track:5ZLkihi6DVsHwDL3B8ym1t","Shubh","One Love","SHUBH",3,3,15,"6638135"
4,"spotify:track:5PUXKVVVQ74C3gl5vKy9Li","Jasleen Royal, Arijit Singh, Harrykahanhai","Heeriye (feat. Arijit Singh)","Warner Music India",1,4,18,"5760410"
5,"spotify:track:72vuBPMhwFNlSYpTSf6fVD","Diljit Dosanjh, Sia, Greg Kurstin","Hass Hass","Warner Music India",5,5,5,"5257440"
6,"spotify:track:4ApCig0GTR4IEp7Ijsyo3r","Manan Bhardwaj, Bhupinder Babbal","Arjan Vailly","T-Series",6,63,2,"4937993"
7,"spotify:track:3yHyiUDJdz02FZ6jfUbsmY","Arijit Singh, Shreyas Puranik, Siddharth - Garima","Satranga (From ""ANIMAL"")","T-Series",7,9,5,"4785447"
8,"spotify:track:0YQJoDL6f46J0n1rOVkpxJ","Karan Aujla, Ikky","Softly","WM Canada",4,6,15,"4014607"
9,"spotify:track:4eBvRhTJ2AcxCsbfTUjoRp","Shubh","Cheques","SHUBH",1,7,27,"3599430"
10,"spotify:track:0YxKKO272sacGBJKjf6FnB","Jaani, B Praak","Saari Duniya Jalaa Denge","T-Series",10,-1,1,"3480676"
11,"spotify:track:6c4Po8zyQjB4cR5XgLhcGb","Prabh Singh, Jay Trak, Rooh Sandhu","9:45","Prabh Singh Official",9,10,21,"3229773"
12,"spotify:track:5bQ6oDLqvw8tywmnSmwEyL","Sachin-Jigar, Arijit Singh, Amitabh Bhattacharya","Apna Bana Le","Zee Music Company",1,41,23,"3125156"
13,"spotify:track:0Jiaz0O4AqnJICa9PxHhaR","Darshan Raval","Mahiye Jinna Sohna","Warner Music India",2,11,23,"3033139"
14,"spotify:track:4UMIv5jd9gK98a39BQRD9X","Pritam, Arijit Singh, Amitabh Bhattacharya","Kesariya","Sony Music Entertainment India Pvt. Ltd.",1,8,72,"2987712"
15,"spotify:track:1418IuVKQPTYqt7QNJ9RXN","King","Maan Meri Jaan","Warner Music India",1,15,59,"2804484"
16,"spotify:track:7iekl4P95GuphG8x8a3cNT","Pritam, Arijit Singh, Jonita Gandhi, Ranveer Singh, Madan Mohan, Amitabh Bhattacharya","What Jhumka ? (From ""Rocky Aur Rani Kii Prem Kahaani"")","Saregama",6,14,20,"2710768"
17,"spotify:track:23y8MwhdvbSalGitHeokpk","Anirudh Ravichander","Badass","Sony Music Entertainment India Pvt. Ltd.",4,12,9,"2652424"
18,"spotify:track:5Tkf5CbtVYHA1SiKo1NrJE","Sachin-Jigar, Arijit Singh, Amitabha Bhattacharya","Phir Aur Kya Chahiye (From ""Zara Hatke Zara Bachke"")","Saregama",1,18,27,"2616680"
19,"spotify:track:6FahmzZYKH0zb2f9hrVsvw","Anirudh Ravichander, Nikhita Gandhi","Ordinary Person (From ""Leo"")","Sony Music Entertainment India Pvt. Ltd.",5,13,6,"2602450"
20,"spotify:track:0xIuPDzJSnJywALez8dwKR","AP Dhillon","With You","Mass Appeal India",2,16,16,"2568779"
21,"spotify:track:0645eBDehHcqfiF15hscQV","Vishal Mishra, Rashmeet Kaur","Janiye (from the Netflix Film ""Chor Nikal Ke Bhaga"")","Netflix Music",5,19,21,"2545009"
22,"spotify:track:2FCXQHugkoHE1K3tiDu8pu","Alka Yagnik, Arijit Singh","Agar Tum Saath Ho (From ""Tamasha"")","T-Series",4,24,235,"2450559"
23,"spotify:track:13ZISM2bmrMBCRlMzl669x","Anirudh Ravichander, Thalapathy Vijay, Asal Kolaar","Naa Ready","Sony Music Entertainment India Pvt. Ltd.",4,17,23,"2447501"
24,"spotify:track:73K33p4Vyz9koXGqmL5eFs","Sachet Tandon, Parampara Tandon, Kumaar, Sachet-Parampara","Malang Sajna","T-Series",4,21,45,"2399426"
25,"spotify:track:38h4tmH1AWBVuemWAy4R4y","Pritam, Arijit Singh, Shreya Ghoshal, Amitabh Bhattacharya","Tum Kya Mile (From ""Rocky Aur Rani Kii Prem Kahaani"")","Saregama",9,22,22,"2375960"
26,"spotify:track:4blqlsA1uf2d2I40E90EUC","Pritam, Arijit Singh, Shilpa Rao","Tere Hawaale (From ""Laal Singh Chaddha"")","T-Series",11,32,40,"2246628"
27,"spotify:track:6oz1L5jcqZWYuId7nxvIan","Shubh","Still Rollin","SHUBH",4,28,28,"2217005"
28,"spotify:track:2yIW0esEphGtQgVV0w2SYU","King","Tu Jaana Na Piya","Warner Music India",26,26,5,"2211438"
29,"spotify:track:04ChFQZCKl2yRcvc0VR7qN","Denny, Rahul Mishra, Kunaal Vermaa","Chale Jaana Phir (Humko Tere Bina)","For The Record Music",14,20,21,"2174573"
30,"spotify:track:3F3ZuXYFXGM1V6pk3b3zmi","Diljit Dosanjh, thiarajxtt","Kinni Kinni","DILJIT DOSANJH",30,43,3,"2103546"
31,"spotify:track:24MMjyA3NLqCsDJfsn51eg","Sharn, 40k, The Paul","Mi Amor","Desi Avenue",7,31,46,"2101838"
32,"spotify:track:08Isz2ETWSBhvIl8UpKYsp","Shubh","No Love","SHUBH",2,25,90,"2092576"
33,"spotify:track:5DgY6Ab0vpyUMKnY9ubFOF","Anirudh Ravichander, Super Subu","Hukum - Thalaivar Alappara","Sun Pictures",1,29,20,"2073586"
34,"spotify:track:6GZIAVSu0YXF7FYzyRl1MP","Sachin-Jigar, Varun Jain, Shadab Faridi, Altamash Faridi, Amitabh Bhattacharya","Tere Vaaste (From ""Zara Hatke Zara Bachke"")","Saregama",1,37,27,"2045881"
35,"spotify:track:2Fv2injs4qAm8mJBGaxVKU","Arijit Singh, Mithoon","Tujhe Kitna Chahne Lage (From ""Kabir Singh"")","T-Series",2,30,235,"2040766"
36,"spotify:track:3nKQrVVlwbAQSnFbgZWdN0","Avvy Sra, Karan Aujla, Jaani","White Brown Black","Universal Music India Pvt Ltd. – Distribution",29,40,50,"2036284"
37,"spotify:track:0rMeOAvbQZ2RTG4B6L1M4p","Darshan Raval","Asal Mein","Indie Music Label",21,33,131,"2022359"
38,"spotify:track:0snQrp1VaY5Pj1YIHRJpRJ","Aditya A","Chaand Baaliyan","Sony Music Entertainment India Pvt. Ltd.",2,46,93,"2021472"
39,"spotify:track:5G7pZ8G8NFvS1MQ9H4L7dC","Javed-Mohsin, Arijit Singh, Shreya Ghoshal, Kunaal Vermaa, Prashant Ingole","Pal","Sony Music Entertainment India Pvt. Ltd.",34,35,247,"2010424"
40,"spotify:track:2rOnSn2piaqLAlYjtfUBlY","Tanishk Bagchi, Jubin Nautiyal, Asees Kaur","Raataan Lambiyan (From ""Shershaah"")","Sony Music Entertainment India Pvt. Ltd.",1,38,122,"1998107"
41,"spotify:track:2ZD4aIEepqZsdxPxLSuUhm","Pritam, Arijit Singh, Amitabh Bhattacharya, Nikhita Gandhi","Tere Pyaar Mein","T-Series",5,45,43,"1955837"
42,"spotify:track:54PRUdMOYzglMGnsg9kIta","Raghav Chaitanya, Manoj Muntashir, Pritam","Hua Main (From ""ANIMAL"")","T-Series",42,138,7,"1954243"
43,"spotify:track:1y1rQTkWmrZdJmjwuK07GC","Vishal Mishra","Kaise Hua (From ""Kabir Singh"")","T-Series",5,52,233,"1946682"
44,"spotify:track:7m4CgL81VVIHaaiSxyH922","Yo Yo Honey Singh","Desi Kalakaar","T-Series",13,36,10,"1941493"
45,"spotify:track:5BKKKNwrebowaMoUdBaNby","King","Tu Aake Dekhle","Warner Music India",3,48,148,"1938446"
46,"spotify:track:0UZLaEOSIc5kg0cc7eszqC","Vishal Mishra","Manjha","Desi Music Factory",27,53,79,"1936915"
47,"spotify:track:5LSAafg2oH9YPgf3EG17iw","Aditya Gadhvi, Achint","Khalasi | Coke Studio Bharat","Universal Music India Pvt Ltd.",11,27,8,"1927556"
48,"spotify:track:2oenSXLDbWVaaL7QjSGYj5","Diljit Dosanjh, Intense, Sultaan","Lalkara","DILJIT DOSANJH",22,42,8,"1905605"
49,"spotify:track:4VsP4Dm8gsibRxB5I2hEkw","Kaifi Khalil","Kahani Suno 2.0","1944121 Records DK",1,49,50,"1902424"
50,"spotify:track:4wIWWEhbdgKAxhR68eE0Ye","Arijit Singh, Chinmayi","Mast Magan (From ""2 States"")","T-Series",46,47,145,"1870624"
51,"spotify:track:66v97IvccVkHt40FIOq1LH","Pritam, Arijit Singh, Nikhita Gandhi, Amitabh Bhattacharya","Leke Prabhu Ka Naam (From ""Tiger 3"")","YRF Music",30,34,5,"1869979"
52,"spotify:track:7eQl3Yqv35ioqUfveKHitE","Pritam, Mohit Chauhan","Tum Se Hi","T-Series",27,44,193,"1806952"
53,"spotify:track:3ZzUOWnQuNxenx2MbZqtYq","Sidhu Moose Wala, Sikander Kahlon, Mxrci","Watch Out","Sidhu Moose Wala",23,23,3,"1803026"
54,"spotify:track:610keNiNVTIkYD0CqeSerg","Cheema Y, Gur Sidhu","California Love","Brown Town Music",27,59,27,"1798917"
55,"spotify:track:0tgVpDi06FyKpA1z0VMD4v","Ed Sheeran","Perfect","Atlantic Records UK",29,60,189,"1784729"
56,"spotify:track:5DezAsjtSLUxW9j00eh0Ia","Santhosh Narayanan, Dhee, Vivek","Maamadura - From ""Jigarthanda DoubleX""","Think Music",39,39,3,"1777319"
57,"spotify:track:6udC4b4jOSnHb9ItnXgKLR","Sachin-Jigar, Shreya Ghoshal, Tochi Raina","Saibo","Sony Music Entertainment India Pvt. Ltd.",31,64,161,"1776514"
58,"spotify:track:3HiobOOpSpMsi95WBKPBYk","Jeet Gannguli, Arijit Singh","Hamari Adhuri Kahani (Title Track)","Sony Music Entertainment India Pvt. Ltd.",56,56,107,"1758564"
59,"spotify:track:7ouBSPZKQpm7zQz2leJXta","Arijit Singh","Tum Hi Ho (From ""Aashiqui 2"")","T-Series",44,62,148,"1753136"
60,"spotify:track:6ygiy70ujkNOYXM1tQuMNe","Karan Aujla, Ikky, Preston Pablo","Admirin' You (feat. Preston Pablo)","WM Canada",24,51,17,"1748985"
61,"spotify:track:1smFN2CLqGROu0J0UyvDfL","Pritam, Arijit Singh","Shayad","Sony Music Entertainment India Pvt. Ltd.",1,54,202,"1722679"
62,"spotify:track:5XeFesFbtLpXzIVDNQP22n","Arctic Monkeys","I Wanna Be Yours","Domino Recording Co",48,69,55,"1719797"
63,"spotify:track:3yV2c3cYhkAwSsxAq6nRiv","Gajendra Verma","Mann Mera","Sony Music / Eros Now Music",26,65,139,"1719418"
64,"spotify:track:1sZFDDmmBVkcHOpV6AB0Nx","Yo Yo Honey Singh, Rony Ajnali, Gill Machhrai","Kalaastar (From ""Honey 3.0"")","Zee Music Company",39,57,5,"1711696"
65,"spotify:track:6aQIGqAo9PxRKjUkhYtR6R","Anirudh Ravichander, Priya Mali","Hayyoda (From ""Jawan"")","T-Series",14,50,14,"1690637"
66,"spotify:track:2PvaburAUlhNHxVhw5lvOq","Arijit Singh","Humdard (From ""Ek Villain"")","T-Series",28,58,176,"1688876"
67,"spotify:track:2A4lcqTJZgUs1XrW6TSvt0","Rajat Nagpal, Yasser Desai, Rana Sotal","Hum Toh Deewane","PlayDMF",61,68,9,"1675353"
68,"spotify:track:72zHuDxFQTjbL51qJQSA7j","Jasleen Royal, B Praak, Romy, Anvita Dutt","Ranjha (From ""Shershaah"")","Sony Music Entertainment India Pvt. Ltd.",1,61,121,"1671323"
69,"spotify:track:0Qo75eJMY72e5IQJt0Dz9z","Pritam, Arijit Singh, Irshad Kamil","Ruaan (From ""Tiger 3"")","YRF Music",69,73,2,"1662819"
70,"spotify:track:5W7DOVGQLTigu09afW7QMT","Sidhu Moose Wala","295","Sidhu Moose Wala",1,66,94,"1653966"
71,"spotify:track:3ZGJhN4unVspOqpwGvUL2W","Diljit Dosanjh","Lemonade","DILJIT DOSANJH",26,55,70,"1637555"
72,"spotify:track:0czcoKJbJt08NqKrvSbbz7","Pritam, Arijit Singh, Amitabh Bhattacharya","O Bedardeya (From ""Tu Jhoothi Main Makkaar"")","T-Series",1,81,38,"1636606"
73,"spotify:track:6H7fLdt0AeWpuxUKXuXWrx","Hariharan","Shree Hanuman Chalisa","T-Series",39,72,68,"1629942"
74,"spotify:track:2q9lPN7CT92W1Ry77j2acn","Pritam, Arijit Singh, Shreya Ghoshal, Shadab Faridi, Altamash Faridi, Amitabh Bhattacharya","Ve Kamleya (From ""Rocky Aur Rani Kii Prem Kahaani"")","Saregama",74,117,16,"1597177"
75,"spotify:track:42TMa2hgBNjte4uV7jNCnQ","Shubh, Ikky","Baller","SHUBH",2,70,64,"1593904"
76,"spotify:track:2GXXZFUxYg2LvG8SR0byOE","Atif Aslam","Jeena Jeena","Eros Now Music",37,82,123,"1587765"
77,"spotify:track:7MXVkk9YMctZqd1Srtv4MB","The Weeknd, Daft Punk","Starboy","Universal Republic Records",12,79,122,"1585495"
78,"spotify:track:4VosVUajzm6nzGlSb6nP3L","Parmish Verma, Paradox","Check It Out","SDA Studios",19,67,20,"1573919"
79,"spotify:track:0l6g8Z8mqGbGXFOjigYetD","Pritam, Arijit Singh","Hawayein","Sony Music Entertainment India Pvt. Ltd.",51,77,112,"1568232"
80,"spotify:track:4bD9z9qa4qg9BhryvYWB7c","Pritam, Tochi Raina, Rekha Bhardwaj","Kabira","T-Series",31,107,220,"1566712"
81,"spotify:track:0gPgdRfB4jdGrlyXS0Vx78","Vishal-Shekhar, KK, Shilpa Rao, Anvita Dutt Guptan","Khuda Jaane","YRF Music",37,76,60,"1563351"
82,"spotify:track:0FBQ4NrrHUbR9kus7rzrOj","Atif Aslam","Dil Diyan Gallan","YRF Music",74,74,198,"1557486"
83,"spotify:track:2IoZMG3RqiTmsy7Li3zGFg","Sachet Tandon, Parampara Tandon, Sachet-Parampara","Mere Sohneya (From ""Kabir Singh"")","T-Series",4,75,189,"1529285"
84,"spotify:track:1UWacd8x8tPPwmrPB1MoBI","Pritam, Arijit Singh","Ae Dil Hai Mushkil Title Track","Sony Music Entertainment India Pvt. Ltd.",79,98,200,"1518026"
85,"spotify:track:0rk2X5TAhraBC5aCIXK2Rq","Jawad Ahmad, Shaarib Toshi, Arijit Singh, Shreya Ghoshal","Samjhawan","Sony Music Entertainment India Pvt. Ltd.",70,97,135,"1496979"
86,"spotify:track:3wz2vWhYnnBoFmgMkqtzLy","Chani Nattan, Inderpal Moga","Daku","Kharku Life Records",5,80,67,"1495323"
87,"spotify:track:3dpM3ijJz0vGzbkh5DcMXz","Payal Dev, Vishal Mishra, A.M. Turaz","Naseeb Se (From ""Satyaprem Ki Katha"")","T-Series",44,85,26,"1482658"
88,"spotify:track:4uK0M8AI6gyFmyzUneQpbi","A.R. Rahman, Arijit Singh, Shashaa Tirupati","Rait Zara Si (From ""Atrangi Re"")","T-Series",12,83,95,"1467612"
89,"spotify:track:48Ix6ReYdJf2H4mKb3TIpj","Atif Aslam, Alisha Chinai, Pritam","Tera Hone Laga Hoon","Tips Industries Ltd",59,105,133,"1458321"
90,"spotify:track:29m79w9xPMH4YCD6r8JSmV","AP Dhillon, Gurinder Gill, Intense","Excuses","RUN-UP RECORDS",1,89,110,"1453012"
91,"spotify:track:5Gy67YHzPZTk9Q0D73LAGH","Jeet Gannguli, Arijit Singh","Khamoshiyan (From ""Khamoshiyan"")","Sony Music Entertainment India Pvt. Ltd.",90,90,31,"1436996"
92,"spotify:track:6mTvwBzWTGDOVeCNQEqtOE","Amaal Mallik, Arijit Singh, Tulsi Kumar","Soch Na Sake","T-Series",64,102,48,"1436437"
93,"spotify:track:0TdWXMXyfTQ2qp5vvU9LID","Diljit Dosanjh, Intense","Case","DILJIT DOSANJH",44,71,8,"1428174"
94,"spotify:track:6O1RAYwmOqkcoJQr7J9SFJ","Manan Bhardwaj, Arijit Singh","Oonchi Oonchi Deewarein","T-Series",52,96,7,"1427284"
95,"spotify:track:2vPrBucKCfKmafHhSfJ2pt","Pritam, Arijit Singh, Amitabh Bhattacharya, Charan","Pyaar Hota Kayi Baar Hai (From ""Tu Jhoothi Main Makkaar"")","T-Series",9,101,42,"1424106"
96,"spotify:track:53QrRlALFJfZgdcGLKwy5s","Shubh","Dior","SHUBH",76,95,21,"1423839"
97,"spotify:track:2qgXrzJsry4KgYoJCpuaul","The Local Train","Choo Lo","The Local Train",78,78,23,"1412903"
98,"spotify:track:3WLJ7D5kh44K5eJ1NqZQ6W","Anuv Jain","Baarishein","Universal Music India Pvt. Ltd. (on behalf of Anuv Jain)",18,113,133,"1412823"
99,"spotify:track:4OcvkkpF3xmyCGGY5IBlgi","Akhil Sachdeva, Tulsi Kumar","Tera Ban Jaunga (From ""Kabir Singh"")","T-Series",4,88,220,"1410269"
100,"spotify:track:32VAw8DL9ixX5XSW2VLcZ4","Parmish Verma, PARDHAAN, Desi Crew","Aam Jahe Munde","Parmish Verma Films",29,86,21,"1406116"
101,"spotify:track:1d5lpW3gUyq537iuyrb9Lf","Aditya Rikhari","Samjho Na","CollabX Productions",73,92,32,"1401727"
102,"spotify:track:6Z4rRhYZVQsYKmrxD40tru","Riar Saab, Abhijay Sharma","Obsessed","Mass Appeal India, LLC",2,100,30,"1396975"
103,"spotify:track:0NuWRfZRWzn1oc9piFhK9n","MC SQUARE, Hiten","Laado","Sony Music Entertainment India Pvt. Ltd.",11,84,12,"1394767"
104,"spotify:track:51DEaelXeJJ6cFFYbX8Hal","Javed-Mohsin, Vishal Mishra, Shreya Ghoshal","Zihaal e Miskin","Universal Music India Pvt Ltd.",7,110,27,"1376361"
105,"spotify:track:0ojpEubhy4JNeVftmVuiN7","Vishal Mishra, Armaan Malik","Pehla Pyaar","T-Series",11,116,131,"1375011"
106,"spotify:track:0CtZpaOhtzvLV3FfcsVpQo","Vishal-Shekhar, Shilpa Rao, Caralisa Monteiro, Vishal Dadlani, Shekhar Ravjiani, Kumaar","Besharam Rang (From ""Pathaan"")","YRF Music",4,87,51,"1354963"
107,"spotify:track:3mUkVsovIuscQlSoMhmAZt","Madhur Sharma, Swapnil Tare, Nusrat Fateh Ali Khan","Kali Kali Zulfon Ke (Lo-Fi)","T-Series",6,103,64,"1353376"
108,"spotify:track:2tjWCe2W7sgvS3C8NHcdtI","Akhil, Dhvani Bhanushali, Kunaal Vermaa","Duniyaa (From ""Luka Chuppi"")","T-Series",1,112,249,"1350435"
109,"spotify:track:7lNbI1xd39QRdf6Mj8tvTv","Javed Ali","Saudebazi (Encore) [From ""Aakrosh""]","T-Series",108,108,14,"1344627"
110,"spotify:track:2qxmye6gAegTMjLKEBoR3d","Alec Benjamin","Let Me Down Slowly","2018",34,109,190,"1338112"
111,"spotify:track:3bQsp4Vr9Rg4fNCx6HPOgX","Anuv Jain","Alag Aasmaan","Universal Music India Pvt. Ltd. (on behalf of Anuv Jain)",111,150,11,"1334096"
112,"spotify:track:1dGr1c8CrMLDpV6mPbImSI","Taylor Swift","Lover","Taylor Swift",9,99,22,"1333908"
113,"spotify:track:0ZcMt3GYvVkBjdomag59NP","Addy Nagar, Aniket Jain","Kaley Sheshe","Sony Music Entertainment India Pvt. Ltd.",54,93,8,"1328687"
114,"spotify:track:64r6z0P3RnhpTGdkA7p5Os","Darshan Raval","Ek Tarfa","Indie Music Label",33,104,93,"1327283"
115,"spotify:track:5O932cZmzOZGOGZz9RHx20","Pritam, Arijit Singh","Khairiyat","T-Series",1,91,221,"1320200"
116,"spotify:track:3jyqXdAjwqO3gFtjnYrbq9","Darshan Raval, Rochak Kohli","Ek Ladki Ko Dekha Toh Aisa Laga (From ""Ek Ladki Ko Dekha Toh Aisa Laga"")","Saregama",59,132,54,"1318673"
117,"spotify:track:2eAvDnpXP5W0cVtiI0PUxV","Ruth B.","Dandelions","Columbia",14,118,105,"1314667"
118,"spotify:track:5O2P9iiztwhomNh8xkR9lJ","One Direction","Night Changes","Syco Music",22,125,133,"1311043"
119,"spotify:track:32765xcLM1fd6wQIpkN9A0","Ami Mishra, Kunaal Vermaa","Hasi - Male Version","Sony Music Entertainment India Pvt. Ltd.",98,114,22,"1307676"
120,"spotify:track:6FAYpZ4jve8vpvTwUvjK6H","Vishal-Shekhar, Arijit Singh, Sukriti Kakar, Vishal Dadlani, Shekhar Ravjiani, Kumaar","Jhoome Jo Pathaan","YRF Music",3,120,49,"1292328"
121,"spotify:track:2RgvvnMwtP0R2OkVZmFvnV","KK","Ajab Si (From ""Om Shanti Om"")","T-Series",34,147,99,"1290677"
122,"spotify:track:6V7UVqe8XnAS4WPdpaw5TK","Asees Kaur, Stebin Ben","Tu Mile Dil Khile","Saregama",20,122,42,"1287581"
123,"spotify:track:3eSm4iAkLsn3BeggfiQOH9","Gaurav Chatterji, Aasa Singh, Hansika Pareek, Hrishi Giridhar, Pratik Gangavane","Kaise Ab Kahein - From ""Gutar Gu""","Sikhya Entertainment Records",87,115,17,"1284844"
124,"spotify:track:0H2iJVgorRR0ZFgRqGUjUM","Pritam, Arijit Singh","Channa Mereya","Sony Music Entertainment India Pvt. Ltd.",58,156,201,"1275916"
125,"spotify:track:1YMLgvsQdE27r30q0fsLeV","Arijit Singh","Tera Fitoor","Tips Industries Ltd",87,163,22,"1263160"
126,"spotify:track:6FjbAnaPRPwiP3sciEYctO","Pritam, Arijit Singh","Raabta","T-Series",41,135,79,"1258363"
127,"spotify:track:6fScgF2Y63ScU73nYju0ny","Atif Aslam, Arko","O Saathi","T-Series",58,111,70,"1255767"
128,"spotify:track:5cF0dROlMOK5uNZtivgu50","Charlie Puth","Attention","Artist Partner",110,148,126,"1251057"
129,"spotify:track:5OxVOeYmIzelfupJtq1X6G","Anirudh Ravichander","Lokiverse 2.0","Sony Music Entertainment India Pvt. Ltd.",15,94,6,"1248612"
130,"spotify:track:43YkTTlOD203o9E5ZxhUjF","Arijit Singh","Main Dhoondne Ko Zamaane Mein (From ""Heartless"")","T-Series",62,128,112,"1246784"
131,"spotify:track:1Er6TEtbyuW1b9QtBVkggD","Karan Aujla, Ikky","Jee Ni Lagda","WM Canada",38,127,15,"1234803"
132,"spotify:track:1QZRCi2Z1DQQaR6bGAzhtN","Yo Yo Honey Singh","Love Dose","T-Series",32,123,13,"1231656"
133,"spotify:track:6ZYxNjuAU9Vy3VtF6W1dtE","Shubh","We Rollin","SHUBH",10,106,105,"1231176"
134,"spotify:track:5aMLADD1Ho6Ogq8s8mIzB9","Sachet-Parampara, Sachet Tandon, Parampara Tandon","Ram Siya Ram (From ""Adipurush"")","T-Series",11,146,26,"1221683"
135,"spotify:track:6V4N3h4HYD1Ask9cUTxjjg","Taimour Baig, Raffey Anwar, AUR","Long time no see","Universal Music MENA",66,133,6,"1221386"
136,"spotify:track:3rUGC1vUpkDG9CZFHMur1t","Tate McRae","greedy","RCA Records Label",119,119,5,"1219497"
137,"spotify:track:6bdpj89aYEBjhpsenXAsmO","A.R. Rahman, Arijit Singh","Enna Sona","Sony Music Entertainment India Pvt. Ltd.",34,139,134,"1215539"
138,"spotify:track:3qrdLVOClRU4yPkcXZ7c5u","Ayushmann Khurrana, Tanishk-Vayu","Mere Liye Tum Kaafi Ho (From ""Shubh Mangal Zyada Saavdhan"")","T-Series",11,142,197,"1214986"
139,"spotify:track:2AilvPt1AQ8PixlCKqkjfj","Shubh","Elevated","SHUBH",27,124,100,"1207450"
140,"spotify:track:5WXQbgwGwyauXOqswlEeQY","Tanishk Bagchi, Arijit Singh, Asees Kaur","Bolna (From ""Kapoor & Sons (Since 1921)"")","Sony Music Entertainment India Pvt. Ltd.",101,136,40,"1205435"
141,"spotify:track:1aL9518P5G72N92b48tuKw","AP Dhillon","Summer High","RUN-UP RECORDS",3,131,69,"1204763"
142,"spotify:track:6cUOiOY5qh2FpIQWIYAd2h","Pritam, Darshan Raval, Antara Mitra","Mehrama","Sony Music Entertainment India Pvt. Ltd.",10,152,157,"1199023"
143,"spotify:track:4SqPZorSDuUtvdJwVGeZRC","Pritam, Arijit Singh, Amitabh Bhattacharya, Jonita Gandhi","Deva Deva","Sony Music Entertainment India Pvt. Ltd.",5,144,69,"1197582"
144,"spotify:track:28lvraTNIN8qiTpoIK7m8Z","AP Dhillon, Shinda Kahlon","True Stories","Mass Appeal India",15,149,24,"1192726"
145,"spotify:track:03yKEFruN3BS2coglBtt2N","Laddi Chahal, Parmish Verma, Gurlez Akhtar","Rubicon Drill","Parmish Verma Films",12,141,50,"1179299"
146,"spotify:track:1AMD2AkfGrKoKhwkvYLbza","Sunny Yaduvanshi, AK Rok, Nitesh Ujoli","Yadav Brand 2","Flame Music",9,121,38,"1179274"
147,"spotify:track:7mSzDKajY2wUtstQSLdzMK","Mohit Chauhan, Rochak Kohli","Rang Lageya","Saregama",35,157,44,"1175455"
148,"spotify:track:7qiZfU4dY1lWllzX7mPBI3","Ed Sheeran","Shape of You","Atlantic Records UK",63,153,186,"1173366"
149,"spotify:track:6chviF7naWfxVOF91dkdqb","Vidyasagar, Krishnachandar, Sujatha","Thamarai Poovukum","Magnasound",104,130,5,"1170378"
150,"spotify:track:6gwnKOvdBKkTU4CQ7KpIAu","Shaarib Toshi, Arijit Singh","Bandeya - From ""Dil Juunglee""","Pooja Music",70,173,63,"1161543"
151,"spotify:track:1cPDOeVdALLjj4erFPiuqW","Anirudh Ravichander, Shilpa Rao, Arunraja Kamaraj","Kaavaalaa","Sun Pictures",10,129,21,"1152574"
152,"spotify:track:7v0t3o17J796y9OG2n3ebl","B Praak, Jaani","Kya Loge Tum","Universal Music India Pvt Ltd. – Distribution",10,168,28,"1152083"
153,"spotify:track:5PyDJG7SQRgWXefgexqIge","Doja Cat","Agora Hills","Kemosabe Records/RCA Records",153,159,3,"1149378"
154,"spotify:track:3B9CL5t32mM2SDdps2IhYM","Saad Lamjarred, Shreya Ghoshal, Rajat Nagpal","Guli Mata","PlayDMF",36,143,17,"1145453"
155,"spotify:track:5inzjqKe05zP1eInEO8O1i","Anirudh Ravichander, Vishal Dadlani, Shilpa Rao, Kumaar","Not Ramaiya Vastavaiya","T-Series",20,137,13,"1137760"
156,"spotify:track:2y0hUGvHaKm2p5xmJF4HBe","Arijit Singh","Saware (From ""Phantom"")","T-Series",82,170,41,"1136097"
157,"spotify:track:1ZMq0qzXfGnFo7BN03yddJ","Arjun Kanungo, King","Ilzaam (From the Album 'Industry')","One Mind Music",85,160,34,"1133074"
158,"spotify:track:1RdrAqXa2fUj2XytsKaUwl","Irshad Khan","Haryana Hood","Bajewala Records Haryanvi",40,154,32,"1128717"
159,"spotify:track:567e29TDzLwZwfDuEpGTwo","The Kid LAROI, Justin Bieber","STAY (with Justin Bieber)","Columbia",1,164,125,"1125652"
160,"spotify:track:7wW9scVNLYFLsmBb1yAUmS","Yo Yo Honey Singh","Blue Eyes","T-Series",38,158,10,"1121425"
161,"spotify:track:2HRgqmZQC0MC7GeNuDIXHN","Jung Kook, Latto","Seven (feat. Latto) (Explicit Ver.)","BIGHIT MUSIC",5,145,20,"1119311"
162,"spotify:track:3wwLWFRLiReDf5AqgmAJwT","Rito Riba, Rajat Nagpal, Rana Sotal","Heer Ranjha","PlayDMF",11,172,57,"1117457"
163,"spotify:track:56y1jOTK0XSvJzVv9vHQBK","Doja Cat","Paint The Town Red","Kemosabe Records/RCA Records",45,167,13,"1113132"
164,"spotify:track:3JkVYvxNoGf2HCWJo61462","Sidhu Moose Wala, Sunny Malton, SOE","Never Fold","Sidhu Moose Wala",13,140,84,"1108123"
165,"spotify:track:72Z2D7jpKevicRkyL45mbw","Pritam, Arijit Singh, IP Singh, Swanand Kirkire","Lutt Putt Gaya (From ""Dunki"")","T-Series",165,-1,1,"1103588"
166,"spotify:track:0MbOLfDcGk8ROHJYXJHu5c","Badshah, Karan Aujla, Devika Badyal","Players","Universal Music India Pvt Ltd.",7,177,48,"1100582"
167,"spotify:track:4OEBP1iwGmLtcM8UKRLm80","Arijit Singh, Antara Mitra","Itni Si Baat Hain (From ""Azhar"")","T-Series",167,192,3,"1099435"
168,"spotify:track:5Y7Y315vZkOZbesJ22jXkK","Govind Vasantha, Pradeep Kumar, Shakthisree Gopalan","Railin Oligal - From ""Blue Star""","Think Music",55,151,9,"1093589"
169,"spotify:track:2n9ylYiF7urpXo36qBwr3g","Stebin Ben","Mera Dil Bhi Kitna Pagal Hai - Recreated Version","Ishtar Music Pvt. Ltd.",70,166,31,"1092622"
170,"spotify:track:1feANd8EfcDP5UqSvbheM3","Sachet Tandon, Sachet-Parampara","Bekhayali (From ""Kabir Singh"")","T-Series",1,165,203,"1091490"
171,"spotify:track:6MZyrnqwsLnrWY5Gk0AyXg","Suzonn","Farq hai","Suzonn",60,162,12,"1080438"
172,"spotify:track:0biCSADTAblvLTLtJz4pXO","Vishal-Shekhar, Arijit Singh, Caralisa Monteiro, Jaideep Sahni","Nashe Si Chadh Gayi","YRF Music",151,179,17,"1080437"
173,"spotify:track:6R9DVbFDwO8pwwkd515vyr","Neelkamal Singh","Heroine","Saregama",173,-1,1,"1079271"
174,"spotify:track:4iEGv5Ne6HuCkFCjzxdWQK","Neeti Mohan","Meri Jaan","Saregama",11,161,58,"1076638"
175,"spotify:track:6vPFDbyzSYWAL7r3Waa7BZ","Anirudh Ravichander","I'm Scared (From ""Leo"")","Sony Music Entertainment India Pvt. Ltd.",44,126,5,"1075824"
176,"spotify:track:2IEhtVeM9TVql8fZdKdlo9","Atif Aslam, Chinmayi, Pritam","Main Rang Sharbaton Ka","Tips Industries Ltd",126,-1,17,"1075779"
177,"spotify:track:4RCd3Gdtt3dNedof64hqRD","Mohammed Irfan, Arijit Singh, Saim Bhat","Phir Mohabbat (From ""Murder 2"")","T-Series",160,190,6,"1074920"
178,"spotify:track:7Imk0IG6S5GA5iYWkjmMW5","Palak Muchhal, Arijit Singh","Chahun Main Ya Naa (From ""Aashiqui 2"")","T-Series",169,184,7,"1064013"
179,"spotify:track:18YHbIhrleUkKKj2DvEp79","Pritam, KK","Zara Sa","Sony Music Entertainment India Pvt. Ltd.",33,196,44,"1059289"
180,"spotify:track:1Y3LN4zO1Edc2EluIoSPJN","Stephen Sanchez, Em Beihold","Until I Found You (with Em Beihold) - Em Beihold Version","Republic Records",24,188,51,"1058652"
181,"spotify:track:60d1uQmqTZ1Lg2SGJYdQTI","Shankar-Ehsaan-Loy, Adnan Sami, Shankar Mahadevan, Shreya Ghoshal","Noor E Khuda","Sony Music Entertainment India Pvt. Ltd.",181,-1,1,"1057146"
182,"spotify:track:3FbZoPzEaUBOD84l1FwFEH","Darshan Raval","Mujhe Peene Do","Indie Music Label",56,183,28,"1053746"
183,"spotify:track:0Bz7dfqPY4JOGZO3O1j8Wh","Pritam, Amit Mishra, Shilpa Rao","Bulleya","Sony Music Entertainment India Pvt. Ltd.",167,-1,17,"1053266"
184,"spotify:track:3yRLROmAcKJBqTrdEczFB8","Yo Yo Honey Singh","Brown Rang","Times Music",48,178,10,"1052661"
185,"spotify:track:6EB454nVg2u6sbeCvWAPej","Sam C.S., Anirudh Ravichander, Shakthisree Gopalan","Yaanji - From ""Vikram Vedha""","Think Music",122,171,29,"1046104"
186,"spotify:track:7lvDsmTRXFE3dK4OjvRiWB","Shae Gill, Ali Sethi","Pasoori","Giraffe Pakistan",1,176,93,"1045525"
187,"spotify:track:4kaLkst9lT3sQ5Crgxs3ic","Ayushmann Khurrana","Pani Da Rang - Male Vocals","Eros Now Music",68,-1,16,"1037340"
188,"spotify:track:0tpwqQhdfJXRcUDSNRjb9O","Arijit Singh, Neeti Mohan, Rashmi Virag","Mere Yaaraa (From ""Sooryavanshi"")","T-Series",20,187,81,"1036717"
189,"spotify:track:2uWZ7EGddFlA1DJ3Rzzvs2","Karan Aujla, Ikky, Yarah","Bachke Bachke (feat. Yarah)","WM Canada",57,175,14,"1033188"
