rank,uri,artist_names,track_name,source,peak_rank,previous_rank,weeks_on_chart,streams
1,"spotify:track:4VsP4Dm8gsibRxB5I2hEkw","Kaifi Khalil","Kahani Suno 2.0","1944121 Records DK",1,3,10,"9403482"
2,"spotify:track:1418IuVKQPTYqt7QNJ9RXN","King","Maan Meri Jaan","Warner Music India",1,1,19,"9400301"
4,"spotify:track:6FAYpZ4jve8vpvTwUvjK6H","Vishal-Shekhar, Arijit Singh, Sukriti Kakar, Vishal Dadlani, Shekhar Ravjiani, Kumaar","Jhoome Jo Pathaan","YRF Music",3,4,9,"5313209"
5,"spotify:track:0CtZpaOhtzvLV3FfcsVpQo","Vishal-Shekhar, Shilpa Rao, Caralisa Monteiro, Vishal Dadlani, Shekhar Ravjiani, Kumaar","Besharam Rang (From ""Pathaan"")","YRF Music",4,5,11,"5182032"
6,"spotify:track:4UMIv5jd9gK98a39BQRD9X","Pritam, Arijit Singh, Amitabh Bhattacharya","Kesariya","Sony Music Entertainment India Pvt. Ltd.",1,6,32,"4752694"
7,"spotify:track:3wz2vWhYnnBoFmgMkqtzLy","Chani Nattan, Inderpal Moga","Daku","Kharku Life Records",5,7,27,"4106551"
8,"spotify:track:2ZD4aIEepqZsdxPxLSuUhm","Pritam, Arijit Singh, Amitabh Bhattacharya, Nikhita Gandhi","Tere Pyaar Mein","T-Series",8,8,3,"3775906"
9,"spotify:track:0cgwdBXXlPfXJXWf3wMs32","G. V. Prakash, Shweta Mohan","Vaa Vaathi","Aditya Music",9,37,15,"3604564"
10,"spotify:track:0yCWDaAgOtg6TKlNCg9rwA","King","Tu Aake Dekhle","Warner Music India",3,9,108,"3469641"
11,"spotify:track:08Isz2ETWSBhvIl8UpKYsp","Shubh","No Love","SHUBH",2,11,50,"3463124"
12,"spotify:track:42TMa2hgBNjte4uV7jNCnQ","Shubh, Ikky","Baller","SHUBH",2,13,24,"3279354"
13,"spotify:track:72zHuDxFQTjbL51qJQSA7j","Jasleen Royal, B Praak, Romy, Anvita Dutt","Ranjha (From ""Shershaah"")","Sony Music Entertainment India Pvt. Ltd.",1,10,81,"3261918"
14,"spotify:track:7oN0Wo7sCVvXPdpxoio3JM","Madhur Sharma, Swapnil Tare, Nusrat Fateh Ali Khan","Kali Kali Zulfon Ke (Lo-Fi)","T-Series",6,14,25,"3234912"
15,"spotify:track:54ipXppHLA8U4yqpOFTUhr","Imagine Dragons","Bones","Kid Ina Korner / Interscope",15,16,12,"3216782"
16,"spotify:track:73K33p4Vyz9koXGqmL5eFs","Sachet Tandon, Parampara Tandon, Kumaar, Sachet-Parampara","Malang Sajna","T-Series",16,18,5,"3198412"
17,"spotify:track:0snQrp1VaY5Pj1YIHRJpRJ","Aditya A","Chaand Baaliyan","Sony Music Entertainment India Pvt. Ltd.",2,17,53,"2880154"
18,"spotify:track:6rFckZb1cuJYzsZiGHgqks","Karan Aujla, Ikky","52 Bars","Rehaan Records",12,12,3,"2868635"
19,"spotify:track:0WtM2NBVQNNJLh6scP13H8","Rema, Selena Gomez","Calm Down (with Selena Gomez)","Mavin Records / Jonzing World",16,22,23,"2780769"
20,"spotify:track:0zlGnseLGzRIBA0TJcb3Bo","Yohani, Jubin Nautiyal, Tanishk Bagchi, Rashmi Virag, Surya Ragunaathan","Manike (From ""Thank God"")","T-Series",2,19,23,"2754289"
21,"spotify:track:0MbOLfDcGk8ROHJYXJHu5c","Badshah, Karan Aujla, Devika Badyal","Players","Universal Music India Pvt Ltd.",7,25,9,"2750985"
22,"spotify:track:2rOnSn2piaqLAlYjtfUBlY","Tanishk Bagchi, Jubin Nautiyal, Asees Kaur","Raataan Lambiyan (From ""Shershaah"")","Sony Music Entertainment India Pvt. Ltd.",1,15,82,"2708865"
23,"spotify:track:4ZVtid5khBfDx6Co0vTUE6","Jassa Dhillon, thiarajxtt","SPAIN","Jassa Dhillon",23,38,4,"2707440"
24,"spotify:track:3oWv5qDKYN7MH6FdlglMN5","Guru Randhawa, Sanjoy","Moon Rise","T-Series",18,23,10,"2679630"
25,"spotify:track:0uk9sQ7MjK0CdAUinD4xBV","MC STAN","Ek Din Pyaar","MC Stan",21,21,14,"2666417"
26,"spotify:track:6FrihRowEuYfNehH0zcx0e","DG IMMORTALS, Raga, Harjas Harjaayi, VIRTUAL_AF, DARK HORSE","KALESHI CHORI","Universal Music India Pvt Ltd.",10,20,8,"2652343"
27,"spotify:track:2vPrBucKCfKmafHhSfJ2pt","Pritam, Arijit Singh, Amitabh Bhattacharya, Charan","Pyaar Hota Kayi Baar Hai (From ""Tu Jhoothi Main Makkaar"")","T-Series",27,71,2,"2595775"
28,"spotify:track:24MMjyA3NLqCsDJfsn51eg","Sharn, 40k, The Paul","Mi Amor","Desi Avenue",28,30,6,"2555695"
29,"spotify:track:29m79w9xPMH4YCD6r8JSmV","AP Dhillon, Gurinder Gill, Intense","Excuses","RUN-UP RECORDS",1,26,70,"2521309"
30,"spotify:track:2FCXQHugkoHE1K3tiDu8pu","Alka Yagnik, Arijit Singh","Agar Tum Saath Ho (From ""Tamasha"")","T-Series",4,27,195,"2494380"
31,"spotify:track:0NZPBYD5qbEWRs3PrGiRkT","Sam Smith, Kim Petras","Unholy (feat. Kim Petras)","Capitol Records UK / EMI",6,24,21,"2479228"
32,"spotify:track:5iCY0TXNImK4hyKfcplQsg","Anuv Jain","Baarishein","Universal Music India Pvt. Ltd. (on behalf of Anuv Jain)",25,29,93,"2392065"
33,"spotify:track:7MXVkk9YMctZqd1Srtv4MB","The Weeknd, Daft Punk","Starboy","Universal Republic Records",33,41,82,"2340570"
34,"spotify:track:5si4xdFplkXAydKfFe1xXa","Karan Aujla, Ikky","Take It Easy","Rehaan Records",34,48,3,"2310655"
35,"spotify:track:26b3oVLrRUaaybJulow9kz","Libianca","People","5K Records Limited",35,55,4,"2289802"
36,"spotify:track:7lvDsmTRXFE3dK4OjvRiWB","Shae Gill, Ali Sethi","Pasoori","Giraffe Pakistan",1,31,53,"2226374"
37,"spotify:track:1a8w8nlIyIhE2W1HIayKnl","Amit Trivedi, Amitabh Bhattacharya, Sireesha Bhagavatula","Ghodey Pe Sawaar (From ""Qala"")","Sony Music Entertainment India Pvt. Ltd. / Netflix Music Inc.",11,28,9,"2226250"
38,"spotify:track:1LbBOhicFmu7ktJqIHCELt","Thalapathy Vijay, M.M.Manasi, Thaman S","Ranjithame (From ""Varisu"")","T-Series",9,33,16,"2191282"
39,"spotify:track:3k9PtGmPNnQtt32TKWm6f3","MC STAN","Basti Ka Hasti","MC Stan",35,35,20,"2175698"
40,"spotify:track:6TClJ8jXi3OBV7gcrU3jx5","AP Dhillon, Gurinder Gill","TERE TE","RUN-UP RECORDS",7,36,66,"2110317"
41,"spotify:track:1smFN2CLqGROu0J0UyvDfL","Pritam, Arijit Singh","Shayad","Sony Music Entertainment India Pvt. Ltd.",1,32,162,"2096770"
42,"spotify:track:6ZYxNjuAU9Vy3VtF6W1dtE","Shubh","We Rollin","SHUBH",10,42,65,"2084791"
44,"spotify:track:2AilvPt1AQ8PixlCKqkjfj","Shubh","Elevated","SHUBH",27,46,60,"2081163"
45,"spotify:track:561jH07mF1jHuk7KlaeF0s","Eminem","Mockingbird","Aftermath",24,45,12,"2076172"
46,"spotify:track:7gFzBppKTiKAs38SWOjbO6","Vilen","Kyun Dhunde - 1 Min Music","Universal Music India Pvt Ltd.",22,43,17,"2036853"
48,"spotify:track:03yKEFruN3BS2coglBtt2N","Laddi Chahal, Parmish Verma, Gurlez Akhtar","Rubicon Drill","Parmish Verma Films",48,51,10,"2022355"
49,"spotify:track:7E0A86Yhc0ZyOl6aAPE5wN","Tanishk Bagchi, Anu Malik, Abhijeet","Main Khiladi - From ""Selfiee""","Desi Music Factory",44,44,3,"2015823"
50,"spotify:track:7fRIo7WyDxXn3r233GCcdL","Thaman S, Anirudh Ravichander, Jonita Gandhi","Jimikki Ponnu","T-Series",37,47,8,"2000560"
51,"spotify:track:0tgVpDi06FyKpA1z0VMD4v","Ed Sheeran","Perfect","Atlantic Records UK",48,52,149,"1958111"
52,"spotify:track:6TK7jseRCrogw9IzQYkw2h","Silambarasan TR, Thaman S","Thee Thalapathy (From ""Varisu"")","T-Series",11,39,12,"1913952"
53,"spotify:track:6biqkuWq069vByAEeGxZlr","Shubh","Her","SHUBH",30,50,12,"1901104"
54,"spotify:track:74X9AEKHrrxlWpK1XQRAc8","Prashant Katheriya","Tum Chhupa Na Sakogi","Nawazish Productions",46,53,13,"1880495"
55,"spotify:track:0QT9B8Yfrz0vi66oXMrKJg","Pritam, Amitabh Bhattacharya, Neeraj Shridhar, Abhijit Vaghani, Ashish Pandit","Character Dheela 2.0 (From ""Shehzada"")","T-Series",55,114,2,"1851780"
56,"spotify:track:4SJMuaIYcBS8ke96lDYOsw","Karan Aujla","On Top","Karan Aujla Music",17,57,13,"1849184"
57,"spotify:track:3yV2c3cYhkAwSsxAq6nRiv","Gajendra Verma","Mann Mera","Sony Music / Eros Now Music",33,54,101,"1834583"
58,"spotify:track:5IgjP7X4th6nMNDh4akUHb","Chris Brown","Under The Influence","Chris Brown Entertainment/RCA Records",7,56,28,"1829545"
60,"spotify:track:59eeV0SIeyd431uyjAWCRe","G. V. Prakash, Shweta Mohan","Mastaaru Mastaaru","Aditya Music",60,-1,1,"1819464"
61,"spotify:track:2eAvDnpXP5W0cVtiI0PUxV","Ruth B.","Dandelions","Columbia",14,59,65,"1812729"
62,"spotify:track:3nKQrVVlwbAQSnFbgZWdN0","Avvy Sra, Karan Aujla, Jaani","White Brown Black","Universal Music India Pvt Ltd. – Distribution",49,61,10,"1802601"
63,"spotify:track:1aL9518P5G72N92b48tuKw","AP Dhillon","Summer High","RUN-UP RECORDS",3,60,29,"1790876"
64,"spotify:track:3H3x4NhR3wJh6IvRHmPvkd","Thaman S, Srivardhani Kuchi, Aditi, Satya Yamini, Roshini, Tejaswini","Tum Tum (From ""Enemy"")","Divo",35,84,37,"1713945"
65,"spotify:track:5O2P9iiztwhomNh8xkR9lJ","One Direction","Night Changes","Syco Music",22,68,93,"1705783"
66,"spotify:track:6V7UVqe8XnAS4WPdpaw5TK","Asees Kaur, Stebin Ben","Tu Mile Dil Khile","Saregama",20,40,5,"1705192"
67,"spotify:track:1y1rQTkWmrZdJmjwuK07GC","Vishal Mishra","Kaise Hua (From ""Kabir Singh"")","T-Series",5,58,193,"1675745"
68,"spotify:track:3ZGJhN4unVspOqpwGvUL2W","Diljit Dosanjh","Lemonade","DILJIT DOSANJH",33,80,30,"1672203"
69,"spotify:track:5W7DOVGQLTigu09afW7QMT","Sidhu Moose Wala","295","Sidhu Moose Wala",1,64,54,"1667626"
70,"spotify:track:7FVgT8XjxUSfKuZuHxg316","Prince Narula, Munawar Faruqui, Rony Ajnali","Todh","EYP Creations",22,62,12,"1655040"
71,"spotify:track:7eQl3Yqv35ioqUfveKHitE","Pritam, Mohit Chauhan","Tum Se Hi","T-Series",53,77,153,"1648539"
72,"spotify:track:2QophXhN2Ls2URfoPmiviC","Taaruk Raina, Mismatched - Cast","Kho Gaye","Netflix Music",8,63,19,"1635155"
73,"spotify:track:4bD9z9qa4qg9BhryvYWB7c","Pritam, Tochi Raina, Rekha Bhardwaj","Kabira","T-Series",50,67,180,"1550442"
74,"spotify:track:5ZhKD46Q7mhsl0awl7ZMJc","Atif Aslam","Jeena Jeena","Eros Now Music",72,72,87,"1542791"
75,"spotify:track:0ojpEubhy4JNeVftmVuiN7","Vishal Mishra, Armaan Malik","Pehla Pyaar","T-Series",11,65,91,"1541119"
76,"spotify:track:1Y3LN4zO1Edc2EluIoSPJN","Stephen Sanchez, Em Beihold","Until I Found You (with Em Beihold) - Em Beihold Version","Republic Records",29,116,12,"1536915"
77,"spotify:track:6udC4b4jOSnHb9ItnXgKLR","Sachin-Jigar, Shreya Ghoshal, Tochi Raina","Saibo","Sony Music Entertainment India Pvt. Ltd.",61,70,121,"1533662"
78,"spotify:track:6FjbAnaPRPwiP3sciEYctO","Pritam, Arijit Singh","Raabta","T-Series",74,78,39,"1511429"
80,"spotify:track:567e29TDzLwZwfDuEpGTwo","The Kid LAROI, Justin Bieber","STAY (with Justin Bieber)","Columbia",1,83,85,"1489844"
81,"spotify:track:3wwLWFRLiReDf5AqgmAJwT","Rito Riba, Rajat Nagpal, Rana Sotal","Heer Ranjha","PlayDMF",11,69,18,"1485282"
82,"spotify:track:2nKwKOpdXnHuJgC5iItUxN","Harris Jayaraj, Rohini, Pritt, dilushselva","Unakkul Naane","Ayngaran",51,74,8,"1478705"
84,"spotify:track:0aA3jlllhKSEiXTmGPGSWz","Jeetu Sharma, Abhilipsa Panda","Har Har Shambhu Shiv Mahadeva","Jeetu Sharma",15,-1,28,"1457610"
85,"spotify:track:5urYiIXu1ZhfMAOsp7WDTc","Yasser Desai, Neha Kakkar, Rajat Nagpal","Dil Ko Karaar Aaya (From ""Sukoon"")","Desi Music Factory",3,73,92,"1457151"
86,"spotify:track:45C7tXCrmp3R5E65XUtLLj","Tanishk Bagchi, Faridkot, Yohani, Amar Jalal, Harjot Kaur","Jehda Nasha (From ""An Action Hero"")","T-Series",27,66,14,"1446302"
87,"spotify:track:3uCmVdJNi3Ci4bidF0mdHb","Paradox","Jaadugar","T-Series",13,79,20,"1431070"
88,"spotify:track:6VhuP99TE6gYNQRJIlAWFD","Stephen Sanchez","Until I Found You","Republic Records",20,101,43,"1428585"
89,"spotify:track:2tjWCe2W7sgvS3C8NHcdtI","Akhil, Dhvani Bhanushali, Kunaal Vermaa","Duniyaa (From ""Luka Chuppi"")","T-Series",1,82,209,"1424817"
90,"spotify:track:7AsG1F1eMWd17RYan8M3Wm","AP Dhillon, Shinda Kahlon","Dil Nu","RUN-UP RECORDS",82,85,20,"1423332"
91,"spotify:track:60YICjIPdL7LDBcCMK0tAk","Sidhu Moose Wala, Sunny Malton, The Kidd","Levels","Sidhu Moose Wala",8,81,39,"1420170"
92,"spotify:track:0o9zmvc5f3EFApU52PPIyW","Fujii Kaze","Shinunoga E-Wa","Universal Music LLC",42,99,17,"1419579"
93,"spotify:track:32LKwbmh6yVsWoRRF8DIvf","Pav Dharia","Na Ja","Ishtar-White Hill Music",35,95,68,"1407310"
94,"spotify:track:02MWAaffLxlfxAUY7c5dvx","Glass Animals","Heat Waves","Polydor Records",3,89,84,"1399831"
95,"spotify:track:4SqPZorSDuUtvdJwVGeZRC","Pritam, Arijit Singh, Amitabh Bhattacharya, Jonita Gandhi","Deva Deva","Sony Music Entertainment India Pvt. Ltd.",5,103,29,"1377914"
96,"spotify:track:0pqnGHJpmpxLKifKRmU6WP","Imagine Dragons","Believer","Kid Ina Korner / Interscope",25,102,209,"1371466"
97,"spotify:track:3cjA9xteIeOj82os8oSo4i","Juss, MixSingh","Safar","Mix It Up Studio",75,91,13,"1345816"
98,"spotify:track:0dLbrlAVPPjpPqnYfmJsWk","Atif Aslam, Alisha Chinai, Pritam","Tera Hone Laga Hoon","Tips Industries Ltd",83,90,93,"1344847"
99,"spotify:track:2tMoOS9grHtn4upzb4LwMG","Dhibu Ninan Thomas, Kapil Kapilan","Adiye - From ""Bachelor""","Think Music",16,100,64,"1329776"
100,"spotify:track:3gOXq3FPPesm7VLPKmef6j","Arijit Singh, Shashaa Tirupati","Rait Zara Si","T-Series",12,87,64,"1328323"
101,"spotify:track:6tkl6rjuXWtVOCaXSSSCz2","Armaan Malik","Jab Tak (From ""M.S.Dhoni - The Untold Story"")","T-Series",37,97,41,"1327611"
102,"spotify:track:2qxmye6gAegTMjLKEBoR3d","Alec Benjamin","Let Me Down Slowly","2018",34,92,150,"1323013"
103,"spotify:track:58HvfVOeJY7lUuCqF0m3ly","Elley Duhé","MIDDLE OF THE NIGHT","Not Fit For Society/RCA Records",12,107,60,"1292945"
104,"spotify:track:0uHpY2weZMUCUTqlf8OD74","Karan Aujla, Ikky","Yeah Naah","Rehaan Records",88,88,3,"1289904"
105,"spotify:track:5G7pZ8G8NFvS1MQ9H4L7dC","Javed-Mohsin, Arijit Singh, Shreya Ghoshal, Kunaal Vermaa, Prashant Ingole","Pal","Sony Music Entertainment India Pvt. Ltd.",44,96,207,"1288283"
106,"spotify:track:3JkVYvxNoGf2HCWJo61462","Sidhu Moose Wala, Sunny Malton, SOE","Never Fold","Sidhu Moose Wala",13,105,44,"1287776"
107,"spotify:track:0NODNDsiY0sK5P0TnmDMSE","Pritam, Diljit Dosanjh, Nikhita Gandhi, Kumaar","Munda Sona Hoon Main (From ""Shehzada"")","T-Series",68,86,4,"1276148"
108,"spotify:track:2J2Z1SkXYghSajLibnQHOa","Sia","Unstoppable","Monkey Puzzle Records/RCA Records",16,110,82,"1275385"
109,"spotify:track:7B4uYqxTpTOS1sgxFB9Ann","Sidhu Moose Wala, Wazir Patar","The Last Ride","Sidhu Moose Wala",3,108,41,"1272067"
110,"spotify:track:6H7fLdt0AeWpuxUKXuXWrx","Hariharan","Shree Hanuman Chalisa","T-Series",98,98,28,"1267867"
111,"spotify:track:7qiZfU4dY1lWllzX7mPBI3","Ed Sheeran","Shape of You","Atlantic Records UK",63,117,146,"1265915"
112,"spotify:track:0yLdNVWF3Srea0uzk55zFn","Miley Cyrus","Flowers","Columbia",43,94,5,"1258684"
113,"spotify:track:1Nr46gjiP50uPsz30gYhAd","Santhosh Narayanan, Anirudh Ravichander","Thenmozhi (From ""Thiruchitrambalam"")","Sun Pictures",5,131,28,"1251783"
114,"spotify:track:1AzNN19lPYC68iacrbWL8X","Darbuka Siva, Sid Sriram","Mudhal Nee Mudivum Nee Title Track (From ""Mudhal Nee Mudivum Nee"")","Sony Music Entertainment India Pvt. Ltd.",24,119,41,"1249466"
115,"spotify:track:0FBQ4NrrHUbR9kus7rzrOj","Atif Aslam","Dil Diyan Gallan","YRF Music",82,106,158,"1241058"
116,"spotify:track:0VjIjW4GlUZAMYd2vXMi3b","The Weeknd","Blinding Lights","Republic Records",4,128,169,"1238876"
117,"spotify:track:3APdIdF8H0jsxSuGOqXedS","Rashid Ali","Kabhi Kabhi Aditi","T-Series",86,122,67,"1237707"
118,"spotify:track:3qrdLVOClRU4yPkcXZ7c5u","Ayushmann Khurrana, Tanishk-Vayu","Mere Liye Tum Kaafi Ho (From ""Shubh Mangal Zyada Saavdhan"")","T-Series",11,104,157,"1235967"
119,"spotify:track:7ouBSPZKQpm7zQz2leJXta","Arijit Singh","Tum Hi Ho (From ""Aashiqui 2"")","T-Series",78,109,108,"1222681"
121,"spotify:track:2Fv2injs4qAm8mJBGaxVKU","Arijit Singh, Mithoon","Tujhe Kitna Chahne Lage (From ""Kabir Singh"")","T-Series",2,112,195,"1197605"
122,"spotify:track:4Dvkj6JhhA12EX05fT7y2e","Harry Styles","As It Was","Columbia",5,125,47,"1197592"
123,"spotify:track:14WLGWYd2wxho2cnDkLTBF","Anirudh Ravichander, Leon James, Kasarla Shyam","Gundellonaa (From ""Ori Devuda"")","Saregama",47,121,17,"1192778"
124,"spotify:track:1T44wPr7LUlBY4vX6LlygG","DIVINE, Armani White","Baazigar","Mass Appeal India",18,118,15,"1188940"
125,"spotify:track:6XYQvYJzHjK5150Vl7NKfJ","Sid Sriram, Sreejith Edavana","Kaadhal En Kaviye - From ""Salmon 3D""","MRT Music",8,134,37,"1184103"
126,"spotify:track:2vR23BjIzpLMtzsyKrM6Mb","Kailash Kher, Paresh Kamath, Naresh Kamath","Saiyyan","Sony Music Entertainment India Pvt. Ltd.",126,190,8,"1173183"
127,"spotify:track:6DefzsWqnwrFrmNVnJxWkS","Asim Azhar","Jo Tu Na Mila","Universal Music India Pvt Ltd.",89,113,30,"1167863"
128,"spotify:track:1ccZZf0IQi5y0bHMl2aGDF","Sanam","Gulabi Aankhen","Universal Music India Pvt Ltd.",103,136,25,"1167393"
130,"spotify:track:2FZDNh6tm9mkZ9vTphuAh8","Pritam, Tanishk Bagchi, Neeraj Shridhar","Bhool Bhulaiyaa 2 Title Track","T-Series",7,120,43,"1158829"
131,"spotify:track:5iVYMQKl3OZi0ULxeKAkho","Navaan Sandhu","Hood Famous","Sky Digital",115,115,3,"1140225"
132,"spotify:track:6yvxu91deFKt3X1QoV6qMv","Anirudh Ravichander, Jonita Gandhi","Arabic Kuthu - Halamithi Habibo (From ""Beast"")","Sun Pictures",2,137,54,"1139196"
133,"spotify:track:0NLkVxf0PyxsXBG3EuZcJf","Anuv Jain","Gul","Universal Music India Pvt. Ltd. (on behalf of Anuv Jain)",76,130,23,"1133459"
134,"spotify:track:2RgvvnMwtP0R2OkVZmFvnV","KK","Ajab Si (From ""Om Shanti Om"")","T-Series",46,127,59,"1132965"
135,"spotify:track:5XeFesFbtLpXzIVDNQP22n","Arctic Monkeys","I Wanna Be Yours","Domino Recording Co",110,148,15,"1130386"
136,"spotify:track:3UhmuWcFaLS3AO3kI9ynQ2","AP Dhillon, Shinda Kahlon, Gurinder Gill, Gminxr","Insane","RUN-UP RECORDS",3,138,97,"1129005"
137,"spotify:track:1hQia6rxgfM1ly2hE3StWp","Vishal-Shekhar, Salim Merchant, Neeti Mohan, Shekhar Ravjiani","Ishq Wala Love","Sony Music Entertainment India Pvt. Ltd.",118,126,28,"1125084"
138,"spotify:track:1eHkjvvyncnmjgwCSGI0el","Emiway Bantai","Company","Bantai Studio",138,-1,1,"1125046"
139,"spotify:track:7mSzDKajY2wUtstQSLdzMK","Mohit Chauhan, Rochak Kohli","Rang Lageya","Saregama",135,135,4,"1122901"
140,"spotify:track:2I0MIQhICYnKHvaxUHYH49","Amit Trivedi, Varun Grover, Shahid Mallya, Sireesha Bhagavatula, Swanand Kirkire","Shauq","Sony Music Entertainment India Pvt. Ltd. / Netflix Music Inc.",57,93,8,"1122211"
141,"spotify:track:5pebgx4IJ5YvZH2sYOHDRf","Barney Sku, Taqiya Zaman","Your Eyes","Barney Sku",126,191,5,"1121788"
142,"spotify:track:7d4ZrG3Cer7jbqIl6wOI6D","Tyson Sidhu","GODSPEED","Game Time",79,140,14,"1113439"
143,"spotify:track:2PvaburAUlhNHxVhw5lvOq","Arijit Singh","Humdard (From ""Ek Villain"")","T-Series",93,142,136,"1113435"
144,"spotify:track:7cWnks0lsRtpAi87COOiXK","Salim–Sulaiman, Rahat Fateh Ali Khan, Jaideep Sahni","O Re Piya","YRF Music",95,145,27,"1108925"
145,"spotify:track:60KvZb0FonIUUC9uYjYFQF","Bheems Ceciroleo","Pulsar Bike","B4U Music",145,146,2,"1107716"
146,"spotify:track:1Qrg8KqiBpW07V7PNxwwwL","SZA","Kill Bill","Top Dawg Entertainment/RCA Records",133,161,6,"1102964"
147,"spotify:track:5OMUXgfXsSukZ0zxelpC3b","A.R. Rahman, Jaswinder Singh, Shiraz Uppal","Raanjhanaa","Sony Music Entertainment India Pvt. Ltd.",144,144,19,"1102661"
148,"spotify:track:5O932cZmzOZGOGZz9RHx20","Pritam, Arijit Singh","Khairiyat","T-Series",1,124,181,"1102640"
150,"spotify:track:0GavMn9kjiQk1yI6118jEY","Dhanush, Anirudh Ravichander","Megham Karukatha","Sun Pictures",4,163,31,"1094171"
151,"spotify:track:4OcvkkpF3xmyCGGY5IBlgi","Akhil Sachdeva, Tulsi Kumar","Tera Ban Jaunga (From ""Kabir Singh"")","T-Series",4,133,184,"1093401"
152,"spotify:track:2ZRo7axmMPeSVUvDbGkJah","XXXTENTACION","Hope","Bad Vibes Forever, LLC",44,156,91,"1093328"
155,"spotify:track:0DXfJ2iKRDEG7rPgssWFea","Kanishk Seth, Kavita Seth","Rangisari (From ""Jugjugg Jeeyo"")","T-Series",22,155,37,"1083528"
156,"spotify:track:5mHdCZtVyb4DcJw8799hZp","RAYE, 070 Shake","Escapism.","Human Re Sources",117,149,5,"1080474"
157,"spotify:track:2dHHgzDwk4BJdRwy9uXhTO","Metro Boomin, The Weeknd, 21 Savage","Creepin' (with The Weeknd & 21 Savage)","Republic Records",157,165,8,"1076534"
158,"spotify:track:6gwnKOvdBKkTU4CQ7KpIAu","Shaarib Toshi, Arijit Singh","Bandeya - From ""Dil Juunglee""","Pooja Music",122,154,30,"1074017"
159,"spotify:track:20EQiQQYSyuifv6YMj64qP","King","OOPS","Warner Music India",25,139,26,"1073852"
160,"spotify:track:3fwyItGexa88kR8j76dIqv","Pratsofficial","Aziyat 2.0 - Reprise Version","Prats",85,147,37,"1068719"
161,"spotify:track:6zJejIfVYLgjud3lTk4DLB","Rosa Linn","SNAP","Columbia",93,152,23,"1063422"
162,"spotify:track:2LBqCSwhJGcFQeTHMVGwy3","The Weeknd","Die For You","Universal Republic Records",162,186,3,"1063254"
163,"spotify:track:0rk2X5TAhraBC5aCIXK2Rq","Jawad Ahmad, Shaarib Toshi, Arijit Singh, Shreya Ghoshal","Samjhawan","Sony Music Entertainment India Pvt. Ltd.",70,153,95,"1057231"
164,"spotify:track:1ZiReD9pPTttQWwSoYqdyH","Dikshant","Aankhon Se Batana","Sony Music Entertainment India Pvt. Ltd.",38,150,44,"1056724"
165,"spotify:track:0s76ExpXyMGVBlKLUr683e","Aditya Rikhari","Faasle","CollabX Productions",123,179,3,"1046739"
166,"spotify:track:5EYZZvmNAH5VZCwuzYJqoA","Jatin-Lalit, Shaan, Kailash Kher, Prasoon Joshi","Chand Sifarish","YRF Music",98,129,47,"1044938"
167,"spotify:track:6v3KW9xbzN5yKLt9YKDYA2","Shawn Mendes, Camila Cabello","Señorita","Island Records",1,172,192,"1033422"
168,"spotify:track:4wIWWEhbdgKAxhR68eE0Ye","Arijit Singh, Chinmayi","Mast Magan (From ""2 States"")","T-Series",75,159,105,"1031036"
169,"spotify:track:3LP4QpKptfe2yEC7oG5iNa","Yuvan Shankar Raja, Sid Sriram","Ennai Vittu (From ""Love Today"")","Sony Music Entertainment India Pvt. Ltd.",27,170,16,"1029749"
170,"spotify:track:3HiobOOpSpMsi95WBKPBYk","Jeet Gannguli, Arijit Singh","Hamari Adhuri Kahani (Title Track)","Sony Music Entertainment India Pvt. Ltd.",139,164,67,"1027818"
171,"spotify:track:6KtSNVgCmQEvDgIuHoXAkT","Azaan Sami Khan","Ik Lamha","AZEL RECORDS",36,158,34,"1025706"
172,"spotify:track:043SPVu75TXbs94ZfM9dfn","Kaushik-Guddu, Raghav Chaitanya, Kunaal Vermaa","Dil (From ""Ek Villain Returns"")","T-Series",20,160,33,"1025238"
173,"spotify:track:2l3dFxtoSMgMQVyRIUHjpz","Mitraz","Akhiyaan","Mitraz Records",23,162,43,"1023692"
174,"spotify:track:61ntLJxtXFf9ZkQr67rUrL","Ankit Tiwari, Manoj Muntashir","Galliyan Returns","T-Series",9,141,34,"1022686"
175,"spotify:track:3jtKSUiVDowKNBqVQbWaig","Amit Trivedi, Kavita Seth, Amitabh Bhattacharya","Iktara","Sony Music Entertainment India Pvt. Ltd.",73,174,45,"1018324"
177,"spotify:track:4iFPsNzNV7V9KJgcOX7TEO","Atif Aslam, Pritam","Tu Jaane Na","Tips Industries Ltd",108,167,96,"1007221"
178,"spotify:track:2IoZMG3RqiTmsy7Li3zGFg","Sachet Tandon, Parampara Tandon, Sachet-Parampara","Mere Sohneya (From ""Kabir Singh"")","T-Series",4,173,149,"1005085"
179,"spotify:track:0NvGVd87SYZnryTcfQPKUO","Madhur Sharma","Kali Kali Zulfon Ke","Pearl Records",61,168,38,"1004944"
180,"spotify:track:6NwEpX2JUWHVKWfDDfcqC4","Anirudh Ravichander, Ajesh","Idhazhin Oram - The Innocence of Love","Sony Music Entertainment India Pvt. Ltd.",180,200,2,"996864"
181,"spotify:track:0tpwqQhdfJXRcUDSNRjb9O","Arijit Singh, Neeti Mohan, Rashmi Virag","Mere Yaaraa (From ""Sooryavanshi"")","T-Series",20,157,68,"985139"
182,"spotify:track:0EH7sgeiFqDa3eS7ieW2zs","Akon, Hamsika Iyer","Chammak Challo","T-Series",121,-1,2,"983019"
183,"spotify:track:1bpzDsnW35B4QSRWXmatcc","Karan Aujla, Ikky","Fallin Apart","Rehaan Records",156,175,3,"982117"
184,"spotify:track:7fW9J3EpVWVN1ouv0slAs0","KK","Kya Mujhe Pyar Hai (From ""Woh Lamhe"")","T-Series",42,166,26,"978981"
185,"spotify:track:1UWacd8x8tPPwmrPB1MoBI","Pritam, Arijit Singh","Ae Dil Hai Mushkil Title Track","Sony Music Entertainment India Pvt. Ltd.",105,181,160,"974233"
186,"spotify:track:43YkTTlOD203o9E5ZxhUjF","Arijit Singh","Main Dhoondne Ko Zamaane Mein (From ""Heartless"")","T-Series",62,182,80,"974213"
187,"spotify:track:6cUOiOY5qh2FpIQWIYAd2h","Pritam, Darshan Raval, Antara Mitra","Mehrama","Sony Music Entertainment India Pvt. Ltd.",10,193,118,"970624"
188,"spotify:track:58SIEtTjWErr0yEXVBKxvd","Jubin Nautiyal","Shri Krishna Govind Hare Murari","T-Series",124,-1,3,"963306"
189,"spotify:track:6bdpj89aYEBjhpsenXAsmO","A.R. Rahman, Arijit Singh","Enna Sona","Sony Music Entertainment India Pvt. Ltd.",34,169,94,"954553"
190,"spotify:track:0l6g8Z8mqGbGXFOjigYetD","Pritam, Arijit Singh","Hawayein","Sony Music Entertainment India Pvt. Ltd.",51,171,74,"953298"
191,"spotify:track:1w3exvIgbRFV2ijf6qyWm8","Sidhu Moose Wala","Everybody Hurts","Sidhu Moose Wala",18,197,29,"952321"
192,"spotify:track:1h819b9tDPeqf9oKltPQ2Q","Sushin Shyam, Madhuvanthi Narayan, Vinayak Sasikumar","Aadharanjali (From ""Romancham)","Saregama",192,-1,2,"950122"
193,"spotify:track:32FVH23yFXr8Z0sfjRw4It","AP Dhillon","Wo Noor","RUN-UP RECORDS",57,188,20,"946207"
194,"spotify:track:06EgOhKj59Jk0AUSzly2Jn","MC SQUARE","Ram Ram","T-Series",17,180,17,"944940"
195,"spotify:track:0GQngE2rOYvlKwEQjTAsP8","Pritam, Sreeram, Shilpa Rao","Subhanallah","T-Series",146,199,26,"944584"
196,"spotify:track:2y0hUGvHaKm2p5xmJF4HBe","Arijit Singh","Saware (From ""Phantom"")","T-Series",178,178,2,"943494"
197,"spotify:track:1E16f7KcZmuXuhlenRwA2m","VIBIE","Saibo - Lofi Flip","Sony Music Entertainment India Pvt. Ltd.",103,185,14,"941456"
198,"spotify:track:3jyqXdAjwqO3gFtjnYrbq9","Darshan Raval, Rochak Kohli","Ek Ladki Ko Dekha Toh Aisa Laga (From ""Ek Ladki Ko Dekha Toh Aisa Laga"")","Saregama",152,177,14,"939510"
199,"spotify:track:2NTVtNcpC0i1R7LVGaCZCF","Badshah, Nikhita Gandhi","Jugnu","Universal Music India Pvt Ltd.",5,194,69,"937612"
200,"spotify:track:5ZTsPwtt7aCuzbWd5rDGys","MC STAN","Shana Bann","HINDI RECORDS",176,192,8,"934776"
