rank,uri,artist_names,track_name,source,peak_rank,previous_rank,weeks_on_chart,streams
193,"spotify:track:2q9lPN7CT92W1Ry77j2acn","Pritam, Arijit Singh, Shreya Ghoshal, Shadab Faridi, Altamash Faridi, Amitabh Bhattacharya","Ve Kamleya (From ""Rocky Aur Rani Kii Prem Kahaani"")","Saregama",136,188,13,"1087120"
194,"spotify:track:0MbOLfDcGk8ROHJYXJHu5c","Badshah, Karan Aujla, Devika Badyal","Players","Universal Music India Pvt Ltd.",7,195,45,"1084038"
195,"spotify:track:60YICjIPdL7LDBcCMK0tAk","Sidhu Moose Wala, Sunny Malton, The Kidd","Levels","Sidhu Moose Wala",8,185,63,"1075096"
196,"spotify:track:1Y3LN4zO1Edc2EluIoSPJN","Stephen Sanchez, Em Beihold","Until I Found You (with Em Beihold) - Em Beihold Version","Republic Records",24,181,49,"1073946"
197,"spotify:track:5XseQZ9TGr06Rv1Ye6wCu0","Yashraj, Dropped Out, Talwiinder","Dhundhala","Universal Music India Pvt. Ltd. (on behalf of Yashraj)",39,190,11,"1068482"
198,"spotify:track:3rUGC1vUpkDG9CZFHMur1t","Tate McRae","greedy","RCA Records Label",193,193,2,"1065398"
199,"spotify:track:5vGiuYFSGekGLgbxhV1rD5","Atif Aslam, Pritam","Tu Jaane Na","Tips Industries Ltd",101,173,120,"1062827"
200,"spotify:track:5lrA2NzUxmBjKr2tCZfMtl","Pritam, Arijit Singh","Ik Vaari Aa (From ""Raabta"")","T-Series",40,-1,74,"1057284"
