rank,uri,artist_names,track_name,source,peak_rank,previous_rank,weeks_on_chart,streams
1,"spotify:track:3xMHXmedL5Rvfxmiar9Ryv","Anirudh Ravichander, Arijit Singh, Shilpa Rao, Kumaar","Chaleya","T-Series",1,1,10,"11209211"
2,"spotify:track:5PUXKVVVQ74C3gl5vKy9Li","Jasleen Royal, Arijit Singh, Harrykahanhai","Heeriye (feat. Arijit Singh)","Warner Music India",1,2,12,"8485015"
3,"spotify:track:5ZLkihi6DVsHwDL3B8ym1t","Shubh","One Love","SHUBH",3,3,9,"6299528"
4,"spotify:track:3zSSCPpLZ5Oc8nelhhGjKz","AUR","Tu hai kahan","Sony Music Entertainment",4,-1,1,"5205744"
5,"spotify:track:0YQJoDL6f46J0n1rOVkpxJ","Karan Aujla, Ikky","Softly","WM Canada",4,4,9,"4859285"
6,"spotify:track:4eBvRhTJ2AcxCsbfTUjoRp","Shubh","Cheques","SHUBH",1,5,21,"4835215"
7,"spotify:track:0Jiaz0O4AqnJICa9PxHhaR","Darshan Raval","Mahiye Jinna Sohna","Warner Music India",2,6,17,"4517656"
8,"spotify:track:32qnBgfzURbwNayQIEB5W5","Anirudh Ravichander","Badass (From ""Leo"")","Sony Music Entertainment India Pvt. Ltd.",8,9,3,"4133899"
9,"spotify:track:0645eBDehHcqfiF15hscQV","Vishal Mishra, Rashmeet Kaur","Janiye (from the Netflix Film ""Chor Nikal Ke Bhaga"")","Netflix Music",5,8,15,"3952965"
10,"spotify:track:0xIuPDzJSnJywALez8dwKR","AP Dhillon","With You","Mass Appeal India",2,7,10,"3935046"
11,"spotify:track:5DgY6Ab0vpyUMKnY9ubFOF","Anirudh Ravichander, Super Subu","Hukum - Thalaivar Alappara","Sun Pictures",1,10,14,"3672337"
12,"spotify:track:1B02UI29t3PTh3m98absaP","Anirudh Ravichander, Thalapathy Vijay, Asal Kolaar","Naa Ready (From ""Leo"")","Sony Music Entertainment India Pvt. Ltd.",4,21,17,"3578651"
13,"spotify:track:7m4CgL81VVIHaaiSxyH922","Yo Yo Honey Singh","Desi Kalakaar","T-Series",13,18,4,"3539073"
14,"spotify:track:4UMIv5jd9gK98a39BQRD9X","Pritam, Arijit Singh, Amitabh Bhattacharya","Kesariya","Sony Music Entertainment India Pvt. Ltd.",1,14,66,"3487891"
15,"spotify:track:7iekl4P95GuphG8x8a3cNT","Pritam, Arijit Singh, Jonita Gandhi, Ranveer Singh, Madan Mohan, Amitabh Bhattacharya","What Jhumka ? (From ""Rocky Aur Rani Kii Prem Kahaani"")","Saregama",6,11,14,"3398527"
16,"spotify:track:0NuWRfZRWzn1oc9piFhK9n","MC SQUARE, Hiten","Laado","Sony Music Entertainment India Pvt. Ltd.",11,12,6,"3236423"
17,"spotify:track:04ChFQZCKl2yRcvc0VR7qN","Denny, Rahul Mishra, Kunaal Vermaa","Chale Jaana Phir (Humko Tere Bina)","For The Record Music",16,16,15,"3163028"
18,"spotify:track:5Tkf5CbtVYHA1SiKo1NrJE","Sachin-Jigar, Arijit Singh, Amitabha Bhattacharya","Phir Aur Kya Chahiye (From ""Zara Hatke Zara Bachke"")","Saregama",1,19,21,"3084544"
19,"spotify:track:73K33p4Vyz9koXGqmL5eFs","Sachet Tandon, Parampara Tandon, Kumaar, Sachet-Parampara","Malang Sajna","T-Series",4,13,39,"3052168"
20,"spotify:track:2FCXQHugkoHE1K3tiDu8pu","Alka Yagnik, Arijit Singh","Agar Tum Saath Ho (From ""Tamasha"")","T-Series",4,22,229,"3008234"
21,"spotify:track:38h4tmH1AWBVuemWAy4R4y","Pritam, Arijit Singh, Shreya Ghoshal, Amitabh Bhattacharya","Tum Kya Mile (From ""Rocky Aur Rani Kii Prem Kahaani"")","Saregama",9,15,16,"2999850"
22,"spotify:track:6aQIGqAo9PxRKjUkhYtR6R","Anirudh Ravichander, Priya Mali","Hayyoda (From ""Jawan"")","T-Series",14,25,8,"2837212"
23,"spotify:track:6c4Po8zyQjB4cR5XgLhcGb","Prabh Singh, Jay Trak, Rooh Sandhu","9:45","Prabh Singh Official",9,17,15,"2780250"
24,"spotify:track:6oz1L5jcqZWYuId7nxvIan","Shubh","Still Rollin","SHUBH",4,20,22,"2659117"
25,"spotify:track:6GZIAVSu0YXF7FYzyRl1MP","Sachin-Jigar, Varun Jain, Shadab Faridi, Altamash Faridi, Amitabh Bhattacharya","Tere Vaaste (From ""Zara Hatke Zara Bachke"")","Saregama",1,23,21,"2643270"
26,"spotify:track:24MMjyA3NLqCsDJfsn51eg","Sharn, 40k, The Paul","Mi Amor","Desi Avenue",7,26,40,"2560763"
27,"spotify:track:2oenSXLDbWVaaL7QjSGYj5","Diljit Dosanjh, Intense, Sultaan","Lalkara","DILJIT DOSANJH",27,70,2,"2549339"
28,"spotify:track:1418IuVKQPTYqt7QNJ9RXN","King","Maan Meri Jaan","Warner Music India",1,28,53,"2478055"
29,"spotify:track:2Fv2injs4qAm8mJBGaxVKU","Arijit Singh, Mithoon","Tujhe Kitna Chahne Lage (From ""Kabir Singh"")","T-Series",2,29,229,"2463070"
30,"spotify:track:5LSAafg2oH9YPgf3EG17iw","Aditya Gadhvi, Achint","Khalasi | Coke Studio Bharat","Universal Music India Pvt Ltd.",30,141,2,"2461205"
31,"spotify:track:2ZD4aIEepqZsdxPxLSuUhm","Pritam, Arijit Singh, Amitabh Bhattacharya, Nikhita Gandhi","Tere Pyaar Mein","T-Series",5,30,37,"2393337"
32,"spotify:track:6ygiy70ujkNOYXM1tQuMNe","Karan Aujla, Ikky, Preston Pablo","Admirin' You (feat. Preston Pablo)","WM Canada",24,24,11,"2382796"
33,"spotify:track:4VosVUajzm6nzGlSb6nP3L","Parmish Verma, Paradox","Check It Out","SDA Studios",19,27,14,"2377993"
34,"spotify:track:1QZRCi2Z1DQQaR6bGAzhtN","Yo Yo Honey Singh","Love Dose","T-Series",32,32,7,"2340796"
35,"spotify:track:08Isz2ETWSBhvIl8UpKYsp","Shubh","No Love","SHUBH",2,41,84,"2315835"
36,"spotify:track:1smFN2CLqGROu0J0UyvDfL","Pritam, Arijit Singh","Shayad","Sony Music Entertainment India Pvt. Ltd.",1,46,196,"2313569"
37,"spotify:track:0rMeOAvbQZ2RTG4B6L1M4p","Darshan Raval","Asal Mein","Indie Music Label",21,31,125,"2289810"
38,"spotify:track:0snQrp1VaY5Pj1YIHRJpRJ","Aditya A","Chaand Baaliyan","Sony Music Entertainment India Pvt. Ltd.",2,35,87,"2263689"
39,"spotify:track:0UZLaEOSIc5kg0cc7eszqC","Vishal Mishra","Manjha","Desi Music Factory",29,33,73,"2244868"
40,"spotify:track:2rOnSn2piaqLAlYjtfUBlY","Tanishk Bagchi, Jubin Nautiyal, Asees Kaur","Raataan Lambiyan (From ""Shershaah"")","Sony Music Entertainment India Pvt. Ltd.",1,37,116,"2202156"
41,"spotify:track:7eQl3Yqv35ioqUfveKHitE","Pritam, Mohit Chauhan","Tum Se Hi","T-Series",27,56,187,"2181526"
42,"spotify:track:3nKQrVVlwbAQSnFbgZWdN0","Avvy Sra, Karan Aujla, Jaani","White Brown Black","Universal Music India Pvt Ltd. – Distribution",40,40,44,"2154688"
43,"spotify:track:7wW9scVNLYFLsmBb1yAUmS","Yo Yo Honey Singh","Blue Eyes","T-Series",38,38,4,"2137171"
44,"spotify:track:7ouBSPZKQpm7zQz2leJXta","Arijit Singh","Tum Hi Ho (From ""Aashiqui 2"")","T-Series",44,51,142,"2105204"
45,"spotify:track:5BKKKNwrebowaMoUdBaNby","King","Tu Aake Dekhle","Warner Music India",3,42,142,"2096200"
46,"spotify:track:4blqlsA1uf2d2I40E90EUC","Pritam, Arijit Singh, Shilpa Rao","Tere Hawaale (From ""Laal Singh Chaddha"")","T-Series",11,43,34,"2091730"
47,"spotify:track:1y1rQTkWmrZdJmjwuK07GC","Vishal Mishra","Kaise Hua (From ""Kabir Singh"")","T-Series",5,47,227,"2090243"
48,"spotify:track:1cPDOeVdALLjj4erFPiuqW","Anirudh Ravichander, Shilpa Rao, Arunraja Kamaraj","Kaavaalaa","Sun Pictures",10,39,15,"2072944"
49,"spotify:track:5G7pZ8G8NFvS1MQ9H4L7dC","Javed-Mohsin, Arijit Singh, Shreya Ghoshal, Kunaal Vermaa, Prashant Ingole","Pal","Sony Music Entertainment India Pvt. Ltd.",39,53,241,"2059688"
50,"spotify:track:5inzjqKe05zP1eInEO8O1i","Anirudh Ravichander, Vishal Dadlani, Shilpa Rao, Kumaar","Not Ramaiya Vastavaiya","T-Series",20,36,7,"2057191"
51,"spotify:track:0TdWXMXyfTQ2qp5vvU9LID","Diljit Dosanjh, Intense","Case","DILJIT DOSANJH",51,81,2,"2055000"
52,"spotify:track:72zHuDxFQTjbL51qJQSA7j","Jasleen Royal, B Praak, Romy, Anvita Dutt","Ranjha (From ""Shershaah"")","Sony Music Entertainment India Pvt. Ltd.",1,59,115,"1935713"
53,"spotify:track:0czcoKJbJt08NqKrvSbbz7","Pritam, Arijit Singh, Amitabh Bhattacharya","O Bedardeya (From ""Tu Jhoothi Main Makkaar"")","T-Series",1,45,32,"1926440"
54,"spotify:track:29m79w9xPMH4YCD6r8JSmV","AP Dhillon, Gurinder Gill, Intense","Excuses","RUN-UP RECORDS",1,44,104,"1924384"
55,"spotify:track:4VsP4Dm8gsibRxB5I2hEkw","Kaifi Khalil","Kahani Suno 2.0","1944121 Records DK",1,54,44,"1915778"
56,"spotify:track:1AMD2AkfGrKoKhwkvYLbza","Sunny Yaduvanshi, AK Rok, Nitesh Ujoli","Yadav Brand 2","Flame Music",9,34,32,"1910580"
57,"spotify:track:5Y7Y315vZkOZbesJ22jXkK","Govind Vasantha, Pradeep Kumar, Shakthisree Gopalan","Railin Oligal - From ""Blue Star""","Think Music",57,58,3,"1894012"
58,"spotify:track:3yRLROmAcKJBqTrdEczFB8","Yo Yo Honey Singh","Brown Rang","Times Music",48,48,4,"1869792"
59,"spotify:track:3HiobOOpSpMsi95WBKPBYk","Jeet Gannguli, Arijit Singh","Hamari Adhuri Kahani (Title Track)","Sony Music Entertainment India Pvt. Ltd.",59,73,101,"1821442"
60,"spotify:track:32VAw8DL9ixX5XSW2VLcZ4","Parmish Verma, PARDHAAN, Desi Crew","Aam Jahe Munde","Parmish Verma Films",29,55,15,"1794955"
61,"spotify:track:5XeFesFbtLpXzIVDNQP22n","Arctic Monkeys","I Wanna Be Yours","Domino Recording Co",48,65,49,"1794894"
62,"spotify:track:2A4lcqTJZgUs1XrW6TSvt0","Rajat Nagpal, Yasser Desai, Rana Sotal","Hum Toh Deewane","PlayDMF",61,61,3,"1786135"
63,"spotify:track:2PvaburAUlhNHxVhw5lvOq","Arijit Singh","Humdard (From ""Ek Villain"")","T-Series",28,78,170,"1772206"
64,"spotify:track:7MXVkk9YMctZqd1Srtv4MB","The Weeknd, Daft Punk","Starboy","Universal Republic Records",12,66,116,"1765476"
65,"spotify:track:1HNig28114roVWfkCHk5oJ","Kapil Kapilan, Sam C.S., Manu Manjith","Neela Nilave (From ""RDX"")","Saregama",33,60,7,"1752552"
66,"spotify:track:4wIWWEhbdgKAxhR68eE0Ye","Arijit Singh, Chinmayi","Mast Magan (From ""2 States"")","T-Series",55,90,139,"1744472"
67,"spotify:track:42TMa2hgBNjte4uV7jNCnQ","Shubh, Ikky","Baller","SHUBH",2,77,58,"1740144"
68,"spotify:track:6Z4rRhYZVQsYKmrxD40tru","Riar Saab, Abhijay Sharma","Obsessed","Mass Appeal India, LLC",2,50,24,"1736043"
69,"spotify:track:0tgVpDi06FyKpA1z0VMD4v","Ed Sheeran","Perfect","Atlantic Records UK",29,79,183,"1701589"
70,"spotify:track:5W7DOVGQLTigu09afW7QMT","Sidhu Moose Wala","295","Sidhu Moose Wala",1,84,88,"1696182"
71,"spotify:track:6H7fLdt0AeWpuxUKXuXWrx","Hariharan","Shree Hanuman Chalisa","T-Series",39,57,62,"1693886"
72,"spotify:track:0aXnTU90v6G1QVlimy0Kw8","M.H.R, JOKER390P, SA, Dabzee","Malabari Banger","Devil Inside",72,83,4,"1688034"
73,"spotify:track:3dpM3ijJz0vGzbkh5DcMXz","Payal Dev, Vishal Mishra, A.M. Turaz","Naseeb Se (From ""Satyaprem Ki Katha"")","T-Series",44,71,20,"1674127"
74,"spotify:track:3B9CL5t32mM2SDdps2IhYM","Saad Lamjarred, Shreya Ghoshal, Rajat Nagpal","Guli Mata","PlayDMF",36,62,11,"1672140"
75,"spotify:track:3wz2vWhYnnBoFmgMkqtzLy","Chani Nattan, Inderpal Moga","Daku","Kharku Life Records",5,74,61,"1663297"
76,"spotify:track:56y1jOTK0XSvJzVv9vHQBK","Doja Cat","Paint The Town Red","Kemosabe Records/RCA Records",45,64,7,"1653802"
77,"spotify:track:2IoZMG3RqiTmsy7Li3zGFg","Sachet Tandon, Parampara Tandon, Sachet-Parampara","Mere Sohneya (From ""Kabir Singh"")","T-Series",4,89,183,"1636347"
78,"spotify:track:0ZcMt3GYvVkBjdomag59NP","Addy Nagar, Aniket Jain","Kaley Sheshe","Sony Music Entertainment India Pvt. Ltd.",78,111,2,"1627716"
79,"spotify:track:28lvraTNIN8qiTpoIK7m8Z","AP Dhillon, Shinda Kahlon","True Stories","Mass Appeal India",15,63,18,"1624837"
80,"spotify:track:51DEaelXeJJ6cFFYbX8Hal","Javed-Mohsin, Vishal Mishra, Shreya Ghoshal","Zihaal e Miskin","Universal Music India Pvt Ltd.",7,69,21,"1609876"
81,"spotify:track:4bD9z9qa4qg9BhryvYWB7c","Pritam, Tochi Raina, Rekha Bhardwaj","Kabira","T-Series",31,107,214,"1607789"
82,"spotify:track:1Er6TEtbyuW1b9QtBVkggD","Karan Aujla, Ikky","Jee Ni Lagda","WM Canada",38,52,9,"1601915"
83,"spotify:track:0l6g8Z8mqGbGXFOjigYetD","Pritam, Arijit Singh","Hawayein","Sony Music Entertainment India Pvt. Ltd.",51,106,106,"1601430"
84,"spotify:track:610keNiNVTIkYD0CqeSerg","Cheema Y, Gur Sidhu","California Love","Brown Town Music",27,68,21,"1593757"
85,"spotify:track:2e7CeqSe18O2LPnuRaHpdX","King","Sarkaare","Warner Music India",72,72,3,"1590380"
86,"spotify:track:3mUkVsovIuscQlSoMhmAZt","Madhur Sharma, Swapnil Tare, Nusrat Fateh Ali Khan","Kali Kali Zulfon Ke (Lo-Fi)","T-Series",6,49,58,"1589738"
87,"spotify:track:0CtZpaOhtzvLV3FfcsVpQo","Vishal-Shekhar, Shilpa Rao, Caralisa Monteiro, Vishal Dadlani, Shekhar Ravjiani, Kumaar","Besharam Rang (From ""Pathaan"")","YRF Music",4,87,45,"1587898"
88,"spotify:track:6ZYxNjuAU9Vy3VtF6W1dtE","Shubh","We Rollin","SHUBH",10,105,99,"1581528"
89,"spotify:track:48Ix6ReYdJf2H4mKb3TIpj","Atif Aslam, Alisha Chinai, Pritam","Tera Hone Laga Hoon","Tips Industries Ltd",59,98,127,"1576688"
90,"spotify:track:1UWacd8x8tPPwmrPB1MoBI","Pritam, Arijit Singh","Ae Dil Hai Mushkil Title Track","Sony Music Entertainment India Pvt. Ltd.",79,97,194,"1574322"
91,"spotify:track:5qolX8ncpZ8R6TfKbvTzbA","Talha Anjum, Umair","Downers At Dusk","Young Stunners",73,76,12,"1559328"
92,"spotify:track:2vPrBucKCfKmafHhSfJ2pt","Pritam, Arijit Singh, Amitabh Bhattacharya, Charan","Pyaar Hota Kayi Baar Hai (From ""Tu Jhoothi Main Makkaar"")","T-Series",9,95,36,"1553888"
93,"spotify:track:0FBQ4NrrHUbR9kus7rzrOj","Atif Aslam","Dil Diyan Gallan","YRF Music",78,123,192,"1534868"
94,"spotify:track:3yV2c3cYhkAwSsxAq6nRiv","Gajendra Verma","Mann Mera","Sony Music / Eros Now Music",26,158,133,"1514983"
95,"spotify:track:554RItg5afQv3ODGQMT29x","Jakes Bejoy, Shreya Ghoshal, Benny Dayal, Fejo, Joe Paul","Kalapakkaara (From ""King of Kotha"")","Sony Music Entertainment India Pvt. Ltd.",29,80,10,"1500620"
96,"spotify:track:6udC4b4jOSnHb9ItnXgKLR","Sachin-Jigar, Shreya Ghoshal, Tochi Raina","Saibo","Sony Music Entertainment India Pvt. Ltd.",31,121,155,"1498337"
97,"spotify:track:4OcvkkpF3xmyCGGY5IBlgi","Akhil Sachdeva, Tulsi Kumar","Tera Ban Jaunga (From ""Kabir Singh"")","T-Series",4,149,214,"1495983"
98,"spotify:track:2eAvDnpXP5W0cVtiI0PUxV","Ruth B.","Dandelions","Columbia",14,99,99,"1482686"
99,"spotify:track:5O932cZmzOZGOGZz9RHx20","Pritam, Arijit Singh","Khairiyat","T-Series",1,135,215,"1470332"
100,"spotify:track:6FAYpZ4jve8vpvTwUvjK6H","Vishal-Shekhar, Arijit Singh, Sukriti Kakar, Vishal Dadlani, Shekhar Ravjiani, Kumaar","Jhoome Jo Pathaan","YRF Music",3,91,43,"1468438"
101,"spotify:track:5XseQZ9TGr06Rv1Ye6wCu0","Yashraj, Dropped Out, Talwiinder","Dhundhala","Universal Music India Pvt. Ltd. (on behalf of Yashraj)",39,67,8,"1459176"
102,"spotify:track:6mTvwBzWTGDOVeCNQEqtOE","Amaal Mallik, Arijit Singh, Tulsi Kumar","Soch Na Sake","T-Series",102,138,42,"1454690"
103,"spotify:track:1RdrAqXa2fUj2XytsKaUwl","Irshad Khan","Haryana Hood","Bajewala Records Haryanvi",40,94,26,"1449750"
104,"spotify:track:2tjWCe2W7sgvS3C8NHcdtI","Akhil, Dhvani Bhanushali, Kunaal Vermaa","Duniyaa (From ""Luka Chuppi"")","T-Series",1,96,243,"1448901"
105,"spotify:track:7GsNFfmWszJUcMvYePL6M1","Suzonn","Farq hai","Suzonn",60,86,6,"1435308"
106,"spotify:track:7x9aauaA9cu6tyfpHnqDLo","Jung Kook, Latto","Seven (feat. Latto)","BIGHIT MUSIC",5,82,14,"1432900"
107,"spotify:track:0gPgdRfB4jdGrlyXS0Vx78","Vishal-Shekhar, KK, Shilpa Rao, Anvita Dutt Guptan","Khuda Jaane","YRF Music",37,131,54,"1424667"
108,"spotify:track:2n9ylYiF7urpXo36qBwr3g","Stebin Ben","Mera Dil Bhi Kitna Pagal Hai - Recreated Version","Ishtar Music Pvt. Ltd.",70,88,25,"1422057"
109,"spotify:track:1d5lpW3gUyq537iuyrb9Lf","Aditya Rikhari","Samjho Na","CollabX Productions",73,117,26,"1411568"
110,"spotify:track:3ZGJhN4unVspOqpwGvUL2W","Diljit Dosanjh","Lemonade","DILJIT DOSANJH",26,112,64,"1411548"
111,"spotify:track:4fyR24BKznXBLNkK8LwWla","Yo Yo Honey Singh","Dheere Dheere","T-Series",93,93,3,"1410448"
112,"spotify:track:5mjYQaktjmjcMKcUIcqz4s","Kenya Grace","Strangers","Warner Records/Major Recordings",75,75,3,"1405680"
113,"spotify:track:3l198ZkmLWrHYL3WXTOoep","Anirudh Ravichander, Lothika","Anbenum (From ""Leo"")","Sony Music Entertainment India Pvt. Ltd.",113,-1,1,"1404492"
114,"spotify:track:64r6z0P3RnhpTGdkA7p5Os","Darshan Raval","Ek Tarfa","Indie Music Label",33,102,87,"1402689"
115,"spotify:track:0ojpEubhy4JNeVftmVuiN7","Vishal Mishra, Armaan Malik","Pehla Pyaar","T-Series",11,119,125,"1402239"
116,"spotify:track:1ZMq0qzXfGnFo7BN03yddJ","Arjun Kanungo, King","Ilzaam (From the Album 'Industry')","One Mind Music",85,92,28,"1400360"
117,"spotify:track:7lNbI1xd39QRdf6Mj8tvTv","Javed Ali","Saudebazi (Encore) [From ""Aakrosh""]","T-Series",109,109,8,"1396384"
118,"spotify:track:2qxmye6gAegTMjLKEBoR3d","Alec Benjamin","Let Me Down Slowly","2018",34,104,184,"1387059"
119,"spotify:track:5O2P9iiztwhomNh8xkR9lJ","One Direction","Night Changes","Syco Music",22,125,127,"1383094"
120,"spotify:track:2AilvPt1AQ8PixlCKqkjfj","Shubh","Elevated","SHUBH",27,148,94,"1376608"
121,"spotify:track:1aL9518P5G72N92b48tuKw","AP Dhillon","Summer High","RUN-UP RECORDS",3,110,63,"1376083"
122,"spotify:track:2RgvvnMwtP0R2OkVZmFvnV","KK","Ajab Si (From ""Om Shanti Om"")","T-Series",34,128,93,"1373077"
123,"spotify:track:2qgXrzJsry4KgYoJCpuaul","The Local Train","Choo Lo","The Local Train",81,114,17,"1368760"
124,"spotify:track:3qrdLVOClRU4yPkcXZ7c5u","Ayushmann Khurrana, Tanishk-Vayu","Mere Liye Tum Kaafi Ho (From ""Shubh Mangal Zyada Saavdhan"")","T-Series",11,115,191,"1367329"
125,"spotify:track:3eSm4iAkLsn3BeggfiQOH9","Gaurav Chatterji, Aasa Singh, Hansika Pareek, Hrishi Giridhar, Pratik Gangavane","Kaise Ab Kahein - From ""Gutar Gu""","Sikhya Entertainment Records",87,101,11,"1352813"
126,"spotify:track:32765xcLM1fd6wQIpkN9A0","Ami Mishra, Kunaal Vermaa","Hasi - Male Version","Sony Music Entertainment India Pvt. Ltd.",98,136,16,"1350058"
127,"spotify:track:5Gy67YHzPZTk9Q0D73LAGH","Jeet Gannguli, Arijit Singh","Khamoshiyan (From ""Khamoshiyan"")","Sony Music Entertainment India Pvt. Ltd.",107,160,25,"1346183"
128,"spotify:track:1YMLgvsQdE27r30q0fsLeV","Arijit Singh","Tera Fitoor","Tips Industries Ltd",87,113,16,"1335960"
129,"spotify:track:6cUOiOY5qh2FpIQWIYAd2h","Pritam, Darshan Raval, Antara Mitra","Mehrama","Sony Music Entertainment India Pvt. Ltd.",10,146,151,"1319864"
130,"spotify:track:6FjbAnaPRPwiP3sciEYctO","Pritam, Arijit Singh","Raabta","T-Series",41,130,73,"1319092"
131,"spotify:track:6V7UVqe8XnAS4WPdpaw5TK","Asees Kaur, Stebin Ben","Tu Mile Dil Khile","Saregama",20,127,36,"1309325"
132,"spotify:track:567e29TDzLwZwfDuEpGTwo","The Kid LAROI, Justin Bieber","STAY (with Justin Bieber)","Columbia",1,132,119,"1306984"
133,"spotify:track:3WLJ7D5kh44K5eJ1NqZQ6W","Anuv Jain","Baarishein","Universal Music India Pvt. Ltd. (on behalf of Anuv Jain)",18,142,127,"1303681"
134,"spotify:track:03yKEFruN3BS2coglBtt2N","Laddi Chahal, Parmish Verma, Gurlez Akhtar","Rubicon Drill","Parmish Verma Films",12,126,44,"1303589"
135,"spotify:track:0rk2X5TAhraBC5aCIXK2Rq","Jawad Ahmad, Shaarib Toshi, Arijit Singh, Shreya Ghoshal","Samjhawan","Sony Music Entertainment India Pvt. Ltd.",70,147,129,"1301480"
136,"spotify:track:53QrRlALFJfZgdcGLKwy5s","Shubh","Dior","SHUBH",76,118,15,"1296392"
137,"spotify:track:03hJuEQpEQERrHpjcXKWzJ","Mithoon, Arijit Singh, Manoj Muntashir","Tumhe Kitna Pyaar Karte (From ""Bawaal"")","T-Series",20,133,15,"1291366"
138,"spotify:track:4KwsXvFDCoW7l1cfxhjTdD","Hesham Abdul Wahab, Chinmayi","Aradhya (From ""Kushi"") (Telugu)","Saregama India Ltd",93,164,11,"1279400"
139,"spotify:track:7v0t3o17J796y9OG2n3ebl","B Praak, Jaani","Kya Loge Tum","Universal Music India Pvt Ltd. – Distribution",10,116,22,"1278503"
140,"spotify:track:6vNolBIVWvfY3Z20gAG5nI","Payal Dev, Jubin Nautiyal, Kunaal Vermaa","Tum Hi Aana (Sad Version) [From ""Marjaavaan""]","T-Series",56,103,23,"1272129"
141,"spotify:track:0KWfizTu6jJIMmsVhws6yM","Yo Yo Honey Singh, Deep Money","Dope Shope","Moviebox Birmingham Limited",120,120,3,"1268207"
142,"spotify:track:1feANd8EfcDP5UqSvbheM3","Sachet Tandon, Sachet-Parampara","Bekhayali (From ""Kabir Singh"")","T-Series",1,170,197,"1257034"
143,"spotify:track:2uWZ7EGddFlA1DJ3Rzzvs2","Karan Aujla, Ikky, Yarah","Bachke Bachke (feat. Yarah)","WM Canada",57,100,9,"1256656"
144,"spotify:track:7mSzDKajY2wUtstQSLdzMK","Mohit Chauhan, Rochak Kohli","Rang Lageya","Saregama",35,137,38,"1255058"
145,"spotify:track:3jyqXdAjwqO3gFtjnYrbq9","Darshan Raval, Rochak Kohli","Ek Ladki Ko Dekha Toh Aisa Laga (From ""Ek Ladki Ko Dekha Toh Aisa Laga"")","Saregama",59,134,48,"1239622"
146,"spotify:track:6EB454nVg2u6sbeCvWAPej","Sam C.S., Anirudh Ravichander, Shakthisree Gopalan","Yaanji - From ""Vikram Vedha""","Think Music",122,199,23,"1238474"
147,"spotify:track:1dGr1c8CrMLDpV6mPbImSI","Taylor Swift","Lover","Taylor Swift",9,173,16,"1235829"
148,"spotify:track:01qFKNWq73UfEslI0GvumE","Jung Kook, Jack Harlow","3D (feat. Jack Harlow)","BIGHIT MUSIC",52,85,3,"1229837"
149,"spotify:track:0H2iJVgorRR0ZFgRqGUjUM","Pritam, Arijit Singh","Channa Mereya","Sony Music Entertainment India Pvt. Ltd.",58,157,195,"1226921"
150,"spotify:track:6bdpj89aYEBjhpsenXAsmO","A.R. Rahman, Arijit Singh","Enna Sona","Sony Music Entertainment India Pvt. Ltd.",34,172,128,"1226159"
151,"spotify:track:5zjFsuLrTM5sp6coribhCa","Sukhwinder Singh","Taal Se Taal - Western Version","Tips Industries Ltd",108,108,9,"1224418"
152,"spotify:track:3JkVYvxNoGf2HCWJo61462","Sidhu Moose Wala, Sunny Malton, SOE","Never Fold","Sidhu Moose Wala",13,150,78,"1215399"
153,"spotify:track:7qiZfU4dY1lWllzX7mPBI3","Ed Sheeran","Shape of You","Atlantic Records UK",63,161,180,"1210321"
154,"spotify:track:10Ve2mQ4hTWtgqR6MbmJyf","Jakes Bejoy, Asal Kolaar, Dabzee, Roll Rida, Resmi Sateesh","Kotha Raja","Sony Music Entertainment India Pvt. Ltd.",154,168,6,"1208093"
155,"spotify:track:18YHbIhrleUkKKj2DvEp79","Pritam, KK","Zara Sa","Sony Music Entertainment India Pvt. Ltd.",33,163,39,"1207127"
156,"spotify:track:54PRUdMOYzglMGnsg9kIta","Raghav Chaitanya, Manoj Muntashir, Pritam","Hua Main (From ""ANIMAL"")","T-Series",156,-1,1,"1203073"
157,"spotify:track:0qVNxbFE4EUV3mNFodXiln","Ayushmann Khurrana, Neeti Mohan","Saadi Galli Aaja","T-Series",80,124,6,"1201154"
158,"spotify:track:1Y3LN4zO1Edc2EluIoSPJN","Stephen Sanchez, Em Beihold","Until I Found You (with Em Beihold) - Em Beihold Version","Republic Records",24,151,46,"1186584"
159,"spotify:track:3wwLWFRLiReDf5AqgmAJwT","Rito Riba, Rajat Nagpal, Rana Sotal","Heer Ranjha","PlayDMF",11,143,51,"1184400"
160,"spotify:track:18kRElgBSIAsd3DHPUajuI","Diljit Dosanjh, thiarajxtt","Jatt Vailly","DILJIT DOSANJH",156,156,2,"1184241"
161,"spotify:track:6O1RAYwmOqkcoJQr7J9SFJ","Manan Bhardwaj, Arijit Singh","Oonchi Oonchi Deewarein","T-Series",161,-1,1,"1180363"
162,"spotify:track:4uK0M8AI6gyFmyzUneQpbi","A.R. Rahman, Arijit Singh, Shashaa Tirupati","Rait Zara Si (From ""Atrangi Re"")","T-Series",12,174,89,"1177306"
163,"spotify:track:5aMLADD1Ho6Ogq8s8mIzB9","Sachet-Parampara, Sachet Tandon, Parampara Tandon","Ram Siya Ram (From ""Adipurush"")","T-Series",11,145,20,"1175204"
164,"spotify:track:43YkTTlOD203o9E5ZxhUjF","Arijit Singh","Main Dhoondne Ko Zamaane Mein (From ""Heartless"")","T-Series",62,185,106,"1172138"
165,"spotify:track:4SqPZorSDuUtvdJwVGeZRC","Pritam, Arijit Singh, Amitabh Bhattacharya, Jonita Gandhi","Deva Deva","Sony Music Entertainment India Pvt. Ltd.",5,189,63,"1154890"
166,"spotify:track:3GEiVoaUXq468gfYs2EPfh","DIVINE, Sidhu Moose Wala","Chorni","DIVINE",8,152,15,"1152321"
167,"spotify:track:3sqRODOZ1Z6hR4F2tnFAlg","Maninder Buttar","Sakhiyaan","White Hill Music",20,155,209,"1140869"
168,"spotify:track:7AsG1F1eMWd17RYan8M3Wm","AP Dhillon, Shinda Kahlon","Dil Nu","RUN-UP RECORDS",33,159,54,"1140600"
169,"spotify:track:3FbZoPzEaUBOD84l1FwFEH","Darshan Raval","Mujhe Peene Do","Indie Music Label",56,144,24,"1139646"
170,"spotify:track:5vGiuYFSGekGLgbxhV1rD5","Atif Aslam, Pritam","Tu Jaane Na","Tips Industries Ltd",101,-1,117,"1137418"
171,"spotify:track:7lvDsmTRXFE3dK4OjvRiWB","Shae Gill, Ali Sethi","Pasoori","Giraffe Pakistan",1,192,87,"1135404"
172,"spotify:track:2q9lPN7CT92W1Ry77j2acn","Pritam, Arijit Singh, Shreya Ghoshal, Shadab Faridi, Altamash Faridi, Amitabh Bhattacharya","Ve Kamleya (From ""Rocky Aur Rani Kii Prem Kahaani"")","Saregama",136,162,11,"1132106"
173,"spotify:track:0zlGnseLGzRIBA0TJcb3Bo","Yohani, Jubin Nautiyal, Tanishk Bagchi, Rashmi Virag, Surya Ragunaathan","Manike (From ""Thank God"")","T-Series",2,154,57,"1132029"
174,"spotify:track:0s76ExpXyMGVBlKLUr683e","Aditya Rikhari","Faasle","CollabX Productions",123,-1,21,"1131739"
175,"spotify:track:2y0hUGvHaKm2p5xmJF4HBe","Arijit Singh","Saware (From ""Phantom"")","T-Series",82,165,36,"1129839"
176,"spotify:track:2IEhtVeM9TVql8fZdKdlo9","Atif Aslam, Chinmayi, Pritam","Main Rang Sharbaton Ka","Tips Industries Ltd",129,184,12,"1124013"
177,"spotify:track:5kwldaZvtbiTmRYsmlyxAN","Sachin-Jigar, Vishal Dadlani, Mellow D, Jigar Saraiya","Paisa Hai Toh","Sony Music / Amazon Sellers Services Pvt. Ltd.",77,180,25,"1122017"
178,"spotify:track:7Imk0IG6S5GA5iYWkjmMW5","Palak Muchhal, Arijit Singh","Chahun Main Ya Naa (From ""Aashiqui 2"")","T-Series",178,198,2,"1120946"
179,"spotify:track:4iEGv5Ne6HuCkFCjzxdWQK","Neeti Mohan","Meri Jaan","Saregama",11,194,52,"1115251"
180,"spotify:track:0pqnGHJpmpxLKifKRmU6WP","Imagine Dragons","Believer","Kid Ina Korner / Interscope",25,195,243,"1113351"
181,"spotify:track:5RaK2eqyHaBSyjEtI27w3T","Karan Aujla, Ikky","Try Me","WM Canada",44,122,9,"1113299"
182,"spotify:track:5frmIBzZKMjU2PlWJJ8Ir3","Rabbi Shergill","Tere Bin","Odd One Out Records",71,129,10,"1101688"
183,"spotify:track:6fScgF2Y63ScU73nYju0ny","Atif Aslam, Arko","O Saathi","T-Series",58,-1,64,"1099037"
184,"spotify:track:6kTavS1DM3ImGAAiIWGLPY","Atif Aslam","Jeena Jeena","Eros Now Music",37,177,117,"1097316"
185,"spotify:track:2NmBCDkjvJVvEZkH5QDOeb","Varinder Brar, Rav Dhaliwal, Ultra Beats","Thaa","Varinder Brar Music",10,-1,28,"1093006"
186,"spotify:track:4Tkb7zsDmsawB7S5TpKQV1","Atif Aslam, Shiraz Uppal","Pehli Dafa","T-Series",159,-1,6,"1092454"
187,"spotify:track:2NTVtNcpC0i1R7LVGaCZCF","Badshah, Nikhita Gandhi","Jugnu","Universal Music India Pvt Ltd.",5,187,77,"1089215"
188,"spotify:track:32LKwbmh6yVsWoRRF8DIvf","Pav Dharia","Na Ja","Ishtar-White Hill Music",35,139,101,"1084835"
189,"spotify:track:1s7oOCT8vauUh01PbJD6ps","Rema, Selena Gomez","Calm Down (with Selena Gomez)","Mavin Records / Jonzing World",11,176,57,"1084444"
190,"spotify:track:58f4twRnbZOOVUhMUpplJ4","AP Dhillon, Gminxr, Gurinder Gill, Shinda Kahlon","Brown Munde","Run-up Records",1,-1,135,"1079433"
191,"spotify:track:0DXfJ2iKRDEG7rPgssWFea","Kanishk Seth, Kavita Seth","Rangisari (From ""Jugjugg Jeeyo"")","T-Series",22,191,51,"1077909"
