rank,uri,artist_names,track_name,source,peak_rank,previous_rank,weeks_on_chart,streams
190,"spotify:track:1Ef0TmgS1QrVO6tKHrMMmH","Vishal-Shekhar, Arijit Singh, Shilpa Rao, Kumaar","Ghungroo (From ""War"")","YRF Music",1,-1,169,"1012644"
191,"spotify:track:1aL9518P5G72N92b48tuKw","AP Dhillon","Summer High","RUN-UP RECORDS",3,190,72,"1009449"
192,"spotify:track:5PyDJG7SQRgWXefgexqIge","Doja Cat","Agora Hills","Kemosabe Records/RCA Records",153,168,7,"1006484"
193,"spotify:track:3f0wz6zcA7XkQiGm0qNF5r","Arijit Singh, Tanishk Bagchi","Thodi Jagah (From ""Marjaavaan"")","T-Series",15,191,57,"1002930"
194,"spotify:track:58f4twRnbZOOVUhMUpplJ4","AP Dhillon, Gminxr, Gurinder Gill, Shinda Kahlon","Brown Munde","Run-up Records",1,-1,137,"998893"
195,"spotify:track:57jOEZtoLQK4zF2x55bdkp","Rochak Kohli, Arijit Singh, Neha Kakkar","Tu Hi Yaar Mera (From ""Pati Patni Aur Woh"")","T-Series",8,-1,190,"990450"
196,"spotify:track:6wkHR8cU4INbp145hngbQO","Sukha, Chani Nattan, Prodgk, Gurlez Akhtar","8 ASLE","SODHI MUSIC INC.",196,-1,1,"990026"
197,"spotify:track:3oWv5qDKYN7MH6FdlglMN5","Guru Randhawa, Sanjoy","Moon Rise","T-Series",18,187,39,"985799"
198,"spotify:track:7lvDsmTRXFE3dK4OjvRiWB","Shae Gill, Ali Sethi","Pasoori","Giraffe Pakistan",1,-1,95,"984554"
199,"spotify:track:6EB454nVg2u6sbeCvWAPej","Sam C.S., Anirudh Ravichander, Shakthisree Gopalan","Yaanji - From ""Vikram Vedha""","Think Music",122,-1,30,"984374"
200,"spotify:track:1Er6TEtbyuW1b9QtBVkggD","Karan Aujla, Ikky","Jee Ni Lagda","WM Canada",38,181,19,"982628"
