rank,uri,artist_names,track_name,source,peak_rank,previous_rank,weeks_on_chart,streams
1,"spotify:track:5PUXKVVVQ74C3gl5vKy9Li","Jasleen Royal, Arijit Singh, Harrykahanhai","Heeriye (feat. Arijit Singh)","Warner Music India",1,1,5,"13419101"
2,"spotify:track:0xIuPDzJSnJywALez8dwKR","AP Dhillon","With You","Mass Appeal India",2,2,3,"9985950"
3,"spotify:track:4eBvRhTJ2AcxCsbfTUjoRp","Shubh","Cheques","SHUBH",1,3,14,"8654813"
4,"spotify:track:5DgY6Ab0vpyUMKnY9ubFOF","Anirudh Ravichander, Super Subu","Hukum - Thalaivar Alappara","Sun Pictures",1,4,7,"7384493"
5,"spotify:track:4nc6XiUze2Yh7wFueGOPv7","Anirudh Ravichander, Arijit Singh, Shilpa Rao, Kumaar","Chaleya (From ""Jawan"")","T-Series",5,8,3,"6707113"
6,"spotify:track:0645eBDehHcqfiF15hscQV","Vishal Mishra, Rashmeet Kaur","Janiye (from the Netflix Film ""Chor Nikal Ke Bhaga"")","Netflix Music",5,5,8,"5925919"
7,"spotify:track:7iekl4P95GuphG8x8a3cNT","Pritam, Arijit Singh, Jonita Gandhi, Ranveer Singh, Madan Mohan, Amitabh Bhattacharya","What Jhumka ? (From ""Rocky Aur Rani Kii Prem Kahaani"")","Saregama",6,6,7,"5395063"
8,"spotify:track:0Jiaz0O4AqnJICa9PxHhaR","Darshan Raval","Mahiye Jinna Sohna","Warner Music India",2,7,10,"5201086"
9,"spotify:track:6c4Po8zyQjB4cR5XgLhcGb","Prabh Singh, Jay Trak, Rooh Sandhu","9:45","Prabh Singh Official",9,12,8,"4665427"
10,"spotify:track:4JvziZ2kQsbzfvRQtpYfmJ","Sunny Yaduvanshi, AK Rok, Nitesh Ujoli","Yadav Brand 2","Flame Music",9,17,25,"4601612"
11,"spotify:track:1cPDOeVdALLjj4erFPiuqW","Anirudh Ravichander, Shilpa Rao, Arunraja Kamaraj","Kaavaalaa","Sun Pictures",10,11,8,"4482850"
12,"spotify:track:6oz1L5jcqZWYuId7nxvIan","Shubh","Still Rollin","SHUBH",4,13,15,"4227242"
13,"spotify:track:1B02UI29t3PTh3m98absaP","Anirudh Ravichander, Thalapathy Vijay, Asal Kolaar","Naa Ready (From ""Leo"")","Sony Music Entertainment India Pvt. Ltd.",4,14,10,"4176733"
14,"spotify:track:5Tkf5CbtVYHA1SiKo1NrJE","Sachin-Jigar, Arijit Singh, Amitabha Bhattacharya","Phir Aur Kya Chahiye (From ""Zara Hatke Zara Bachke"")","Saregama",1,10,14,"4129280"
15,"spotify:track:24MMjyA3NLqCsDJfsn51eg","Sharn, 40k, The Paul","Mi Amor","Desi Avenue",7,16,33,"4115840"
16,"spotify:track:73K33p4Vyz9koXGqmL5eFs","Sachet Tandon, Parampara Tandon, Kumaar, Sachet-Parampara","Malang Sajna","T-Series",4,18,32,"4092343"
17,"spotify:track:28lvraTNIN8qiTpoIK7m8Z","AP Dhillon, Shinda Kahlon","True Stories","Mass Appeal India",15,15,11,"4034410"
18,"spotify:track:6GZIAVSu0YXF7FYzyRl1MP","Sachin-Jigar, Varun Jain, Shadab Faridi, Altamash Faridi, Amitabh Bhattacharya","Tere Vaaste (From ""Zara Hatke Zara Bachke"")","Saregama",1,9,14,"3876408"
19,"spotify:track:1418IuVKQPTYqt7QNJ9RXN","King","Maan Meri Jaan","Warner Music India",1,19,46,"3764457"
20,"spotify:track:38h4tmH1AWBVuemWAy4R4y","Pritam, Arijit Singh, Shreya Ghoshal, Amitabh Bhattacharya","Tum Kya Mile (From ""Rocky Aur Rani Kii Prem Kahaani"")","Saregama",9,20,9,"3586743"
21,"spotify:track:4UMIv5jd9gK98a39BQRD9X","Pritam, Arijit Singh, Amitabh Bhattacharya","Kesariya","Sony Music Entertainment India Pvt. Ltd.",1,23,59,"3503732"
22,"spotify:track:4VosVUajzm6nzGlSb6nP3L","Parmish Verma, Paradox","Check It Out","SDA Studios",19,21,7,"3435593"
23,"spotify:track:1aL9518P5G72N92b48tuKw","AP Dhillon","Summer High","RUN-UP RECORDS",3,27,56,"3234910"
24,"spotify:track:29m79w9xPMH4YCD6r8JSmV","AP Dhillon, Gurinder Gill, Intense","Excuses","RUN-UP RECORDS",1,24,97,"3146208"
25,"spotify:track:6Z4rRhYZVQsYKmrxD40tru","Riar Saab, Abhijay Sharma","Obsessed","Mass Appeal India, LLC",2,22,17,"3067830"
26,"spotify:track:6ygiy70ujkNOYXM1tQuMNe","Karan Aujla, Ikky, Preston Pablo","Admirin' You (feat. Preston Pablo)","WM Canada",25,25,4,"2871077"
27,"spotify:track:2FCXQHugkoHE1K3tiDu8pu","Alka Yagnik, Arijit Singh","Agar Tum Saath Ho (From ""Tamasha"")","T-Series",4,26,222,"2830779"
28,"spotify:track:0snQrp1VaY5Pj1YIHRJpRJ","Aditya A","Chaand Baaliyan","Sony Music Entertainment India Pvt. Ltd.",2,38,80,"2756604"
29,"spotify:track:554RItg5afQv3ODGQMT29x","Jakes Bejoy, Shreya Ghoshal, Benny Dayal, Fejo, Joe Paul","Kalapakkaara (From ""King of Kotha"")","Sony Music Entertainment India Pvt. Ltd.",29,76,3,"2724477"
30,"spotify:track:0czcoKJbJt08NqKrvSbbz7","Pritam, Arijit Singh, Amitabh Bhattacharya","O Bedardeya (From ""Tu Jhoothi Main Makkaar"")","T-Series",1,28,25,"2685712"
31,"spotify:track:08Isz2ETWSBhvIl8UpKYsp","Shubh","No Love","SHUBH",2,32,77,"2638559"
32,"spotify:track:0rMeOAvbQZ2RTG4B6L1M4p","Darshan Raval","Asal Mein","Indie Music Label",21,34,118,"2614523"
33,"spotify:track:32VAw8DL9ixX5XSW2VLcZ4","Parmish Verma, PARDHAAN, Desi Crew","Aam Jahe Munde","Parmish Verma Films",33,63,8,"2543512"
34,"spotify:track:2ZD4aIEepqZsdxPxLSuUhm","Pritam, Arijit Singh, Amitabh Bhattacharya, Nikhita Gandhi","Tere Pyaar Mein","T-Series",5,31,30,"2536838"
35,"spotify:track:4blqlsA1uf2d2I40E90EUC","Pritam, Arijit Singh, Shilpa Rao","Tere Hawaale (From ""Laal Singh Chaddha"")","T-Series",11,30,27,"2503973"
36,"spotify:track:4VsP4Dm8gsibRxB5I2hEkw","Kaifi Khalil","Kahani Suno 2.0","1944121 Records DK",1,36,37,"2473740"
37,"spotify:track:04ChFQZCKl2yRcvc0VR7qN","Denny, Rahul Mishra, Kunaal Vermaa","Chale Jaana Phir (Humko Tere Bina)","For The Record Music",37,80,8,"2454291"
38,"spotify:track:3B9CL5t32mM2SDdps2IhYM","Saad Lamjarred, Shreya Ghoshal, Rajat Nagpal","Guli Mata","PlayDMF",38,43,4,"2441124"
39,"spotify:track:1smFN2CLqGROu0J0UyvDfL","Pritam, Arijit Singh","Shayad","Sony Music Entertainment India Pvt. Ltd.",1,39,189,"2418469"
40,"spotify:track:72zHuDxFQTjbL51qJQSA7j","Jasleen Royal, B Praak, Romy, Anvita Dutt","Ranjha (From ""Shershaah"")","Sony Music Entertainment India Pvt. Ltd.",1,52,108,"2403293"
41,"spotify:track:2rOnSn2piaqLAlYjtfUBlY","Tanishk Bagchi, Jubin Nautiyal, Asees Kaur","Raataan Lambiyan (From ""Shershaah"")","Sony Music Entertainment India Pvt. Ltd.",1,45,109,"2394366"
42,"spotify:track:7x9aauaA9cu6tyfpHnqDLo","Jung Kook, Latto","Seven (feat. Latto)","BIGHIT MUSIC",5,37,7,"2345565"
43,"spotify:track:2Fv2injs4qAm8mJBGaxVKU","Arijit Singh, Mithoon","Tujhe Kitna Chahne Lage (From ""Kabir Singh"")","T-Series",2,47,222,"2293336"
44,"spotify:track:5iCY0TXNImK4hyKfcplQsg","Anuv Jain","Baarishein","Universal Music India Pvt. Ltd. (on behalf of Anuv Jain)",18,40,120,"2280100"
45,"spotify:track:51DEaelXeJJ6cFFYbX8Hal","Javed-Mohsin, Vishal Mishra, Shreya Ghoshal","Zihaal e Miskin","Universal Music India Pvt Ltd.",7,46,14,"2275986"
46,"spotify:track:3wz2vWhYnnBoFmgMkqtzLy","Chani Nattan, Inderpal Moga","Daku","Kharku Life Records",5,50,54,"2243081"
47,"spotify:track:7AsG1F1eMWd17RYan8M3Wm","AP Dhillon, Shinda Kahlon","Dil Nu","RUN-UP RECORDS",33,33,47,"2232915"
48,"spotify:track:1y1rQTkWmrZdJmjwuK07GC","Vishal Mishra","Kaise Hua (From ""Kabir Singh"")","T-Series",5,48,220,"2229236"
49,"spotify:track:0UZLaEOSIc5kg0cc7eszqC","Vishal Mishra","Manjha","Desi Music Factory",29,67,66,"2226866"
50,"spotify:track:610keNiNVTIkYD0CqeSerg","Cheema Y, Gur Sidhu","California Love","Brown Town Music",27,35,14,"2212009"
51,"spotify:track:42TMa2hgBNjte4uV7jNCnQ","Shubh, Ikky","Baller","SHUBH",2,41,51,"2200299"
52,"spotify:track:1RdrAqXa2fUj2XytsKaUwl","Irshad Khan","Haryana Hood","Bajewala Records Haryanvi",40,49,19,"2170240"
53,"spotify:track:3mUkVsovIuscQlSoMhmAZt","Madhur Sharma, Swapnil Tare, Nusrat Fateh Ali Khan","Kali Kali Zulfon Ke (Lo-Fi)","T-Series",6,94,51,"2130679"
54,"spotify:track:5RaK2eqyHaBSyjEtI27w3T","Karan Aujla, Ikky","Try Me","WM Canada",44,44,2,"2115434"
55,"spotify:track:5BKKKNwrebowaMoUdBaNby","King","Tu Aake Dekhle","Warner Music India",3,51,135,"2115147"
56,"spotify:track:5G7pZ8G8NFvS1MQ9H4L7dC","Javed-Mohsin, Arijit Singh, Shreya Ghoshal, Kunaal Vermaa, Prashant Ingole","Pal","Sony Music Entertainment India Pvt. Ltd.",39,64,234,"2066296"
57,"spotify:track:0iiX5o434i4xb49x4LluyR","Vkey, SDEE","Rao Sahab Drill","Nupur Audio",55,55,3,"2061921"
58,"spotify:track:3dpM3ijJz0vGzbkh5DcMXz","Payal Dev, Vishal Mishra, A.M. Turaz","Naseeb Se (From ""Satyaprem Ki Katha"")","T-Series",44,78,13,"2055804"
59,"spotify:track:7MXVkk9YMctZqd1Srtv4MB","The Weeknd, Daft Punk","Starboy","Universal Republic Records",12,69,109,"2051034"
60,"spotify:track:0tgVpDi06FyKpA1z0VMD4v","Ed Sheeran","Perfect","Atlantic Records UK",29,62,176,"1962150"
61,"spotify:track:5W7DOVGQLTigu09afW7QMT","Sidhu Moose Wala","295","Sidhu Moose Wala",1,57,81,"1954800"
62,"spotify:track:03yKEFruN3BS2coglBtt2N","Laddi Chahal, Parmish Verma, Gurlez Akhtar","Rubicon Drill","Parmish Verma Films",12,42,37,"1952213"
63,"spotify:track:7eQl3Yqv35ioqUfveKHitE","Pritam, Mohit Chauhan","Tum Se Hi","T-Series",27,61,180,"1945691"
64,"spotify:track:7ouBSPZKQpm7zQz2leJXta","Arijit Singh","Tum Hi Ho (From ""Aashiqui 2"")","T-Series",47,72,135,"1908473"
65,"spotify:track:3ZGJhN4unVspOqpwGvUL2W","Diljit Dosanjh","Lemonade","DILJIT DOSANJH",26,29,57,"1902759"
66,"spotify:track:6H7fLdt0AeWpuxUKXuXWrx","Hariharan","Shree Hanuman Chalisa","T-Series",39,54,55,"1900371"
67,"spotify:track:03hJuEQpEQERrHpjcXKWzJ","Mithoon, Arijit Singh, Manoj Muntashir","Tumhe Kitna Pyaar Karte (From ""Bawaal"")","T-Series",20,53,8,"1886986"
68,"spotify:track:2vPrBucKCfKmafHhSfJ2pt","Pritam, Arijit Singh, Amitabh Bhattacharya, Charan","Pyaar Hota Kayi Baar Hai (From ""Tu Jhoothi Main Makkaar"")","T-Series",9,59,29,"1878851"
69,"spotify:track:1L3Nsi7YXtBxTdnbqektia","Darshan Raval","Hawa Banke","Indie Music Label",26,79,63,"1870585"
70,"spotify:track:3nKQrVVlwbAQSnFbgZWdN0","Avvy Sra, Karan Aujla, Jaani","White Brown Black","Universal Music India Pvt Ltd. – Distribution",49,66,37,"1858952"
71,"spotify:track:5frmIBzZKMjU2PlWJJ8Ir3","Rabbi Shergill","Tere Bin","Odd One Out Records",71,71,3,"1848673"
72,"spotify:track:4nrIa48GgXzNks6NvqVIOX","Anirudh Ravichander, Dhee, Ananthakrrishnan, Super Subu","Jujubee","Sun Pictures",56,58,3,"1843989"
73,"spotify:track:2n9ylYiF7urpXo36qBwr3g","Stebin Ben","Mera Dil Bhi Kitna Pagal Hai - Recreated Version","Ishtar Music Pvt. Ltd.",73,-1,18,"1843060"
74,"spotify:track:6vNolBIVWvfY3Z20gAG5nI","Payal Dev, Jubin Nautiyal, Kunaal Vermaa","Tum Hi Aana (Sad Version) [From ""Marjaavaan""]","T-Series",56,-1,16,"1810536"
75,"spotify:track:3jyqXdAjwqO3gFtjnYrbq9","Darshan Raval, Rochak Kohli","Ek Ladki Ko Dekha Toh Aisa Laga (From ""Ek Ladki Ko Dekha Toh Aisa Laga"")","Saregama",59,98,41,"1801845"
76,"spotify:track:5XeFesFbtLpXzIVDNQP22n","Arctic Monkeys","I Wanna Be Yours","Domino Recording Co",73,82,42,"1791102"
77,"spotify:track:3uzmqeJjMKb3iCfjPHGmwa","R Maan, Deepty","System Pe System","All Good Music",42,56,7,"1784007"
78,"spotify:track:1d5lpW3gUyq537iuyrb9Lf","Aditya Rikhari","Samjho Na","CollabX Productions",78,92,19,"1773659"
79,"spotify:track:3GEiVoaUXq468gfYs2EPfh","DIVINE, Sidhu Moose Wala","Chorni","DIVINE",8,65,8,"1763156"
80,"spotify:track:5aMLADD1Ho6Ogq8s8mIzB9","Sachet-Parampara, Sachet Tandon, Parampara Tandon","Ram Siya Ram (From ""Adipurush"")","T-Series",11,68,13,"1762007"
81,"spotify:track:6TClJ8jXi3OBV7gcrU3jx5","AP Dhillon, Gurinder Gill","TERE TE","RUN-UP RECORDS",7,70,93,"1760414"
82,"spotify:track:2RgvvnMwtP0R2OkVZmFvnV","KK","Ajab Si (From ""Om Shanti Om"")","T-Series",34,73,86,"1751567"
83,"spotify:track:2PvaburAUlhNHxVhw5lvOq","Arijit Singh","Humdard (From ""Ek Villain"")","T-Series",28,85,163,"1745350"
84,"spotify:track:2IoZMG3RqiTmsy7Li3zGFg","Sachet Tandon, Parampara Tandon, Sachet-Parampara","Mere Sohneya (From ""Kabir Singh"")","T-Series",4,155,176,"1741300"
85,"spotify:track:64r6z0P3RnhpTGdkA7p5Os","Darshan Raval","Ek Tarfa","Indie Music Label",33,131,80,"1729824"
86,"spotify:track:2tjWCe2W7sgvS3C8NHcdtI","Akhil, Dhvani Bhanushali, Kunaal Vermaa","Duniyaa (From ""Luka Chuppi"")","T-Series",1,96,236,"1724441"
87,"spotify:track:6PSGzXHJaQogb2G8m8gGZZ","Yashraj, Dropped Out, Talwiinder","Dhundhala","Universal Music India Pvt. Ltd. (on behalf of Yashraj)",87,-1,1,"1722587"
88,"spotify:track:6FAYpZ4jve8vpvTwUvjK6H","Vishal-Shekhar, Arijit Singh, Sukriti Kakar, Vishal Dadlani, Shekhar Ravjiani, Kumaar","Jhoome Jo Pathaan","YRF Music",3,84,36,"1717568"
89,"spotify:track:5ZLkihi6DVsHwDL3B8ym1t","Shubh","One Love","SHUBH",89,113,2,"1698788"
90,"spotify:track:2eAvDnpXP5W0cVtiI0PUxV","Ruth B.","Dandelions","Columbia",14,91,92,"1696937"
91,"spotify:track:0CtZpaOhtzvLV3FfcsVpQo","Vishal-Shekhar, Shilpa Rao, Caralisa Monteiro, Vishal Dadlani, Shekhar Ravjiani, Kumaar","Besharam Rang (From ""Pathaan"")","YRF Music",4,89,38,"1695191"
92,"spotify:track:53QrRlALFJfZgdcGLKwy5s","Shubh","Dior","SHUBH",76,104,8,"1685814"
93,"spotify:track:2uWZ7EGddFlA1DJ3Rzzvs2","Karan Aujla, Ikky, Yarah","Bachke Bachke (feat. Yarah)","WM Canada",93,106,2,"1685315"
94,"spotify:track:48Ix6ReYdJf2H4mKb3TIpj","Atif Aslam, Alisha Chinai, Pritam","Tera Hone Laga Hoon","Tips Industries Ltd",59,60,120,"1683956"
95,"spotify:track:3HiobOOpSpMsi95WBKPBYk","Jeet Gannguli, Arijit Singh","Hamari Adhuri Kahani (Title Track)","Sony Music Entertainment India Pvt. Ltd.",72,93,94,"1675761"
96,"spotify:track:6ZYxNjuAU9Vy3VtF6W1dtE","Shubh","We Rollin","SHUBH",10,86,92,"1669504"
97,"spotify:track:4bD9z9qa4qg9BhryvYWB7c","Pritam, Tochi Raina, Rekha Bhardwaj","Kabira","T-Series",31,87,207,"1659939"
98,"spotify:track:4wIWWEhbdgKAxhR68eE0Ye","Arijit Singh, Chinmayi","Mast Magan (From ""2 States"")","T-Series",55,108,132,"1653937"
99,"spotify:track:7lJebwVBaywjSis2ahqtnn","Badshah, Payal Dev","Gone Girl","Universal Music India Pvt Ltd.",75,75,3,"1649037"
100,"spotify:track:3qrdLVOClRU4yPkcXZ7c5u","Ayushmann Khurrana, Tanishk-Vayu","Mere Liye Tum Kaafi Ho (From ""Shubh Mangal Zyada Saavdhan"")","T-Series",11,165,184,"1641967"
101,"spotify:track:3yV2c3cYhkAwSsxAq6nRiv","Gajendra Verma","Mann Mera","Sony Music / Eros Now Music",26,170,127,"1612487"
102,"spotify:track:2qgXrzJsry4KgYoJCpuaul","The Local Train","Choo Lo","The Local Train",81,81,10,"1598010"
103,"spotify:track:3UhmuWcFaLS3AO3kI9ynQ2","AP Dhillon, Shinda Kahlon, Gurinder Gill, Gminxr","Insane","RUN-UP RECORDS",3,83,121,"1595555"
104,"spotify:track:6udC4b4jOSnHb9ItnXgKLR","Sachin-Jigar, Shreya Ghoshal, Tochi Raina","Saibo","Sony Music Entertainment India Pvt. Ltd.",31,95,148,"1590802"
105,"spotify:track:1VxCdnd46iCgHP5zXGCXPe","Sid Sriram, Gautham Vasudev Menon, Malvi Sundaresan, Nivas K Prasanna","Nira - From ""Takkar""","Think Music",57,74,11,"1588887"
106,"spotify:track:2qxmye6gAegTMjLKEBoR3d","Alec Benjamin","Let Me Down Slowly","2018",34,97,177,"1587729"
107,"spotify:track:5O2P9iiztwhomNh8xkR9lJ","One Direction","Night Changes","Syco Music",22,116,120,"1587360"
108,"spotify:track:5qolX8ncpZ8R6TfKbvTzbA","Talha Anjum, Umair","Downers At Dusk","Young Stunners",108,160,5,"1581389"
109,"spotify:track:1ZMq0qzXfGnFo7BN03yddJ","Arjun Kanungo, King","Ilzaam (From the Album 'Industry')","One Mind Music",97,156,21,"1576561"
110,"spotify:track:58f4twRnbZOOVUhMUpplJ4","AP Dhillon, Gminxr, Gurinder Gill, Shinda Kahlon","Brown Munde","Run-up Records",1,77,130,"1573593"
111,"spotify:track:32LKwbmh6yVsWoRRF8DIvf","Pav Dharia","Na Ja","Ishtar-White Hill Music",35,147,95,"1568531"
112,"spotify:track:7lvDsmTRXFE3dK4OjvRiWB","Shae Gill, Ali Sethi","Pasoori","Giraffe Pakistan",1,118,80,"1566790"
113,"spotify:track:3FbZoPzEaUBOD84l1FwFEH","Darshan Raval","Mujhe Peene Do","Indie Music Label",56,120,17,"1561849"
114,"spotify:track:0zlGnseLGzRIBA0TJcb3Bo","Yohani, Jubin Nautiyal, Tanishk Bagchi, Rashmi Virag, Surya Ragunaathan","Manike (From ""Thank God"")","T-Series",2,121,50,"1561368"
115,"spotify:track:2NmBCDkjvJVvEZkH5QDOeb","Varinder Brar, Rav Dhaliwal, Ultra Beats","Thaa","Varinder Brar Music",10,103,22,"1534199"
116,"spotify:track:6FjbAnaPRPwiP3sciEYctO","Pritam, Arijit Singh","Raabta","T-Series",41,112,66,"1533072"
117,"spotify:track:0JBhoxPKHJc1ZeJrjSt0VO","Gajendra Verma","Tera Ghata","Virtual Planet Music",62,126,49,"1529088"
118,"spotify:track:6WzRpISELf3YglGAh7TXcG","The Weeknd, Playboi Carti, Madonna","Popular (with Playboi Carti & Madonna) - From The Idol Vol. 1 (Music from the HBO Original Series)","XO / Republic Records",118,145,6,"1527756"
119,"spotify:track:4tzx5af2qpwgyjG6JQGthj","Anirudh Ravichander, Irshad Kamil","Zinda Banda (From ""Jawan"")","T-Series",88,90,4,"1481374"
120,"spotify:track:0ojpEubhy4JNeVftmVuiN7","Vishal Mishra, Armaan Malik","Pehla Pyaar","T-Series",11,123,118,"1472457"
121,"spotify:track:7v0t3o17J796y9OG2n3ebl","B Praak, Jaani","Kya Loge Tum","Universal Music India Pvt Ltd. – Distribution",10,102,15,"1470793"
122,"spotify:track:5Kq7fNPXz9AUXGHZqCF2FC","B Praak, Jaani, Nawazuddin Siddiqui","Yaar Ka Sataya Hua Hai","Universal Music India Pvt Ltd. – Distribution",29,99,8,"1459454"
123,"spotify:track:6TJ8etbh8uFFLuVbLj25lz","AP Dhillon","Sleepless","Mass Appeal India",88,88,4,"1457855"
124,"spotify:track:2jt9VV6QGn0tbwkrr26OO6","AP Dhillon, Shinda Kahlon, Gminxr","Arrogant","RUN-UP RECORDS",98,122,15,"1457400"
125,"spotify:track:2AilvPt1AQ8PixlCKqkjfj","Shubh","Elevated","SHUBH",27,117,87,"1450236"
126,"spotify:track:1Er6TEtbyuW1b9QtBVkggD","Karan Aujla, Ikky","Jee Ni Lagda","WM Canada",126,135,2,"1443765"
127,"spotify:track:0l6g8Z8mqGbGXFOjigYetD","Pritam, Arijit Singh","Hawayein","Sony Music Entertainment India Pvt. Ltd.",51,133,99,"1428189"
128,"spotify:track:5zjFsuLrTM5sp6coribhCa","Sukhwinder Singh","Taal Se Taal - Western Version","Tips Industries Ltd",128,128,2,"1425339"
129,"spotify:track:2IEhtVeM9TVql8fZdKdlo9","Atif Aslam, Chinmayi, Pritam","Main Rang Sharbaton Ka","Tips Industries Ltd",129,172,5,"1423836"
130,"spotify:track:0YQJoDL6f46J0n1rOVkpxJ","Karan Aujla, Ikky","Softly","WM Canada",130,178,2,"1423279"
131,"spotify:track:567e29TDzLwZwfDuEpGTwo","The Kid LAROI, Justin Bieber","STAY (with Justin Bieber)","Columbia",1,110,112,"1422384"
132,"spotify:track:1odExI7RdWc4BT515LTAwj","David Kushner","Daylight","Miserable Music Group, LLC",108,153,8,"1421111"
133,"spotify:track:7mSzDKajY2wUtstQSLdzMK","Mohit Chauhan, Rochak Kohli","Rang Lageya","Saregama",35,124,31,"1419515"
134,"spotify:track:2mFkD2KjL1dUhkpNKteaKP","Hesham Abdul Wahab, Shiva Nirvana","Na Roja Nuvve (From ""Kushi"")","Saregama",82,114,16,"1408168"
135,"spotify:track:228BxWXUYQPJrJYHDLOHkj","Daddy Yankee","Gasolina","Gasolina Recording Co.",35,115,10,"1406083"
136,"spotify:track:3sqRODOZ1Z6hR4F2tnFAlg","Maninder Buttar","Sakhiyaan","White Hill Music",20,-1,203,"1401674"
137,"spotify:track:1Y3LN4zO1Edc2EluIoSPJN","Stephen Sanchez, Em Beihold","Until I Found You (with Em Beihold) - Em Beihold Version","Republic Records",24,129,39,"1390217"
138,"spotify:track:2GXXZFUxYg2LvG8SR0byOE","Atif Aslam","Jeena Jeena","Eros Now Music",37,-1,113,"1381490"
139,"spotify:track:04UzZSWfw8hkK832P27QLq","Nikk, Avneet Kaur","Yaari","BANG Music",18,-1,70,"1380709"
140,"spotify:track:1UWacd8x8tPPwmrPB1MoBI","Pritam, Arijit Singh","Ae Dil Hai Mushkil Title Track","Sony Music Entertainment India Pvt. Ltd.",79,157,187,"1377325"
141,"spotify:track:5kwldaZvtbiTmRYsmlyxAN","Sachin-Jigar, Vishal Dadlani, Mellow D, Jigar Saraiya","Paisa Hai Toh","Sony Music / Amazon Sellers Services Pvt. Ltd.",77,119,18,"1376546"
142,"spotify:track:7qiZfU4dY1lWllzX7mPBI3","Ed Sheeran","Shape of You","Atlantic Records UK",63,141,173,"1371991"
143,"spotify:track:6bdpj89aYEBjhpsenXAsmO","A.R. Rahman, Arijit Singh","Enna Sona","Sony Music Entertainment India Pvt. Ltd.",34,174,121,"1366696"
144,"spotify:track:0rk2X5TAhraBC5aCIXK2Rq","Jawad Ahmad, Shaarib Toshi, Arijit Singh, Shreya Ghoshal","Samjhawan","Sony Music Entertainment India Pvt. Ltd.",70,138,122,"1360414"
145,"spotify:track:5O932cZmzOZGOGZz9RHx20","Pritam, Arijit Singh","Khairiyat","T-Series",1,158,208,"1355784"
146,"spotify:track:32765xcLM1fd6wQIpkN9A0","Ami Mishra, Kunaal Vermaa","Hasi - Male Version","Sony Music Entertainment India Pvt. Ltd.",98,142,9,"1354320"
147,"spotify:track:3eSm4iAkLsn3BeggfiQOH9","Gaurav Chatterji, Aasa Singh, Hansika Pareek, Hrishi Giridhar, Pratik Gangavane","Kaise Ab Kahein - From ""Gutar Gu""","Sikhya Entertainment Records",107,107,4,"1348701"
148,"spotify:track:0WUUFBKX2vlagsbYm3KUG2","Vilen","Kyun Dhunde - 1 Min Music","Universal Music India Pvt Ltd.",22,-1,29,"1340854"
149,"spotify:track:1BxfuPKGuaTgP7aM0Bbdwr","Taylor Swift","Cruel Summer","Taylor Swift",54,148,10,"1320475"
150,"spotify:track:4ZVtid5khBfDx6Co0vTUE6","Jassa Dhillon, thiarajxtt","SPAIN","Jassa Dhillon",14,105,31,"1315278"
151,"spotify:track:3USxtqRwSYz57Ewm6wWRMp","Glass Animals","Heat Waves","Polydor Records",3,168,111,"1312230"
152,"spotify:track:5Z2GQ0eBKoatNYqbGayihP","Anubha Bajaj","Lamhey","Sony Music Entertainment India Pvt. Ltd.",111,111,4,"1303328"
153,"spotify:track:58SIEtTjWErr0yEXVBKxvd","Jubin Nautiyal","Shri Krishna Govind Hare Murari","T-Series",76,132,28,"1298214"
154,"spotify:track:0MbOLfDcGk8ROHJYXJHu5c","Badshah, Karan Aujla, Devika Badyal","Players","Universal Music India Pvt Ltd.",7,100,36,"1298130"
155,"spotify:track:7o1SDLghDwMc4OW3rKakVt","Bir, Dhanju, thiarajxtt","Afterhours","Sky Digital",87,101,17,"1290544"
156,"spotify:track:2rZ28NWX3NG2BbWc38JC1j","Sunny Yaduvanshi, Nitesh Ujoli, AK Rok","Yadav Brand 2 - Slowed Reverb","Flame Music",131,162,7,"1283523"
157,"spotify:track:1s7oOCT8vauUh01PbJD6ps","Rema, Selena Gomez","Calm Down (with Selena Gomez)","Mavin Records / Jonzing World",11,137,50,"1283153"
158,"spotify:track:2QophXhN2Ls2URfoPmiviC","Taaruk Raina, Mismatched - Cast","Kho Gaye","Netflix Music",8,130,46,"1281901"
159,"spotify:track:0H2iJVgorRR0ZFgRqGUjUM","Pritam, Arijit Singh","Channa Mereya","Sony Music Entertainment India Pvt. Ltd.",58,182,188,"1273558"
160,"spotify:track:0FBQ4NrrHUbR9kus7rzrOj","Atif Aslam","Dil Diyan Gallan","YRF Music",78,164,185,"1270633"
161,"spotify:track:5vGiuYFSGekGLgbxhV1rD5","Atif Aslam, Pritam","Tu Jaane Na","Tips Industries Ltd",101,143,111,"1270454"
162,"spotify:track:7lNbI1xd39QRdf6Mj8tvTv","Javed Ali","Saudebazi (Encore) [From ""Aakrosh""]","T-Series",162,-1,1,"1264431"
163,"spotify:track:2YevgojIN3UouxDM5JjzE0","Aditya A","Awaargi","Sony Music Entertainment India Pvt. Ltd.",163,177,4,"1263874"
164,"spotify:track:57DhVYA7E1CyrE4OKuyLb7","Maninder Buttar","Ik Tera","White Hill Music",29,-1,78,"1257089"
165,"spotify:track:6aQIGqAo9PxRKjUkhYtR6R","Anirudh Ravichander, Priya Mali","Hayyoda (From ""Jawan"")","T-Series",165,-1,1,"1256211"
166,"spotify:track:0gPgdRfB4jdGrlyXS0Vx78","Vishal-Shekhar, KK, Shilpa Rao, Anvita Dutt Guptan","Khuda Jaane","YRF Music",37,175,47,"1250295"
167,"spotify:track:6cUOiOY5qh2FpIQWIYAd2h","Pritam, Darshan Raval, Antara Mitra","Mehrama","Sony Music Entertainment India Pvt. Ltd.",10,146,144,"1244877"
168,"spotify:track:6V7UVqe8XnAS4WPdpaw5TK","Asees Kaur, Stebin Ben","Tu Mile Dil Khile","Saregama",20,-1,29,"1242075"
169,"spotify:track:4SqPZorSDuUtvdJwVGeZRC","Pritam, Arijit Singh, Amitabh Bhattacharya, Jonita Gandhi","Deva Deva","Sony Music Entertainment India Pvt. Ltd.",5,139,56,"1238027"
170,"spotify:track:6EB454nVg2u6sbeCvWAPej","Sam C.S., Anirudh Ravichander, Shakthisree Gopalan","Yaanji - From ""Vikram Vedha""","Think Music",122,151,16,"1232264"
171,"spotify:track:18YHbIhrleUkKKj2DvEp79","Pritam, KK","Zara Sa","Sony Music Entertainment India Pvt. Ltd.",33,144,32,"1231731"
172,"spotify:track:0pqnGHJpmpxLKifKRmU6WP","Imagine Dragons","Believer","Kid Ina Korner / Interscope",25,193,236,"1226825"
173,"spotify:track:28odLhBa4Yh2yPoDWJMOPb","Jubin Nautiyal, Payal Dev","Shish Nawata Hoon","Jubin Nautiyal",173,-1,1,"1226365"
174,"spotify:track:2r32XiAWtZbT3eLUvf4pag","Vishal Dadlani","Jee Le Zaraa","T-Series",151,152,6,"1226294"
175,"spotify:track:3wwLWFRLiReDf5AqgmAJwT","Rito Riba, Rajat Nagpal, Rana Sotal","Heer Ranjha","PlayDMF",11,-1,44,"1225355"
176,"spotify:track:1YMLgvsQdE27r30q0fsLeV","Arijit Singh","Tera Fitoor","Tips Industries Ltd",141,196,9,"1221367"
177,"spotify:track:3JkVYvxNoGf2HCWJo61462","Sidhu Moose Wala, Sunny Malton, SOE","Never Fold","Sidhu Moose Wala",13,179,71,"1213760"
178,"spotify:track:58HvfVOeJY7lUuCqF0m3ly","Elley Duhé","MIDDLE OF THE NIGHT","Not Fit For Society/RCA Records",12,185,87,"1211656"
179,"spotify:track:26b3oVLrRUaaybJulow9kz","Libianca","People","5K Records Limited",35,163,31,"1211527"
180,"spotify:track:5Gy67YHzPZTk9Q0D73LAGH","Jeet Gannguli, Arijit Singh","Khamoshiyan (From ""Khamoshiyan"")","Sony Music Entertainment India Pvt. Ltd.",107,186,18,"1209891"
181,"spotify:track:1E6EwZziD55AK437Ra0b99","Jass Manak","Lehanga","Geet Mp3",52,-1,5,"1201573"
182,"spotify:track:6mTvwBzWTGDOVeCNQEqtOE","Amaal Mallik, Arijit Singh, Tulsi Kumar","Soch Na Sake","T-Series",106,200,35,"1198155"
183,"spotify:track:3APdIdF8H0jsxSuGOqXedS","Rashid Ali","Kabhi Kabhi Aditi","T-Series",73,-1,93,"1195450"
184,"spotify:track:2q9lPN7CT92W1Ry77j2acn","Pritam, Arijit Singh, Shreya Ghoshal, Shadab Faridi, Altamash Faridi, Amitabh Bhattacharya","Ve Kamleya (From ""Rocky Aur Rani Kii Prem Kahaani"")","Saregama",136,136,5,"1189970"
185,"spotify:track:5urYiIXu1ZhfMAOsp7WDTc","Yasser Desai, Neha Kakkar, Rajat Nagpal","Dil Ko Karaar Aaya (From ""Sukoon"")","Desi Music Factory",3,171,114,"1188410"
186,"spotify:track:6R0FwF48PO2BrdZpLeWi42","Dhibu Ninan Thomas, Pradeep Kumar","Nee Kavithaigala","Think Music",128,159,22,"1184449"
187,"spotify:track:0NAUzrHSWZwDCFsAT5fBV4","Vishal Mishra, Anirudh Ravichander, Vignesh Shivan","Rathamaarey","Sun Pictures",134,134,2,"1182479"
188,"spotify:track:2y0hUGvHaKm2p5xmJF4HBe","Arijit Singh","Saware (From ""Phantom"")","T-Series",82,154,29,"1181507"
189,"spotify:track:7fRIo7WyDxXn3r233GCcdL","Thaman S, Anirudh Ravichander, Jonita Gandhi","Jimikki Ponnu","T-Series",37,127,34,"1178605"
190,"spotify:track:0EH7sgeiFqDa3eS7ieW2zs","Akon, Hamsika Iyer","Chammak Challo","T-Series",121,183,25,"1178293"
191,"spotify:track:2J2Z1SkXYghSajLibnQHOa","Sia","Unstoppable","Monkey Puzzle Records/RCA Records",16,197,109,"1167472"
