rank,uri,artist_names,track_name,source,peak_rank,previous_rank,weeks_on_chart,streams
191,"spotify:track:0MbOLfDcGk8ROHJYXJHu5c","Badshah, Karan Aujla, Devika Badyal","Players","Universal Music India Pvt Ltd.",7,169,50,"1016815"
192,"spotify:track:3JkVYvxNoGf2HCWJo61462","Sidhu Moose Wala, Sunny Malton, SOE","Never Fold","Sidhu Moose Wala",13,182,86,"1012915"
193,"spotify:track:2NTVtNcpC0i1R7LVGaCZCF","Badshah, Nikhita Gandhi","Jugnu","Universal Music India Pvt Ltd.",5,200,80,"1007916"
194,"spotify:track:3GEiVoaUXq468gfYs2EPfh","DIVINE, Sidhu Moose Wala","Chorni","DIVINE",8,188,22,"999390"
195,"spotify:track:5rpCUsEfBLIumvrxrahnKF","Hasan Raheem, Umair, Talwiinder","Wishes","1698613 Records DK2",195,-1,1,"994959"
196,"spotify:track:03hJuEQpEQERrHpjcXKWzJ","Mithoon, Arijit Singh, Manoj Muntashir","Tumhe Kitna Pyaar Karte (From ""Bawaal"")","T-Series",20,-1,21,"990379"
197,"spotify:track:1hQia6rxgfM1ly2hE3StWp","Vishal-Shekhar, Salim Merchant, Neeti Mohan, Shekhar Ravjiani","Ishq Wala Love","Sony Music Entertainment India Pvt. Ltd.",100,195,50,"987887"
198,"spotify:track:2y0hUGvHaKm2p5xmJF4HBe","Arijit Singh","Saware (From ""Phantom"")","T-Series",82,176,43,"986800"
199,"spotify:track:2n9ylYiF7urpXo36qBwr3g","Stebin Ben","Mera Dil Bhi Kitna Pagal Hai - Recreated Version","Ishtar Music Pvt. Ltd.",70,185,33,"986628"
200,"spotify:track:3B9CL5t32mM2SDdps2IhYM","Saad Lamjarred, Shreya Ghoshal, Rajat Nagpal","Guli Mata","PlayDMF",36,179,19,"985792"
