rank,uri,artist_names,track_name,source,peak_rank,previous_rank,weeks_on_chart,streams
1,"spotify:track:4VsP4Dm8gsibRxB5I2hEkw","Kaifi Khalil","Kahani Suno 2.0","1944121 Records DK",1,1,18,"4928171"
2,"spotify:track:1418IuVKQPTYqt7QNJ9RXN","King","Maan Meri Jaan","Warner Music India",1,2,27,"4533689"
3,"spotify:track:0czcoKJbJt08NqKrvSbbz7","Pritam, Arijit Singh, Amitabh Bhattacharya","O Bedardeya (From ""Tu Jhoothi Main Makkaar"")","T-Series",3,3,6,"4338502"
4,"spotify:track:4UMIv5jd9gK98a39BQRD9X","Pritam, Arijit Singh, Amitabh Bhattacharya","Kesariya","Sony Music Entertainment India Pvt. Ltd.",1,4,40,"3996519"
5,"spotify:track:73K33p4Vyz9koXGqmL5eFs","Sachet Tandon, Parampara Tandon, Kumaar, Sachet-Parampara","Malang Sajna","T-Series",5,6,13,"3678545"
6,"spotify:track:2ZD4aIEepqZsdxPxLSuUhm","Pritam, Arijit Singh, Amitabh Bhattacharya, Nikhita Gandhi","Tere Pyaar Mein","T-Series",5,7,11,"3226312"
7,"spotify:track:24MMjyA3NLqCsDJfsn51eg","Sharn, 40k, The Paul","Mi Amor","Desi Avenue",7,10,14,"2965383"
8,"spotify:track:6FAYpZ4jve8vpvTwUvjK6H","Vishal-Shekhar, Arijit Singh, Sukriti Kakar, Vishal Dadlani, Shekhar Ravjiani, Kumaar","Jhoome Jo Pathaan","YRF Music",3,11,17,"2920831"
9,"spotify:track:3wz2vWhYnnBoFmgMkqtzLy","Chani Nattan, Inderpal Moga","Daku","Kharku Life Records",5,9,35,"2829556"
10,"spotify:track:2NmBCDkjvJVvEZkH5QDOeb","Varinder Brar, Rav Dhaliwal, Ultra Beats","Thaa","Varinder Brar Music",10,28,3,"2755269"
11,"spotify:track:2vPrBucKCfKmafHhSfJ2pt","Pritam, Arijit Singh, Amitabh Bhattacharya, Charan","Pyaar Hota Kayi Baar Hai (From ""Tu Jhoothi Main Makkaar"")","T-Series",9,12,10,"2714399"
12,"spotify:track:7MXVkk9YMctZqd1Srtv4MB","The Weeknd, Daft Punk","Starboy","Universal Republic Records",12,23,90,"2706350"
13,"spotify:track:0WtM2NBVQNNJLh6scP13H8","Rema, Selena Gomez","Calm Down (with Selena Gomez)","Mavin Records / Jonzing World",11,15,31,"2689085"
14,"spotify:track:2FCXQHugkoHE1K3tiDu8pu","Alka Yagnik, Arijit Singh","Agar Tum Saath Ho (From ""Tamasha"")","T-Series",4,14,203,"2631235"
15,"spotify:track:0CtZpaOhtzvLV3FfcsVpQo","Vishal-Shekhar, Shilpa Rao, Caralisa Monteiro, Vishal Dadlani, Shekhar Ravjiani, Kumaar","Besharam Rang (From ""Pathaan"")","YRF Music",4,18,19,"2542021"
16,"spotify:track:54ipXppHLA8U4yqpOFTUhr","Imagine Dragons","Bones","Kid Ina Korner / Interscope",15,21,20,"2463124"
17,"spotify:track:0snQrp1VaY5Pj1YIHRJpRJ","Aditya A","Chaand Baaliyan","Sony Music Entertainment India Pvt. Ltd.",2,16,61,"2450084"
18,"spotify:track:08Isz2ETWSBhvIl8UpKYsp","Shubh","No Love","SHUBH",2,19,58,"2382656"
19,"spotify:track:0yCWDaAgOtg6TKlNCg9rwA","King","Tu Aake Dekhle","Warner Music India",3,13,116,"2371546"
20,"spotify:track:4ZVtid5khBfDx6Co0vTUE6","Jassa Dhillon, thiarajxtt","SPAIN","Jassa Dhillon",14,17,12,"2312895"
21,"spotify:track:0TlGvDUBcIUGZOroftyVF4","Sidhu Moose Wala, Burna Boy, Steel Banglez","Mera Na","Sidhu Moose Wala",5,5,2,"2282547"
22,"spotify:track:42TMa2hgBNjte4uV7jNCnQ","Shubh, Ikky","Baller","SHUBH",2,20,32,"2254687"
23,"spotify:track:72zHuDxFQTjbL51qJQSA7j","Jasleen Royal, B Praak, Romy, Anvita Dutt","Ranjha (From ""Shershaah"")","Sony Music Entertainment India Pvt. Ltd.",1,26,89,"2228419"
24,"spotify:track:2rOnSn2piaqLAlYjtfUBlY","Tanishk Bagchi, Jubin Nautiyal, Asees Kaur","Raataan Lambiyan (From ""Shershaah"")","Sony Music Entertainment India Pvt. Ltd.",1,25,90,"2212448"
25,"spotify:track:3USxtqRwSYz57Ewm6wWRMp","Glass Animals","Heat Waves","Polydor Records",3,89,92,"2152797"
26,"spotify:track:03yKEFruN3BS2coglBtt2N","Laddi Chahal, Parmish Verma, Gurlez Akhtar","Rubicon Drill","Parmish Verma Films",20,24,18,"2130073"
27,"spotify:track:1Y3LN4zO1Edc2EluIoSPJN","Stephen Sanchez, Em Beihold","Until I Found You (with Em Beihold) - Em Beihold Version","Republic Records",24,30,20,"2090260"
28,"spotify:track:2eAvDnpXP5W0cVtiI0PUxV","Ruth B.","Dandelions","Columbia",14,34,73,"2043046"
29,"spotify:track:0tgVpDi06FyKpA1z0VMD4v","Ed Sheeran","Perfect","Atlantic Records UK",29,39,157,"2037829"
30,"spotify:track:2Fv2injs4qAm8mJBGaxVKU","Arijit Singh, Mithoon","Tujhe Kitna Chahne Lage (From ""Kabir Singh"")","T-Series",2,52,203,"2001527"
31,"spotify:track:1y1rQTkWmrZdJmjwuK07GC","Vishal Mishra","Kaise Hua (From ""Kabir Singh"")","T-Series",5,37,201,"1973477"
32,"spotify:track:4blqlsA1uf2d2I40E90EUC","Pritam, Arijit Singh, Shilpa Rao","Tere Hawaale (From ""Laal Singh Chaddha"")","T-Series",32,50,8,"1970310"
33,"spotify:track:0zlGnseLGzRIBA0TJcb3Bo","Yohani, Jubin Nautiyal, Tanishk Bagchi, Rashmi Virag, Surya Ragunaathan","Manike (From ""Thank God"")","T-Series",2,31,31,"1946931"
34,"spotify:track:0MbOLfDcGk8ROHJYXJHu5c","Badshah, Karan Aujla, Devika Badyal","Players","Universal Music India Pvt Ltd.",7,27,17,"1926196"
35,"spotify:track:7mSzDKajY2wUtstQSLdzMK","Mohit Chauhan, Rochak Kohli","Rang Lageya","Saregama",35,43,12,"1917319"
36,"spotify:track:5O2P9iiztwhomNh8xkR9lJ","One Direction","Night Changes","Syco Music",22,42,101,"1904535"
37,"spotify:track:29m79w9xPMH4YCD6r8JSmV","AP Dhillon, Gurinder Gill, Intense","Excuses","RUN-UP RECORDS",1,29,78,"1888827"
38,"spotify:track:5iCY0TXNImK4hyKfcplQsg","Anuv Jain","Baarishein","Universal Music India Pvt. Ltd. (on behalf of Anuv Jain)",25,33,101,"1823168"
39,"spotify:track:3qrdLVOClRU4yPkcXZ7c5u","Ayushmann Khurrana, Tanishk-Vayu","Mere Liye Tum Kaafi Ho (From ""Shubh Mangal Zyada Saavdhan"")","T-Series",11,70,165,"1817883"
40,"spotify:track:7eQl3Yqv35ioqUfveKHitE","Pritam, Mohit Chauhan","Tum Se Hi","T-Series",33,35,161,"1813307"
41,"spotify:track:3yV2c3cYhkAwSsxAq6nRiv","Gajendra Verma","Mann Mera","Sony Music / Eros Now Music",29,32,109,"1782309"
42,"spotify:track:0NZPBYD5qbEWRs3PrGiRkT","Sam Smith, Kim Petras","Unholy (feat. Kim Petras)","Capitol Records UK / EMI",6,40,29,"1767097"
43,"spotify:track:1smFN2CLqGROu0J0UyvDfL","Pritam, Arijit Singh","Shayad","Sony Music Entertainment India Pvt. Ltd.",1,36,170,"1765017"
44,"spotify:track:4SqPZorSDuUtvdJwVGeZRC","Pritam, Arijit Singh, Amitabh Bhattacharya, Jonita Gandhi","Deva Deva","Sony Music Entertainment India Pvt. Ltd.",5,41,37,"1758161"
45,"spotify:track:26b3oVLrRUaaybJulow9kz","Libianca","People","5K Records Limited",35,58,12,"1756362"
46,"spotify:track:5IgjP7X4th6nMNDh4akUHb","Chris Brown","Under The Influence","Chris Brown Entertainment/RCA Records",7,48,36,"1748183"
47,"spotify:track:561jH07mF1jHuk7KlaeF0s","Eminem","Mockingbird","Aftermath",24,56,20,"1709340"
48,"spotify:track:0cgwdBXXlPfXJXWf3wMs32","G. V. Prakash, Shweta Mohan","Vaa Vaathi","Aditya Music",9,38,23,"1708315"
49,"spotify:track:6TClJ8jXi3OBV7gcrU3jx5","AP Dhillon, Gurinder Gill","TERE TE","RUN-UP RECORDS",7,47,74,"1697968"
50,"spotify:track:7lvDsmTRXFE3dK4OjvRiWB","Shae Gill, Ali Sethi","Pasoori","Giraffe Pakistan",1,45,61,"1666312"
51,"spotify:track:5W7DOVGQLTigu09afW7QMT","Sidhu Moose Wala","295","Sidhu Moose Wala",1,46,62,"1665009"
52,"spotify:track:6ZYxNjuAU9Vy3VtF6W1dtE","Shubh","We Rollin","SHUBH",10,44,73,"1650000"
53,"spotify:track:3SiQsAVS3CDJQzWPRyX1XP","Badshah, Lakhwinder Wadali, Lucky Noor","Sanak","Universal Music India Pvt Ltd.",53,60,4,"1636813"
54,"spotify:track:37F0uwRSrdzkBiuj0D5UHI","The Weeknd","Reminder","Universal Republic Records",49,67,8,"1628862"
55,"spotify:track:6H7fLdt0AeWpuxUKXuXWrx","Hariharan","Shree Hanuman Chalisa","T-Series",39,55,36,"1620109"
56,"spotify:track:6vNolBIVWvfY3Z20gAG5nI","Payal Dev, Jubin Nautiyal, Kunaal Vermaa","Tum Hi Aana (Sad Version) [From ""Marjaavaan""]","T-Series",56,186,3,"1570965"
57,"spotify:track:2tjWCe2W7sgvS3C8NHcdtI","Akhil, Dhvani Bhanushali, Kunaal Vermaa","Duniyaa (From ""Luka Chuppi"")","T-Series",1,61,217,"1567762"
58,"spotify:track:7AsG1F1eMWd17RYan8M3Wm","AP Dhillon, Shinda Kahlon","Dil Nu","RUN-UP RECORDS",58,63,28,"1561665"
59,"spotify:track:3oWv5qDKYN7MH6FdlglMN5","Guru Randhawa, Sanjoy","Moon Rise","T-Series",18,54,18,"1560414"
60,"spotify:track:2GXXZFUxYg2LvG8SR0byOE","Atif Aslam","Jeena Jeena","Eros Now Music",49,49,95,"1556805"
61,"spotify:track:2AilvPt1AQ8PixlCKqkjfj","Shubh","Elevated","SHUBH",27,51,68,"1535170"
62,"spotify:track:4bD9z9qa4qg9BhryvYWB7c","Pritam, Tochi Raina, Rekha Bhardwaj","Kabira","T-Series",45,65,188,"1517780"
63,"spotify:track:6udC4b4jOSnHb9ItnXgKLR","Sachin-Jigar, Shreya Ghoshal, Tochi Raina","Saibo","Sony Music Entertainment India Pvt. Ltd.",31,53,129,"1513004"
64,"spotify:track:2qxmye6gAegTMjLKEBoR3d","Alec Benjamin","Let Me Down Slowly","2018",34,78,158,"1511553"
65,"spotify:track:567e29TDzLwZwfDuEpGTwo","The Kid LAROI, Justin Bieber","STAY (with Justin Bieber)","Columbia",1,69,93,"1483090"
66,"spotify:track:2J2Z1SkXYghSajLibnQHOa","Sia","Unstoppable","Monkey Puzzle Records/RCA Records",16,73,90,"1467999"
67,"spotify:track:0ojpEubhy4JNeVftmVuiN7","Vishal Mishra, Armaan Malik","Pehla Pyaar","T-Series",11,72,99,"1456841"
68,"spotify:track:2IoZMG3RqiTmsy7Li3zGFg","Sachet Tandon, Parampara Tandon, Sachet-Parampara","Mere Sohneya (From ""Kabir Singh"")","T-Series",4,106,157,"1444195"
69,"spotify:track:0pqnGHJpmpxLKifKRmU6WP","Imagine Dragons","Believer","Kid Ina Korner / Interscope",25,88,217,"1433005"
70,"spotify:track:1LbBOhicFmu7ktJqIHCELt","Thalapathy Vijay, M.M.Manasi, Thaman S","Ranjithame (From ""Varisu"")","T-Series",9,71,24,"1427031"
71,"spotify:track:0GamKm5LCEwxFh8p2VWvnq","Aditya Bhardwaj","Bye","Warner Music India",71,104,3,"1416951"
72,"spotify:track:7fRIo7WyDxXn3r233GCcdL","Thaman S, Anirudh Ravichander, Jonita Gandhi","Jimikki Ponnu","T-Series",37,66,16,"1399860"
73,"spotify:track:5HgXSvl2YoBtEY623UsACk","Ilaiyaraaja, Ananya Bhat","Kaattumalli","Sony Music Entertainment India Pvt. Ltd.",73,138,2,"1399758"
74,"spotify:track:2QophXhN2Ls2URfoPmiviC","Taaruk Raina, Mismatched - Cast","Kho Gaye","Netflix Music",8,95,27,"1393966"
75,"spotify:track:5G7pZ8G8NFvS1MQ9H4L7dC","Javed-Mohsin, Arijit Singh, Shreya Ghoshal, Kunaal Vermaa, Prashant Ingole","Pal","Sony Music Entertainment India Pvt. Ltd.",44,62,215,"1387495"
76,"spotify:track:5nhP1idzo26UhFB9jjlIDE","Ram Miriyala, Dhee, Santhosh Narayanan, Kasarla Shyam","Chamkeela Angeelesi (From ""Dasara"")","Saregama",57,68,6,"1379863"
77,"spotify:track:7qiZfU4dY1lWllzX7mPBI3","Ed Sheeran","Shape of You","Atlantic Records UK",63,87,154,"1379042"
78,"spotify:track:6FjbAnaPRPwiP3sciEYctO","Pritam, Arijit Singh","Raabta","T-Series",46,57,47,"1377749"
79,"spotify:track:1aL9518P5G72N92b48tuKw","AP Dhillon","Summer High","RUN-UP RECORDS",3,64,37,"1376421"
80,"spotify:track:32LKwbmh6yVsWoRRF8DIvf","Pav Dharia","Na Ja","Ishtar-White Hill Music",35,108,76,"1369595"
81,"spotify:track:2PvaburAUlhNHxVhw5lvOq","Arijit Singh","Humdard (From ""Ek Villain"")","T-Series",79,82,144,"1366750"
82,"spotify:track:60YICjIPdL7LDBcCMK0tAk","Sidhu Moose Wala, Sunny Malton, The Kidd","Levels","Sidhu Moose Wala",8,75,47,"1334303"
83,"spotify:track:3JkVYvxNoGf2HCWJo61462","Sidhu Moose Wala, Sunny Malton, SOE","Never Fold","Sidhu Moose Wala",13,84,52,"1333999"
84,"spotify:track:1t39FBb0zsKv5krZaqZKCB","Pritam, Amitabh Bhattacharya, Sunidhi Chauhan, Shashwat Singh","Show Me The Thumka (From ""Tu Jhoothi Main Makkaar"")","T-Series",41,76,7,"1321078"
85,"spotify:track:5fjIpQa7O7ttgx64TN9lZR","Armaan Malik, Amaal Mallik","Kaun Tujhe (Armaan Malik Version)","T-Series",85,-1,1,"1300150"
86,"spotify:track:5XeFesFbtLpXzIVDNQP22n","Arctic Monkeys","I Wanna Be Yours","Domino Recording Co",86,107,23,"1293637"
87,"spotify:track:4afA2YQlZfYzJbfnNoNknK","Jubin Nautiyal, Payal Dev, Manoj Muntashir","Mere Ghar Ram Aaye Hain","T-Series",65,79,6,"1291819"
88,"spotify:track:48Ix6ReYdJf2H4mKb3TIpj","Atif Aslam, Alisha Chinai, Pritam","Tera Hone Laga Hoon","Tips Industries Ltd",59,83,101,"1291144"
89,"spotify:track:1ZaeaGLhFSckG8sv1y7AWk","Harrdy Sandhu, Jaani","Kya Baat Ay","Sony Music Entertainment India Pvt. Ltd.",42,-1,55,"1283903"
90,"spotify:track:0uk9sQ7MjK0CdAUinD4xBV","MC STAN","Ek Din Pyaar","MC Stan",21,80,22,"1281624"
91,"spotify:track:58HvfVOeJY7lUuCqF0m3ly","Elley Duhé","MIDDLE OF THE NIGHT","Not Fit For Society/RCA Records",12,91,68,"1278258"
92,"spotify:track:0VjIjW4GlUZAMYd2vXMi3b","The Weeknd","Blinding Lights","Republic Records",4,103,177,"1269195"
93,"spotify:track:6FrihRowEuYfNehH0zcx0e","DG IMMORTALS, Raga, Harjas Harjaayi, VIRTUAL_AF, DARK HORSE","KALESHI CHORI","Universal Music India Pvt Ltd.",10,86,16,"1269096"
94,"spotify:track:7ouBSPZKQpm7zQz2leJXta","Arijit Singh","Tum Hi Ho (From ""Aashiqui 2"")","T-Series",78,93,116,"1261533"
95,"spotify:track:6tkl6rjuXWtVOCaXSSSCz2","Armaan Malik","Jab Tak (From ""M.S.Dhoni - The Untold Story"")","T-Series",37,94,49,"1255196"
96,"spotify:track:7E0A86Yhc0ZyOl6aAPE5wN","Tanishk Bagchi, Anu Malik, Abhijeet","Main Khiladi - From ""Selfiee""","Desi Music Factory",44,128,11,"1246765"
97,"spotify:track:3wwLWFRLiReDf5AqgmAJwT","Rito Riba, Rajat Nagpal, Rana Sotal","Heer Ranjha","PlayDMF",11,102,26,"1242541"
98,"spotify:track:6anGj4SX83j5DyG3aZOzqc","Arjun Kanungo","Zara Zara - MTV Unwind","Saregama",98,133,2,"1234665"
99,"spotify:track:58SIEtTjWErr0yEXVBKxvd","Jubin Nautiyal","Shri Krishna Govind Hare Murari","T-Series",99,109,9,"1232640"
100,"spotify:track:6rFckZb1cuJYzsZiGHgqks","Karan Aujla, Ikky","52 Bars","Rehaan Records",12,81,11,"1226501"
101,"spotify:track:3gOXq3FPPesm7VLPKmef6j","Arijit Singh, Shashaa Tirupati","Rait Zara Si","T-Series",12,97,72,"1223981"
102,"spotify:track:69CrOS7vEHIrhC2ILyEi0s","JISOO","FLOWER","YG Entertainment/Interscope Records",85,85,3,"1213824"
103,"spotify:track:6V7UVqe8XnAS4WPdpaw5TK","Asees Kaur, Stebin Ben","Tu Mile Dil Khile","Saregama",20,129,13,"1201314"
104,"spotify:track:0UZLaEOSIc5kg0cc7eszqC","Vishal Mishra","Manjha","Desi Music Factory",53,178,47,"1200718"
105,"spotify:track:0rk2X5TAhraBC5aCIXK2Rq","Jawad Ahmad, Shaarib Toshi, Arijit Singh, Shreya Ghoshal","Samjhawan","Sony Music Entertainment India Pvt. Ltd.",70,92,103,"1195287"
106,"spotify:track:4Dvkj6JhhA12EX05fT7y2e","Harry Styles","As It Was","Columbia",5,99,55,"1194517"
107,"spotify:track:4SJMuaIYcBS8ke96lDYOsw","Karan Aujla","On Top","Karan Aujla Music",17,77,21,"1184508"
108,"spotify:track:6TK7jseRCrogw9IzQYkw2h","Silambarasan TR, Thaman S","Thee Thalapathy (From ""Varisu"")","T-Series",11,98,20,"1183728"
109,"spotify:track:6v3KW9xbzN5yKLt9YKDYA2","Shawn Mendes, Camila Cabello","Señorita","Island Records",1,127,200,"1181551"
110,"spotify:track:0l6g8Z8mqGbGXFOjigYetD","Pritam, Arijit Singh","Hawayein","Sony Music Entertainment India Pvt. Ltd.",51,120,80,"1175547"
111,"spotify:track:5si4xdFplkXAydKfFe1xXa","Karan Aujla, Ikky","Take It Easy","Rehaan Records",34,114,11,"1166003"
112,"spotify:track:5yjh1Y7lt6lx0nPslNz3H0","Sanatan Sangeet","Ram Siya Ram - Remastered 2023","Sanatan Sangeet",59,59,7,"1159911"
113,"spotify:track:1a8w8nlIyIhE2W1HIayKnl","Amit Trivedi, Amitabh Bhattacharya, Sireesha Bhagavatula","Ghodey Pe Sawaar (From ""Qala"")","Sony Music Entertainment India Pvt. Ltd. / Netflix Music Inc.",11,90,17,"1158370"
114,"spotify:track:4wIWWEhbdgKAxhR68eE0Ye","Arijit Singh, Chinmayi","Mast Magan (From ""2 States"")","T-Series",75,101,113,"1154632"
115,"spotify:track:1ccZZf0IQi5y0bHMl2aGDF","Sanam","Gulabi Aankhen","Universal Music India Pvt Ltd.",103,137,33,"1147404"
116,"spotify:track:1UWacd8x8tPPwmrPB1MoBI","Pritam, Arijit Singh","Ae Dil Hai Mushkil Title Track","Sony Music Entertainment India Pvt. Ltd.",105,110,168,"1145323"
117,"spotify:track:1ZiReD9pPTttQWwSoYqdyH","Dikshant","Aankhon Se Batana","Sony Music Entertainment India Pvt. Ltd.",38,96,52,"1144996"
118,"spotify:track:4JvziZ2kQsbzfvRQtpYfmJ","Sunny Yaduvanshi, AK Rok, Nitesh Ujoli","Yadav Brand 2","Flame Music",118,136,6,"1143914"
119,"spotify:track:4W4fNrZYkobj539TOWsLO2","The Weeknd, Ariana Grande","Die For You (with Ariana Grande) - Remix","XO / Republic Records",30,124,8,"1142799"
120,"spotify:track:0u2P5u6lvoDfwTYjAADbn4","Billie Eilish, Khalid","lovely (with Khalid)","Darkroom",23,165,208,"1136963"
121,"spotify:track:2n9ylYiF7urpXo36qBwr3g","Stebin Ben","Mera Dil Bhi Kitna Pagal Hai - Recreated Version","Ishtar Music Pvt. Ltd.",121,-1,15,"1134342"
122,"spotify:track:7B4uYqxTpTOS1sgxFB9Ann","Sidhu Moose Wala, Wazir Patar","The Last Ride","Sidhu Moose Wala",3,111,49,"1132773"
123,"spotify:track:4OcvkkpF3xmyCGGY5IBlgi","Akhil Sachdeva, Tulsi Kumar","Tera Ban Jaunga (From ""Kabir Singh"")","T-Series",4,145,192,"1123683"
124,"spotify:track:0WUUFBKX2vlagsbYm3KUG2","Vilen","Kyun Dhunde - 1 Min Music","Universal Music India Pvt Ltd.",22,22,25,"1122147"
125,"spotify:track:0o9zmvc5f3EFApU52PPIyW","Fujii Kaze","Shinunoga E-Wa","Universal Music LLC",42,125,25,"1121646"
126,"spotify:track:0FBQ4NrrHUbR9kus7rzrOj","Atif Aslam","Dil Diyan Gallan","YRF Music",82,117,166,"1119983"
127,"spotify:track:4LK8863ScRhhT6hitFfBI5","Santhosh Narayanan, Pradeep, Priya Hemesh","Aval","Sony Music Entertainment India Pvt. Ltd.",99,105,8,"1119039"
128,"spotify:track:3HiobOOpSpMsi95WBKPBYk","Jeet Gannguli, Arijit Singh","Hamari Adhuri Kahani (Title Track)","Sony Music Entertainment India Pvt. Ltd.",128,131,75,"1116228"
129,"spotify:track:2y0hUGvHaKm2p5xmJF4HBe","Arijit Singh","Saware (From ""Phantom"")","T-Series",113,123,10,"1112796"
130,"spotify:track:3H3x4NhR3wJh6IvRHmPvkd","Thaman S, Srivardhani Kuchi, Aditi, Satya Yamini, Roshini, Tejaswini","Tum Tum (From ""Enemy"")","Divo",35,112,45,"1112167"
131,"spotify:track:0NvGVd87SYZnryTcfQPKUO","Madhur Sharma","Kali Kali Zulfon Ke","Pearl Records",61,-1,44,"1111393"
132,"spotify:track:6bdpj89aYEBjhpsenXAsmO","A.R. Rahman, Arijit Singh","Enna Sona","Sony Music Entertainment India Pvt. Ltd.",34,132,102,"1103992"
133,"spotify:track:2RgvvnMwtP0R2OkVZmFvnV","KK","Ajab Si (From ""Om Shanti Om"")","T-Series",46,118,67,"1101911"
134,"spotify:track:3ZGJhN4unVspOqpwGvUL2W","Diljit Dosanjh","Lemonade","DILJIT DOSANJH",33,100,38,"1100671"
135,"spotify:track:4nriYsKSq1VmiamjZOB4Tp","Pritam, Jubin Nautiyal, Amitabh Bhattacharya","Jaadui (From ""Tu Jhoothi Main Makkaar"")","T-Series",117,148,4,"1093949"
136,"spotify:track:1hQia6rxgfM1ly2hE3StWp","Vishal-Shekhar, Salim Merchant, Neeti Mohan, Shekhar Ravjiani","Ishq Wala Love","Sony Music Entertainment India Pvt. Ltd.",100,122,36,"1086725"
137,"spotify:track:43GfQ1SC17rBWiHkOtdwK8","Atif Aslam, Shirley Setia, Dj Chetas","Jab Koi Baat - Recreated","Ishtar Music Pvt. Ltd.",44,197,43,"1086374"
138,"spotify:track:3APdIdF8H0jsxSuGOqXedS","Rashid Ali","Kabhi Kabhi Aditi","T-Series",73,115,75,"1085387"
139,"spotify:track:6zJejIfVYLgjud3lTk4DLB","Rosa Linn","SNAP","Columbia",93,143,31,"1085045"
140,"spotify:track:3jyqXdAjwqO3gFtjnYrbq9","Darshan Raval, Rochak Kohli","Ek Ladki Ko Dekha Toh Aisa Laga (From ""Ek Ladki Ko Dekha Toh Aisa Laga"")","Saregama",104,135,22,"1072303"
141,"spotify:track:1hSbtbX2cVbSyBVqoYHjSj","Anirudh Ravichander, Dhee, Muthamil","Mainaru Vetti Katti","Saregama",141,-1,1,"1072149"
142,"spotify:track:3nKQrVVlwbAQSnFbgZWdN0","Avvy Sra, Karan Aujla, Jaani","White Brown Black","Universal Music India Pvt Ltd. – Distribution",49,113,18,"1067794"
143,"spotify:track:0rMeOAvbQZ2RTG4B6L1M4p","Darshan Raval","Asal Mein","Indie Music Label",21,142,99,"1060722"
144,"spotify:track:5urYiIXu1ZhfMAOsp7WDTc","Yasser Desai, Neha Kakkar, Rajat Nagpal","Dil Ko Karaar Aaya (From ""Sukoon"")","Desi Music Factory",3,74,100,"1059682"
145,"spotify:track:6gwnKOvdBKkTU4CQ7KpIAu","Shaarib Toshi, Arijit Singh","Bandeya - From ""Dil Juunglee""","Pooja Music",76,119,38,"1038754"
146,"spotify:track:1L3Nsi7YXtBxTdnbqektia","Darshan Raval","Hawa Banke","Indie Music Label",26,134,44,"1031263"
147,"spotify:track:5O932cZmzOZGOGZz9RHx20","Pritam, Arijit Singh","Khairiyat","T-Series",1,130,189,"1014527"
148,"spotify:track:2dHHgzDwk4BJdRwy9uXhTO","Metro Boomin, The Weeknd, 21 Savage","Creepin' (with The Weeknd & 21 Savage)","Republic Records",138,167,16,"999657"
149,"spotify:track:6VhuP99TE6gYNQRJIlAWFD","Stephen Sanchez","Until I Found You","Republic Records",20,164,51,"999295"
150,"spotify:track:6biqkuWq069vByAEeGxZlr","Shubh","Her","SHUBH",30,116,20,"996601"
151,"spotify:track:7FbrGaHYVDmfr7KoLIZnQ7","FIFTY FIFTY","Cupid - Twin Ver.","ATTRAKT",151,-1,1,"995897"
152,"spotify:track:7d4ZrG3Cer7jbqIl6wOI6D","Tyson Sidhu","GODSPEED","Game Time",79,144,22,"993252"
153,"spotify:track:2LBqCSwhJGcFQeTHMVGwy3","The Weeknd","Die For You","Universal Republic Records",137,179,11,"993038"
154,"spotify:track:1PSFtCx1i5J6b7mSxhTXIz","Mohit Lalwani, Bharat Kamal","Samay Samjhayega (Lofi)","Melo",154,172,2,"989264"
155,"spotify:track:0lYBSQXN6rCTvUZvg9S0lU","DJ Snake, Justin Bieber","Let Me Love You","DJ Snake Def Jam",90,-1,206,"988382"
156,"spotify:track:6cUOiOY5qh2FpIQWIYAd2h","Pritam, Darshan Raval, Antara Mitra","Mehrama","Sony Music Entertainment India Pvt. Ltd.",10,141,125,"984954"
157,"spotify:track:59eeV0SIeyd431uyjAWCRe","G. V. Prakash, Shweta Mohan","Mastaaru Mastaaru","Aditya Music",48,126,9,"981418"
158,"spotify:track:1d5lpW3gUyq537iuyrb9Lf","Aditya Rikhari","Samjho Na","CollabX Productions",158,-1,6,"979165"
159,"spotify:track:7sVEoPc5ZUUQerRkgTypUZ","Javed Ali, Devi Sri Prasad","Srivalli (From ""Pushpa The Rise Part - 01"")","T-Series",4,-1,54,"978512"
160,"spotify:track:2ZRo7axmMPeSVUvDbGkJah","XXXTENTACION","Hope","Bad Vibes Forever, LLC",44,177,99,"977634"
161,"spotify:track:6yvxu91deFKt3X1QoV6qMv","Anirudh Ravichander, Jonita Gandhi","Arabic Kuthu - Halamithi Habibo (From ""Beast"")","Sun Pictures",2,156,62,"977026"
162,"spotify:track:0GQngE2rOYvlKwEQjTAsP8","Pritam, Sreeram, Shilpa Rao","Subhanallah","T-Series",126,154,34,"976450"
163,"spotify:track:57jOEZtoLQK4zF2x55bdkp","Rochak Kohli, Arijit Singh, Neha Kakkar","Tu Hi Yaar Mera (From ""Pati Patni Aur Woh"")","T-Series",8,157,174,"974284"
164,"spotify:track:0lKILDCwOjyR54xYhBazuJ","Sachet Tandon","Ram Siya Ram","T-Series",120,140,4,"974038"
165,"spotify:track:6R0FwF48PO2BrdZpLeWi42","Dhibu Ninan Thomas, Pradeep Kumar","Nee Kavithaigala","Think Music",149,176,3,"973328"
166,"spotify:track:7hbqKqRKkG99KfM4hmVm3w","Imdad Hussain, RDRKSH","Khudaya Khair","Imdad Hussain",150,150,4,"969309"
167,"spotify:track:3sqRODOZ1Z6hR4F2tnFAlg","Maninder Buttar","Sakhiyaan","White Hill Music",20,-1,198,"968867"
168,"spotify:track:3k9PtGmPNnQtt32TKWm6f3","MC STAN","Basti Ka Hasti","MC Stan",35,146,28,"966350"
169,"spotify:track:2tMoOS9grHtn4upzb4LwMG","Dhibu Ninan Thomas, Kapil Kapilan","Adiye - From ""Bachelor""","Think Music",16,139,72,"965349"
170,"spotify:track:5pebgx4IJ5YvZH2sYOHDRf","Barney Sku, Taqiya Zaman","Your Eyes","Barney Sku",80,121,13,"963114"
171,"spotify:track:3GrCQPpKqKzOcKfMAoqn82","Tanishk Bagchi, Arijit Singh, Asees Kaur","Bolna (From ""Kapoor & Sons (Since 1921)"")","Sony Music Entertainment India Pvt. Ltd.",101,-1,28,"960661"
172,"spotify:track:2NTVtNcpC0i1R7LVGaCZCF","Badshah, Nikhita Gandhi","Jugnu","Universal Music India Pvt Ltd.",5,170,72,"958653"
173,"spotify:track:1feANd8EfcDP5UqSvbheM3","Sachet Tandon, Sachet-Parampara","Bekhayali (From ""Kabir Singh"")","T-Series",1,191,179,"956887"
174,"spotify:track:45C7tXCrmp3R5E65XUtLLj","Tanishk Bagchi, Faridkot, Yohani, Amar Jalal, Harjot Kaur","Jehda Nasha (From ""An Action Hero"")","T-Series",27,163,22,"956630"
175,"spotify:track:3jtKSUiVDowKNBqVQbWaig","Amit Trivedi, Kavita Seth, Amitabh Bhattacharya","Iktara","Sony Music Entertainment India Pvt. Ltd.",73,155,50,"955399"
176,"spotify:track:1eHkjvvyncnmjgwCSGI0el","Emiway Bantai","Company","Bantai Studio",76,149,9,"952256"
177,"spotify:track:7cVe3mYMIfhOlz1NXFWv70","Sidhu Moose Wala","0 to 100","Sidhu Moose Wala",45,162,17,"951874"
178,"spotify:track:1nvvaiJbrhCkM3Az74N1pM","Jasleen Royal, Prerna Arora, Ashwani Basoya","Ranjha - Sid X Kiara Version","Sony Music Entertainment India Pvt. Ltd.",161,-1,3,"950955"
179,"spotify:track:04UzZSWfw8hkK832P27QLq","Nikk, Avneet Kaur","Yaari","BANG Music",18,-1,67,"949537"
180,"spotify:track:0QT9B8Yfrz0vi66oXMrKJg","Pritam, Amitabh Bhattacharya, Neeraj Shridhar, Abhijit Vaghani, Ashish Pandit","Character Dheela 2.0 (From ""Shehzada"")","T-Series",55,195,10,"947300"
181,"spotify:track:2l3dFxtoSMgMQVyRIUHjpz","Mitraz","Akhiyaan","Mitraz Records",23,159,51,"947046"
182,"spotify:track:0qOnSQQF0yzuPWsXrQ9paz","Gym Class Heroes, Adam Levine","Stereo Hearts (feat. Adam Levine)","Decaydance/Fueled By Ramen",12,-1,96,"946103"
183,"spotify:track:6fScgF2Y63ScU73nYju0ny","Atif Aslam, Arko","O Saathi","T-Series",58,188,62,"943863"
184,"spotify:track:5b7u3idwfY2LyqMQlCwscm","Palak Muchhal","Kaun Tujhe (From ""M.S.Dhoni - The Untold Story"")","T-Series",57,-1,7,"942866"
185,"spotify:track:4DHcnVTT87F0zZhRPYmZ3B","Miley Cyrus","Flowers","Columbia",43,166,13,"941464"
186,"spotify:track:2mCSLb0iW0XRrKDVjMzNhm","Sargi Maan, Gurjas Sidhu, Gulab Sidhu","Nakhra","Red Leaf Music",186,-1,1,"933183"
187,"spotify:track:0OfaueVeRebAfWsAHajj3z","Darshan Raval","Tera Zikr","Sony Music Entertainment India Pvt. Ltd.",172,199,10,"924196"
188,"spotify:track:2vR23BjIzpLMtzsyKrM6Mb","Kailash Kher, Paresh Kamath, Naresh Kamath","Saiyyan","Sony Music Entertainment India Pvt. Ltd.",126,153,16,"924054"
189,"spotify:track:0DXfJ2iKRDEG7rPgssWFea","Kanishk Seth, Kavita Seth","Rangisari (From ""Jugjugg Jeeyo"")","T-Series",22,-1,42,"917067"
190,"spotify:track:7tbzfR8ZvZzJEzy6v0d6el","Ritviz","Liggi","Ritviz",4,-1,113,"909167"
191,"spotify:track:0Id2IzhR3w50aP2PHfMUE3","Guri","Nira Ishq","Geet Mp3",63,-1,28,"907316"
192,"spotify:track:68EMU2RD1ECNeOeJ5qAXCV","Charlie Puth, Selena Gomez","We Don't Talk Anymore (feat. Selena Gomez)","Artist Partner",77,-1,115,"906904"
193,"spotify:track:1Ef0TmgS1QrVO6tKHrMMmH","Vishal-Shekhar, Arijit Singh, Shilpa Rao, Kumaar","Ghungroo (From ""War"")","YRF Music",1,184,163,"905677"
194,"spotify:track:0j9Y4rbP8dkNipKoCR1gva","Kaka","Shape","Sky Digital",194,-1,1,"903817"
195,"spotify:track:3NpbGCDrcQTERaZb5dHhd3","Guru Randhawa, Asees Kaur, Vishal Shelke","Nain Ta Heere (From ""Jugjugg Jeeyo"")","T-Series",104,-1,15,"901892"
