rank,uri,artist_names,track_name,source,peak_rank,previous_rank,weeks_on_chart,streams
1,"spotify:track:4VsP4Dm8gsibRxB5I2hEkw","Kaifi Khalil","Kahani Suno 2.0","1944121 Records DK",1,1,14,"7130192"
2,"spotify:track:1418IuVKQPTYqt7QNJ9RXN","King","Maan Meri Jaan","Warner Music India",1,2,23,"6719233"
3,"spotify:track:4UMIv5jd9gK98a39BQRD9X","Pritam, Arijit Singh, Amitabh Bhattacharya","Kesariya","Sony Music Entertainment India Pvt. Ltd.",1,3,36,"4533173"
4,"spotify:track:6FAYpZ4jve8vpvTwUvjK6H","Vishal-Shekhar, Arijit Singh, Sukriti Kakar, Vishal Dadlani, Shekhar Ravjiani, Kumaar","Jhoome Jo Pathaan","YRF Music",3,4,13,"4064675"
5,"spotify:track:2ZD4aIEepqZsdxPxLSuUhm","Pritam, Arijit Singh, Amitabh Bhattacharya, Nikhita Gandhi","Tere Pyaar Mein","T-Series",5,5,7,"4020451"
6,"spotify:track:3wz2vWhYnnBoFmgMkqtzLy","Chani Nattan, Inderpal Moga","Daku","Kharku Life Records",5,6,31,"3822989"
7,"spotify:track:0yCWDaAgOtg6TKlNCg9rwA","King","Tu Aake Dekhle","Warner Music India",3,7,112,"3775361"
8,"spotify:track:73K33p4Vyz9koXGqmL5eFs","Sachet Tandon, Parampara Tandon, Kumaar, Sachet-Parampara","Malang Sajna","T-Series",8,11,9,"3707679"
9,"spotify:track:2vPrBucKCfKmafHhSfJ2pt","Pritam, Arijit Singh, Amitabh Bhattacharya, Charan","Pyaar Hota Kayi Baar Hai (From ""Tu Jhoothi Main Makkaar"")","T-Series",9,10,6,"3664521"
10,"spotify:track:0CtZpaOhtzvLV3FfcsVpQo","Vishal-Shekhar, Shilpa Rao, Caralisa Monteiro, Vishal Dadlani, Shekhar Ravjiani, Kumaar","Besharam Rang (From ""Pathaan"")","YRF Music",4,8,15,"3653452"
11,"spotify:track:7oN0Wo7sCVvXPdpxoio3JM","Madhur Sharma, Swapnil Tare, Nusrat Fateh Ali Khan","Kali Kali Zulfon Ke (Lo-Fi)","T-Series",6,9,29,"3649238"
12,"spotify:track:0czcoKJbJt08NqKrvSbbz7","Pritam, Arijit Singh, Amitabh Bhattacharya","O Bedardeya (From ""Tu Jhoothi Main Makkaar"")","T-Series",12,27,2,"3544136"
13,"spotify:track:24MMjyA3NLqCsDJfsn51eg","Sharn, 40k, The Paul","Mi Amor","Desi Avenue",13,17,10,"3185166"
14,"spotify:track:08Isz2ETWSBhvIl8UpKYsp","Shubh","No Love","SHUBH",2,13,54,"3041566"
15,"spotify:track:0WtM2NBVQNNJLh6scP13H8","Rema, Selena Gomez","Calm Down (with Selena Gomez)","Mavin Records / Jonzing World",14,14,27,"2975557"
16,"spotify:track:0snQrp1VaY5Pj1YIHRJpRJ","Aditya A","Chaand Baaliyan","Sony Music Entertainment India Pvt. Ltd.",2,19,57,"2974514"
17,"spotify:track:42TMa2hgBNjte4uV7jNCnQ","Shubh, Ikky","Baller","SHUBH",2,12,28,"2966970"
18,"spotify:track:2FCXQHugkoHE1K3tiDu8pu","Alka Yagnik, Arijit Singh","Agar Tum Saath Ho (From ""Tamasha"")","T-Series",4,25,199,"2852085"
19,"spotify:track:54ipXppHLA8U4yqpOFTUhr","Imagine Dragons","Bones","Kid Ina Korner / Interscope",15,16,16,"2775954"
20,"spotify:track:0cgwdBXXlPfXJXWf3wMs32","G. V. Prakash, Shweta Mohan","Vaa Vaathi","Aditya Music",9,18,19,"2750555"
21,"spotify:track:72zHuDxFQTjbL51qJQSA7j","Jasleen Royal, B Praak, Romy, Anvita Dutt","Ranjha (From ""Shershaah"")","Sony Music Entertainment India Pvt. Ltd.",1,22,85,"2660693"
22,"spotify:track:7MXVkk9YMctZqd1Srtv4MB","The Weeknd, Daft Punk","Starboy","Universal Republic Records",21,21,86,"2636553"
23,"spotify:track:4ZVtid5khBfDx6Co0vTUE6","Jassa Dhillon, thiarajxtt","SPAIN","Jassa Dhillon",14,15,8,"2620430"
24,"spotify:track:0MbOLfDcGk8ROHJYXJHu5c","Badshah, Karan Aujla, Devika Badyal","Players","Universal Music India Pvt Ltd.",7,23,13,"2612292"
25,"spotify:track:2rOnSn2piaqLAlYjtfUBlY","Tanishk Bagchi, Jubin Nautiyal, Asees Kaur","Raataan Lambiyan (From ""Shershaah"")","Sony Music Entertainment India Pvt. Ltd.",1,29,86,"2607363"
26,"spotify:track:03yKEFruN3BS2coglBtt2N","Laddi Chahal, Parmish Verma, Gurlez Akhtar","Rubicon Drill","Parmish Verma Films",20,20,14,"2605566"
27,"spotify:track:0zlGnseLGzRIBA0TJcb3Bo","Yohani, Jubin Nautiyal, Tanishk Bagchi, Rashmi Virag, Surya Ragunaathan","Manike (From ""Thank God"")","T-Series",2,26,27,"2535600"
28,"spotify:track:1Y3LN4zO1Edc2EluIoSPJN","Stephen Sanchez, Em Beihold","Until I Found You (with Em Beihold) - Em Beihold Version","Republic Records",28,32,16,"2403488"
29,"spotify:track:5iCY0TXNImK4hyKfcplQsg","Anuv Jain","Baarishein","Universal Music India Pvt. Ltd. (on behalf of Anuv Jain)",25,34,97,"2386621"
30,"spotify:track:7gFzBppKTiKAs38SWOjbO6","Vilen","Kyun Dhunde - 1 Min Music","Universal Music India Pvt Ltd.",22,28,21,"2350447"
31,"spotify:track:29m79w9xPMH4YCD6r8JSmV","AP Dhillon, Gurinder Gill, Intense","Excuses","RUN-UP RECORDS",1,30,74,"2315494"
32,"spotify:track:3oWv5qDKYN7MH6FdlglMN5","Guru Randhawa, Sanjoy","Moon Rise","T-Series",18,24,14,"2242795"
33,"spotify:track:3yV2c3cYhkAwSsxAq6nRiv","Gajendra Verma","Mann Mera","Sony Music / Eros Now Music",33,47,105,"2201320"
34,"spotify:track:0uk9sQ7MjK0CdAUinD4xBV","MC STAN","Ek Din Pyaar","MC Stan",21,31,18,"2200424"
35,"spotify:track:7lvDsmTRXFE3dK4OjvRiWB","Shae Gill, Ali Sethi","Pasoori","Giraffe Pakistan",1,36,57,"2116474"
36,"spotify:track:0tgVpDi06FyKpA1z0VMD4v","Ed Sheeran","Perfect","Atlantic Records UK",35,35,153,"2110747"
37,"spotify:track:1y1rQTkWmrZdJmjwuK07GC","Vishal Mishra","Kaise Hua (From ""Kabir Singh"")","T-Series",5,56,197,"2102230"
38,"spotify:track:0NapkeC45rszeuSgbvcjx4","King, Nick Jonas","Maan Meri Jaan (Afterlife)","Warner Music India",38,135,2,"2081138"
39,"spotify:track:1LbBOhicFmu7ktJqIHCELt","Thalapathy Vijay, M.M.Manasi, Thaman S","Ranjithame (From ""Varisu"")","T-Series",9,55,20,"2071242"
40,"spotify:track:0NZPBYD5qbEWRs3PrGiRkT","Sam Smith, Kim Petras","Unholy (feat. Kim Petras)","Capitol Records UK / EMI",6,33,25,"2047574"
41,"spotify:track:1t39FBb0zsKv5krZaqZKCB","Pritam, Amitabh Bhattacharya, Sunidhi Chauhan, Shashwat Singh","Show Me The Thumka (From ""Tu Jhoothi Main Makkaar"")","T-Series",41,45,3,"2017723"
42,"spotify:track:7eQl3Yqv35ioqUfveKHitE","Pritam, Mohit Chauhan","Tum Se Hi","T-Series",42,44,157,"2011640"
43,"spotify:track:2AilvPt1AQ8PixlCKqkjfj","Shubh","Elevated","SHUBH",27,38,64,"2008797"
44,"spotify:track:5urYiIXu1ZhfMAOsp7WDTc","Yasser Desai, Neha Kakkar, Rajat Nagpal","Dil Ko Karaar Aaya (From ""Sukoon"")","Desi Music Factory",3,59,96,"1999850"
45,"spotify:track:1smFN2CLqGROu0J0UyvDfL","Pritam, Arijit Singh","Shayad","Sony Music Entertainment India Pvt. Ltd.",1,48,166,"1988753"
46,"spotify:track:6TClJ8jXi3OBV7gcrU3jx5","AP Dhillon, Gurinder Gill","TERE TE","RUN-UP RECORDS",7,50,70,"1917000"
47,"spotify:track:6ZYxNjuAU9Vy3VtF6W1dtE","Shubh","We Rollin","SHUBH",10,37,69,"1910023"
48,"spotify:track:2eAvDnpXP5W0cVtiI0PUxV","Ruth B.","Dandelions","Columbia",14,49,69,"1885448"
49,"spotify:track:7fRIo7WyDxXn3r233GCcdL","Thaman S, Anirudh Ravichander, Jonita Gandhi","Jimikki Ponnu","T-Series",37,43,12,"1885081"
50,"spotify:track:4bD9z9qa4qg9BhryvYWB7c","Pritam, Tochi Raina, Rekha Bhardwaj","Kabira","T-Series",50,65,184,"1869851"
51,"spotify:track:5IgjP7X4th6nMNDh4akUHb","Chris Brown","Under The Influence","Chris Brown Entertainment/RCA Records",7,52,32,"1848322"
52,"spotify:track:561jH07mF1jHuk7KlaeF0s","Eminem","Mockingbird","Aftermath",24,40,16,"1840123"
53,"spotify:track:5G7pZ8G8NFvS1MQ9H4L7dC","Javed-Mohsin, Arijit Singh, Shreya Ghoshal, Kunaal Vermaa, Prashant Ingole","Pal","Sony Music Entertainment India Pvt. Ltd.",44,81,211,"1831665"
54,"spotify:track:59eeV0SIeyd431uyjAWCRe","G. V. Prakash, Shweta Mohan","Mastaaru Mastaaru","Aditya Music",48,60,5,"1792301"
55,"spotify:track:5O2P9iiztwhomNh8xkR9lJ","One Direction","Night Changes","Syco Music",22,53,97,"1791512"
56,"spotify:track:1aL9518P5G72N92b48tuKw","AP Dhillon","Summer High","RUN-UP RECORDS",3,51,33,"1777777"
57,"spotify:track:2Fv2injs4qAm8mJBGaxVKU","Arijit Singh, Mithoon","Tujhe Kitna Chahne Lage (From ""Kabir Singh"")","T-Series",2,106,199,"1735949"
58,"spotify:track:6udC4b4jOSnHb9ItnXgKLR","Sachin-Jigar, Shreya Ghoshal, Tochi Raina","Saibo","Sony Music Entertainment India Pvt. Ltd.",58,63,125,"1729399"
59,"spotify:track:2tjWCe2W7sgvS3C8NHcdtI","Akhil, Dhvani Bhanushali, Kunaal Vermaa","Duniyaa (From ""Luka Chuppi"")","T-Series",1,75,213,"1698271"
60,"spotify:track:26b3oVLrRUaaybJulow9kz","Libianca","People","5K Records Limited",35,46,8,"1695279"
61,"spotify:track:37F0uwRSrdzkBiuj0D5UHI","The Weeknd","Reminder","Universal Republic Records",61,69,4,"1694078"
62,"spotify:track:3k9PtGmPNnQtt32TKWm6f3","MC STAN","Basti Ka Hasti","MC Stan",35,54,24,"1685091"
63,"spotify:track:4SJMuaIYcBS8ke96lDYOsw","Karan Aujla","On Top","Karan Aujla Music",17,41,17,"1657919"
64,"spotify:track:2GXXZFUxYg2LvG8SR0byOE","Atif Aslam","Jeena Jeena","Eros Now Music",64,71,91,"1649918"
65,"spotify:track:0ojpEubhy4JNeVftmVuiN7","Vishal Mishra, Armaan Malik","Pehla Pyaar","T-Series",11,68,95,"1647976"
66,"spotify:track:6FrihRowEuYfNehH0zcx0e","DG IMMORTALS, Raga, Harjas Harjaayi, VIRTUAL_AF, DARK HORSE","KALESHI CHORI","Universal Music India Pvt Ltd.",10,61,12,"1638971"
67,"spotify:track:5W7DOVGQLTigu09afW7QMT","Sidhu Moose Wala","295","Sidhu Moose Wala",1,62,58,"1628470"
68,"spotify:track:32LKwbmh6yVsWoRRF8DIvf","Pav Dharia","Na Ja","Ishtar-White Hill Music",35,74,72,"1609779"
69,"spotify:track:567e29TDzLwZwfDuEpGTwo","The Kid LAROI, Justin Bieber","STAY (with Justin Bieber)","Columbia",1,67,89,"1578019"
70,"spotify:track:3GCwsB2loRGeUL8oq2Y4TW","Ram Miriyala, Dhee, Santhosh Narayanan, Kasarla Shyam","Chamkeela Angeelesi (From ""Dasara"")","Saregama",70,110,2,"1569997"
71,"spotify:track:7AsG1F1eMWd17RYan8M3Wm","AP Dhillon, Shinda Kahlon","Dil Nu","RUN-UP RECORDS",71,96,24,"1551817"
72,"spotify:track:6rFckZb1cuJYzsZiGHgqks","Karan Aujla, Ikky","52 Bars","Rehaan Records",12,39,7,"1540117"
73,"spotify:track:1a8w8nlIyIhE2W1HIayKnl","Amit Trivedi, Amitabh Bhattacharya, Sireesha Bhagavatula","Ghodey Pe Sawaar (From ""Qala"")","Sony Music Entertainment India Pvt. Ltd. / Netflix Music Inc.",11,64,13,"1539451"
74,"spotify:track:0dLbrlAVPPjpPqnYfmJsWk","Atif Aslam, Alisha Chinai, Pritam","Tera Hone Laga Hoon","Tips Industries Ltd",74,103,97,"1527939"
75,"spotify:track:6FjbAnaPRPwiP3sciEYctO","Pritam, Arijit Singh","Raabta","T-Series",74,79,43,"1522779"
76,"spotify:track:6H7fLdt0AeWpuxUKXuXWrx","Hariharan","Shree Hanuman Chalisa","T-Series",76,82,32,"1522198"
77,"spotify:track:6TK7jseRCrogw9IzQYkw2h","Silambarasan TR, Thaman S","Thee Thalapathy (From ""Varisu"")","T-Series",11,72,16,"1512069"
78,"spotify:track:3H3x4NhR3wJh6IvRHmPvkd","Thaman S, Srivardhani Kuchi, Aditi, Satya Yamini, Roshini, Tejaswini","Tum Tum (From ""Enemy"")","Divo",35,77,41,"1501202"
79,"spotify:track:3ZGJhN4unVspOqpwGvUL2W","Diljit Dosanjh","Lemonade","DILJIT DOSANJH",33,73,34,"1494467"
80,"spotify:track:7E0A86Yhc0ZyOl6aAPE5wN","Tanishk Bagchi, Anu Malik, Abhijeet","Main Khiladi - From ""Selfiee""","Desi Music Factory",44,70,7,"1480721"
81,"spotify:track:3wwLWFRLiReDf5AqgmAJwT","Rito Riba, Rajat Nagpal, Rana Sotal","Heer Ranjha","PlayDMF",11,78,22,"1468952"
82,"spotify:track:6biqkuWq069vByAEeGxZlr","Shubh","Her","SHUBH",30,57,16,"1462273"
83,"spotify:track:7ouBSPZKQpm7zQz2leJXta","Arijit Singh","Tum Hi Ho (From ""Aashiqui 2"")","T-Series",78,91,112,"1437831"
84,"spotify:track:7mSzDKajY2wUtstQSLdzMK","Mohit Chauhan, Rochak Kohli","Rang Lageya","Saregama",84,88,8,"1429562"
85,"spotify:track:2PvaburAUlhNHxVhw5lvOq","Arijit Singh","Humdard (From ""Ek Villain"")","T-Series",85,122,140,"1420877"
86,"spotify:track:1eHkjvvyncnmjgwCSGI0el","Emiway Bantai","Company","Bantai Studio",76,76,5,"1417472"
87,"spotify:track:3nKQrVVlwbAQSnFbgZWdN0","Avvy Sra, Karan Aujla, Jaani","White Brown Black","Universal Music India Pvt Ltd. – Distribution",49,58,14,"1397083"
88,"spotify:track:7x4jPB2jvTeIXms30ak5W8","Raka","Amli Anthem","Raka",88,-1,1,"1392357"
89,"spotify:track:0rMeOAvbQZ2RTG4B6L1M4p","Darshan Raval","Asal Mein","Indie Music Label",21,102,95,"1385496"
90,"spotify:track:02MWAaffLxlfxAUY7c5dvx","Glass Animals","Heat Waves","Polydor Records",3,80,88,"1384770"
91,"spotify:track:4DHcnVTT87F0zZhRPYmZ3B","Miley Cyrus","Flowers","Columbia",43,115,9,"1380337"
92,"spotify:track:2qxmye6gAegTMjLKEBoR3d","Alec Benjamin","Let Me Down Slowly","2018",34,84,154,"1367183"
93,"spotify:track:2QophXhN2Ls2URfoPmiviC","Taaruk Raina, Mismatched - Cast","Kho Gaye","Netflix Music",8,105,23,"1356585"
94,"spotify:track:60YICjIPdL7LDBcCMK0tAk","Sidhu Moose Wala, Sunny Malton, The Kidd","Levels","Sidhu Moose Wala",8,85,43,"1352980"
95,"spotify:track:1eIf4HuGZMBbXpP6mh04Ry","Salman SV","Sv l O Re piya","Salman SV",83,83,4,"1342741"
96,"spotify:track:5pebgx4IJ5YvZH2sYOHDRf","Barney Sku, Taqiya Zaman","Your Eyes","Barney Sku",90,90,9,"1331971"
97,"spotify:track:58HvfVOeJY7lUuCqF0m3ly","Elley Duhé","MIDDLE OF THE NIGHT","Not Fit For Society/RCA Records",12,89,64,"1329323"
98,"spotify:track:0VjIjW4GlUZAMYd2vXMi3b","The Weeknd","Blinding Lights","Republic Records",4,93,173,"1321232"
99,"spotify:track:2nKwKOpdXnHuJgC5iItUxN","Harris Jayaraj, Rohini, Pritt, dilushselva","Unakkul Naane","Ayngaran",51,94,12,"1320835"
100,"spotify:track:4Dvkj6JhhA12EX05fT7y2e","Harry Styles","As It Was","Columbia",5,92,51,"1317876"
101,"spotify:track:2tMoOS9grHtn4upzb4LwMG","Dhibu Ninan Thomas, Kapil Kapilan","Adiye - From ""Bachelor""","Think Music",16,97,68,"1313746"
102,"spotify:track:0pqnGHJpmpxLKifKRmU6WP","Imagine Dragons","Believer","Kid Ina Korner / Interscope",25,99,213,"1304971"
103,"spotify:track:3APdIdF8H0jsxSuGOqXedS","Rashid Ali","Kabhi Kabhi Aditi","T-Series",73,123,71,"1302118"
104,"spotify:track:3jyqXdAjwqO3gFtjnYrbq9","Darshan Raval, Rochak Kohli","Ek Ladki Ko Dekha Toh Aisa Laga (From ""Ek Ladki Ko Dekha Toh Aisa Laga"")","Saregama",104,138,18,"1301560"
105,"spotify:track:6V7UVqe8XnAS4WPdpaw5TK","Asees Kaur, Stebin Ben","Tu Mile Dil Khile","Saregama",20,119,9,"1293212"
106,"spotify:track:4SqPZorSDuUtvdJwVGeZRC","Pritam, Arijit Singh, Amitabh Bhattacharya, Jonita Gandhi","Deva Deva","Sony Music Entertainment India Pvt. Ltd.",5,117,33,"1292783"
107,"spotify:track:4LK8863ScRhhT6hitFfBI5","Santhosh Narayanan, Pradeep, Priya Hemesh","Aval","Sony Music Entertainment India Pvt. Ltd.",107,118,4,"1290291"
108,"spotify:track:3gOXq3FPPesm7VLPKmef6j","Arijit Singh, Shashaa Tirupati","Rait Zara Si","T-Series",12,108,68,"1286516"
109,"spotify:track:59hBR0BCtJsfIbV9VzCVAp","Jimin","Set Me Free Pt.2","BIGHIT MUSIC",109,-1,1,"1285503"
110,"spotify:track:4blqlsA1uf2d2I40E90EUC","Pritam, Arijit Singh, Shilpa Rao","Tere Hawaale (From ""Laal Singh Chaddha"")","T-Series",110,179,4,"1282112"
111,"spotify:track:45C7tXCrmp3R5E65XUtLLj","Tanishk Bagchi, Faridkot, Yohani, Amar Jalal, Harjot Kaur","Jehda Nasha (From ""An Action Hero"")","T-Series",27,107,18,"1279815"
112,"spotify:track:2J2Z1SkXYghSajLibnQHOa","Sia","Unstoppable","Monkey Puzzle Records/RCA Records",16,104,86,"1272634"
113,"spotify:track:5si4xdFplkXAydKfFe1xXa","Karan Aujla, Ikky","Take It Easy","Rehaan Records",34,66,7,"1272609"
114,"spotify:track:0QT9B8Yfrz0vi66oXMrKJg","Pritam, Amitabh Bhattacharya, Neeraj Shridhar, Abhijit Vaghani, Ashish Pandit","Character Dheela 2.0 (From ""Shehzada"")","T-Series",55,111,6,"1272300"
115,"spotify:track:0FBQ4NrrHUbR9kus7rzrOj","Atif Aslam","Dil Diyan Gallan","YRF Music",82,120,162,"1268880"
116,"spotify:track:7qiZfU4dY1lWllzX7mPBI3","Ed Sheeran","Shape of You","Atlantic Records UK",63,98,150,"1266668"
117,"spotify:track:5XeFesFbtLpXzIVDNQP22n","Arctic Monkeys","I Wanna Be Yours","Domino Recording Co",110,116,19,"1266013"
118,"spotify:track:4wIWWEhbdgKAxhR68eE0Ye","Arijit Singh, Chinmayi","Mast Magan (From ""2 States"")","T-Series",75,121,109,"1259589"
119,"spotify:track:0rk2X5TAhraBC5aCIXK2Rq","Jawad Ahmad, Shaarib Toshi, Arijit Singh, Shreya Ghoshal","Samjhawan","Sony Music Entertainment India Pvt. Ltd.",70,127,99,"1259343"
120,"spotify:track:6tkl6rjuXWtVOCaXSSSCz2","Armaan Malik","Jab Tak (From ""M.S.Dhoni - The Untold Story"")","T-Series",37,114,45,"1259180"
121,"spotify:track:2RgvvnMwtP0R2OkVZmFvnV","KK","Ajab Si (From ""Om Shanti Om"")","T-Series",46,101,63,"1250857"
122,"spotify:track:3JkVYvxNoGf2HCWJo61462","Sidhu Moose Wala, Sunny Malton, SOE","Never Fold","Sidhu Moose Wala",13,87,48,"1230795"
123,"spotify:track:57jOEZtoLQK4zF2x55bdkp","Rochak Kohli, Arijit Singh, Neha Kakkar","Tu Hi Yaar Mera (From ""Pati Patni Aur Woh"")","T-Series",8,181,170,"1228212"
124,"spotify:track:4OcvkkpF3xmyCGGY5IBlgi","Akhil Sachdeva, Tulsi Kumar","Tera Ban Jaunga (From ""Kabir Singh"")","T-Series",4,158,188,"1225643"
125,"spotify:track:0o9zmvc5f3EFApU52PPIyW","Fujii Kaze","Shinunoga E-Wa","Universal Music LLC",42,95,21,"1221339"
126,"spotify:track:3uCmVdJNi3Ci4bidF0mdHb","Paradox","Jaadugar","T-Series",13,100,24,"1217059"
127,"spotify:track:1hQia6rxgfM1ly2hE3StWp","Vishal-Shekhar, Salim Merchant, Neeti Mohan, Shekhar Ravjiani","Ishq Wala Love","Sony Music Entertainment India Pvt. Ltd.",101,128,32,"1216560"
128,"spotify:track:3qrdLVOClRU4yPkcXZ7c5u","Ayushmann Khurrana, Tanishk-Vayu","Mere Liye Tum Kaafi Ho (From ""Shubh Mangal Zyada Saavdhan"")","T-Series",11,141,161,"1208022"
129,"spotify:track:1L3Nsi7YXtBxTdnbqektia","Darshan Raval","Hawa Banke","Indie Music Label",26,168,40,"1192563"
130,"spotify:track:0UZLaEOSIc5kg0cc7eszqC","Vishal Mishra","Manjha","Desi Music Factory",53,165,43,"1185619"
131,"spotify:track:2y0hUGvHaKm2p5xmJF4HBe","Arijit Singh","Saware (From ""Phantom"")","T-Series",131,146,6,"1181218"
132,"spotify:track:7FVgT8XjxUSfKuZuHxg316","Prince Narula, Munawar Faruqui, Rony Ajnali","Todh","EYP Creations",22,86,16,"1176254"
133,"spotify:track:6bdpj89aYEBjhpsenXAsmO","A.R. Rahman, Arijit Singh","Enna Sona","Sony Music Entertainment India Pvt. Ltd.",34,124,98,"1173709"
134,"spotify:track:6VhuP99TE6gYNQRJIlAWFD","Stephen Sanchez","Until I Found You","Republic Records",20,113,47,"1160529"
135,"spotify:track:4W4fNrZYkobj539TOWsLO2","The Weeknd, Ariana Grande","Die For You (with Ariana Grande) - Remix","XO / Republic Records",30,42,4,"1153686"
136,"spotify:track:5O932cZmzOZGOGZz9RHx20","Pritam, Arijit Singh","Khairiyat","T-Series",1,148,185,"1148312"
137,"spotify:track:3HiobOOpSpMsi95WBKPBYk","Jeet Gannguli, Arijit Singh","Hamari Adhuri Kahani (Title Track)","Sony Music Entertainment India Pvt. Ltd.",130,130,71,"1145989"
138,"spotify:track:7B4uYqxTpTOS1sgxFB9Ann","Sidhu Moose Wala, Wazir Patar","The Last Ride","Sidhu Moose Wala",3,112,45,"1145951"
139,"spotify:track:2l3dFxtoSMgMQVyRIUHjpz","Mitraz","Akhiyaan","Mitraz Records",23,160,47,"1143075"
140,"spotify:track:6yvxu91deFKt3X1QoV6qMv","Anirudh Ravichander, Jonita Gandhi","Arabic Kuthu - Halamithi Habibo (From ""Beast"")","Sun Pictures",2,132,58,"1138909"
141,"spotify:track:7cWnks0lsRtpAi87COOiXK","Salim–Sulaiman, Rahat Fateh Ali Khan, Jaideep Sahni","O Re Piya","YRF Music",95,136,31,"1126768"
142,"spotify:track:0GQngE2rOYvlKwEQjTAsP8","Pritam, Sreeram, Shilpa Rao","Subhanallah","T-Series",126,126,30,"1124935"
143,"spotify:track:3jtKSUiVDowKNBqVQbWaig","Amit Trivedi, Kavita Seth, Amitabh Bhattacharya","Iktara","Sony Music Entertainment India Pvt. Ltd.",73,-1,46,"1124672"
144,"spotify:track:0gPgdRfB4jdGrlyXS0Vx78","Vishal-Shekhar, KK, Shilpa Rao, Anvita Dutt Guptan","Khuda Jaane","YRF Music",37,-1,29,"1121813"
145,"spotify:track:1UWacd8x8tPPwmrPB1MoBI","Pritam, Arijit Singh","Ae Dil Hai Mushkil Title Track","Sony Music Entertainment India Pvt. Ltd.",105,157,164,"1121001"
146,"spotify:track:1ccZZf0IQi5y0bHMl2aGDF","Sanam","Gulabi Aankhen","Universal Music India Pvt Ltd.",103,149,29,"1117950"
147,"spotify:track:3cjA9xteIeOj82os8oSo4i","Juss, MixSingh","Safar","Mix It Up Studio",75,140,17,"1114295"
148,"spotify:track:6v3KW9xbzN5yKLt9YKDYA2","Shawn Mendes, Camila Cabello","Señorita","Island Records",1,147,196,"1113924"
149,"spotify:track:1Nr46gjiP50uPsz30gYhAd","Santhosh Narayanan, Anirudh Ravichander","Thenmozhi (From ""Thiruchitrambalam"")","Sun Pictures",5,139,32,"1110383"
150,"spotify:track:2vR23BjIzpLMtzsyKrM6Mb","Kailash Kher, Paresh Kamath, Naresh Kamath","Saiyyan","Sony Music Entertainment India Pvt. Ltd.",126,142,12,"1109544"
151,"spotify:track:1yYM7dY6wSJFp5qmxPRLu1","Atif Aslam, Chinmayi, Pritam","Main Rang Sharbaton Ka","Tips Industries Ltd",151,-1,1,"1101265"
152,"spotify:track:14WLGWYd2wxho2cnDkLTBF","Anirudh Ravichander, Leon James, Kasarla Shyam","Gundellonaa (From ""Ori Devuda"")","Saregama",47,129,21,"1100648"
153,"spotify:track:2IoZMG3RqiTmsy7Li3zGFg","Sachet Tandon, Parampara Tandon, Sachet-Parampara","Mere Sohneya (From ""Kabir Singh"")","T-Series",4,183,153,"1100059"
154,"spotify:track:2FZDNh6tm9mkZ9vTphuAh8","Pritam, Tanishk Bagchi, Neeraj Shridhar","Bhool Bhulaiyaa 2 Title Track","T-Series",7,159,47,"1099198"
155,"spotify:track:6XYQvYJzHjK5150Vl7NKfJ","Sid Sriram, Sreejith Edavana","Kaadhal En Kaviye - From ""Salmon 3D""","MRT Music",8,144,41,"1096049"
156,"spotify:track:0NvGVd87SYZnryTcfQPKUO","Madhur Sharma","Kali Kali Zulfon Ke","Pearl Records",61,151,42,"1089370"
157,"spotify:track:4sRcdrQrFilYpMIybCwgKU","Ali Azmat","Yeh Jism","T-Series",157,-1,2,"1089118"
158,"spotify:track:6DefzsWqnwrFrmNVnJxWkS","Asim Azhar","Jo Tu Na Mila","Universal Music India Pvt Ltd.",89,134,34,"1088574"
159,"spotify:track:2dHHgzDwk4BJdRwy9uXhTO","Metro Boomin, The Weeknd, 21 Savage","Creepin' (with The Weeknd & 21 Savage)","Republic Records",142,156,12,"1085385"
160,"spotify:track:7mNZUnDWUDidWBFaUpVtOC","Vilen","Chidiya","Universal Music India Pvt Ltd.",4,137,139,"1078768"
161,"spotify:track:3sqRODOZ1Z6hR4F2tnFAlg","Maninder Buttar","Sakhiyaan","White Hill Music",20,154,197,"1077936"
162,"spotify:track:6cUOiOY5qh2FpIQWIYAd2h","Pritam, Darshan Raval, Antara Mitra","Mehrama","Sony Music Entertainment India Pvt. Ltd.",10,170,121,"1076942"
163,"spotify:track:0s76ExpXyMGVBlKLUr683e","Aditya Rikhari","Faasle","CollabX Productions",123,145,7,"1074774"
164,"spotify:track:6NwEpX2JUWHVKWfDDfcqC4","Anirudh Ravichander, Ajesh","Idhazhin Oram - The Innocence of Love","Sony Music Entertainment India Pvt. Ltd.",143,143,6,"1072993"
165,"spotify:track:1ZiReD9pPTttQWwSoYqdyH","Dikshant","Aankhon Se Batana","Sony Music Entertainment India Pvt. Ltd.",38,177,48,"1070053"
166,"spotify:track:6gwnKOvdBKkTU4CQ7KpIAu","Shaarib Toshi, Arijit Singh","Bandeya - From ""Dil Juunglee""","Pooja Music",107,153,34,"1067694"
167,"spotify:track:7d4ZrG3Cer7jbqIl6wOI6D","Tyson Sidhu","GODSPEED","Game Time",79,109,18,"1061634"
168,"spotify:track:2LBqCSwhJGcFQeTHMVGwy3","The Weeknd","Die For You","Universal Republic Records",137,173,7,"1059997"
169,"spotify:track:1nvvaiJbrhCkM3Az74N1pM","Jasleen Royal, Prerna Arora, Ashwani Basoya","Ranjha - Sid X Kiara Version","Sony Music Entertainment India Pvt. Ltd.",161,161,2,"1055686"
170,"spotify:track:4iKGu3xtvm90eBw0EIPWJP","Vishal Mishra, Rahul Sipligunj","Naacho Naacho (From ""Rrr"")","T-Series",23,125,34,"1054536"
171,"spotify:track:2NTVtNcpC0i1R7LVGaCZCF","Badshah, Nikhita Gandhi","Jugnu","Universal Music India Pvt Ltd.",5,-1,70,"1053353"
172,"spotify:track:4iFPsNzNV7V9KJgcOX7TEO","Atif Aslam, Pritam","Tu Jaane Na","Tips Industries Ltd",108,180,100,"1051396"
173,"spotify:track:5OMUXgfXsSukZ0zxelpC3b","A.R. Rahman, Jaswinder Singh, Shiraz Uppal","Raanjhanaa","Sony Music Entertainment India Pvt. Ltd.",144,163,22,"1049051"
174,"spotify:track:3UhmuWcFaLS3AO3kI9ynQ2","AP Dhillon, Shinda Kahlon, Gurinder Gill, Gminxr","Insane","RUN-UP RECORDS",3,150,101,"1043845"
175,"spotify:track:0l6g8Z8mqGbGXFOjigYetD","Pritam, Arijit Singh","Hawayein","Sony Music Entertainment India Pvt. Ltd.",51,197,76,"1034191"
176,"spotify:track:2ZRo7axmMPeSVUvDbGkJah","XXXTENTACION","Hope","Bad Vibes Forever, LLC",44,162,95,"1030795"
177,"spotify:track:0EH7sgeiFqDa3eS7ieW2zs","Akon, Hamsika Iyer","Chammak Challo","T-Series",121,191,6,"1030512"
178,"spotify:track:0NLkVxf0PyxsXBG3EuZcJf","Anuv Jain","Gul","Universal Music India Pvt. Ltd. (on behalf of Anuv Jain)",76,131,27,"1028017"
179,"spotify:track:5WncH5iZ5GFlnXm7jKEXVP","Pritam, KK","Labon Ko","T-Series",85,-1,4,"1026968"
180,"spotify:track:5yjh1Y7lt6lx0nPslNz3H0","Sanatan Sangeet","Ram Siya Ram - Remastered 2023","Sanatan Sangeet",77,-1,3,"1021144"
181,"spotify:track:4JvziZ2kQsbzfvRQtpYfmJ","Sunny Yaduvanshi, AK Rok, Nitesh Ujoli","Yadav Brand 2","Flame Music",181,198,2,"1016646"
182,"spotify:track:3Kl8p2PxVf8eAayLwTxOIm","Pritam, KK","Dil Ibaadat","Sony Music Entertainment India Pvt. Ltd.",54,-1,8,"1012138"
183,"spotify:track:58SIEtTjWErr0yEXVBKxvd","Jubin Nautiyal","Shri Krishna Govind Hare Murari","T-Series",124,167,5,"1010451"
184,"spotify:track:43YkTTlOD203o9E5ZxhUjF","Arijit Singh","Main Dhoondne Ko Zamaane Mein (From ""Heartless"")","T-Series",62,174,84,"1007727"
185,"spotify:track:0tpwqQhdfJXRcUDSNRjb9O","Arijit Singh, Neeti Mohan, Rashmi Virag","Mere Yaaraa (From ""Sooryavanshi"")","T-Series",20,-1,69,"1006669"
186,"spotify:track:6zJejIfVYLgjud3lTk4DLB","Rosa Linn","SNAP","Columbia",93,152,27,"1003898"
187,"spotify:track:1E16f7KcZmuXuhlenRwA2m","VIBIE","Saibo - Lofi Flip","Sony Music Entertainment India Pvt. Ltd.",103,-1,16,"1003226"
188,"spotify:track:0DXfJ2iKRDEG7rPgssWFea","Kanishk Seth, Kavita Seth","Rangisari (From ""Jugjugg Jeeyo"")","T-Series",22,169,41,"1001184"
189,"spotify:track:7fW9J3EpVWVN1ouv0slAs0","KK","Kya Mujhe Pyar Hai (From ""Woh Lamhe"")","T-Series",42,-1,27,"996048"
190,"spotify:track:0w2wUGseVPOTjYVp3ZbBlf","Arjan Dhillon","Salute","Panj-aab Records",190,-1,1,"993692"
191,"spotify:track:1AzNN19lPYC68iacrbWL8X","Darbuka Siva, Sid Sriram","Mudhal Nee Mudivum Nee Title Track (From ""Mudhal Nee Mudivum Nee"")","Sony Music Entertainment India Pvt. Ltd.",24,171,45,"988226"
192,"spotify:track:1d5lpW3gUyq537iuyrb9Lf","Aditya Rikhari","Samjho Na","CollabX Productions",164,164,4,"979957"
193,"spotify:track:0loZn1c5heXie7OAtvK6nH","Jubin Nautiyal, Rocky - Shiv","Humnava Mere","T-Series",86,-1,99,"979816"
194,"spotify:track:6KtSNVgCmQEvDgIuHoXAkT","Azaan Sami Khan","Ik Lamha","AZEL RECORDS",36,195,37,"977111"
195,"spotify:track:1Qrg8KqiBpW07V7PNxwwwL","SZA","Kill Bill","Top Dawg Entertainment/RCA Records",133,166,10,"972530"
